{
  "address": "0xd7d3Af1Fe98fB6aCc05DC1126402dd8ea8aDe293",
  "abi": [
    {
      "inputs": [
        {
          "internalType": "contract ComptrollerInterface",
          "name": "comptroller_",
          "type": "address"
        },
        {
          "internalType": "contract InterestRateModel",
          "name": "interestRateModel_",
          "type": "address"
        },
        {
          "internalType": "uint256",
          "name": "initialExchangeRateMantissa_",
          "type": "uint256"
        },
        {
          "internalType": "string",
          "name": "name_",
          "type": "string"
        },
        {
          "internalType": "string",
          "name": "symbol_",
          "type": "string"
        },
        {
          "internalType": "uint8",
          "name": "decimals_",
          "type": "uint8"
        },
        {
          "internalType": "address payable",
          "name": "admin_",
          "type": "address"
        },
        {
          "internalType": "address",
          "name": "_pointsOperator",
          "type": "address"
        }
      ],
      "stateMutability": "nonpayable",
      "type": "constructor"
    },
    {
      "inputs": [],
      "name": "AcceptAdminPendingAdminCheck",
      "type": "error"
    },
    {
      "inputs": [
        {
          "internalType": "uint256",
          "name": "actualAddAmount",
          "type": "uint256"
        }
      ],
      "name": "AddReservesFactorFreshCheck",
      "type": "error"
    },
    {
      "inputs": [],
      "name": "BorrowCashNotAvailable",
      "type": "error"
    },
    {
      "inputs": [
        {
          "internalType": "uint256",
          "name": "errorCode",
          "type": "uint256"
        }
      ],
      "name": "BorrowComptrollerRejection",
      "type": "error"
    },
    {
      "inputs": [],
      "name": "BorrowFreshnessCheck",
      "type": "error"
    },
    {
      "inputs": [
        {
          "internalType": "uint256",
          "name": "errorCode",
          "type": "uint256"
        }
      ],
      "name": "LiquidateAccrueBorrowInterestFailed",
      "type": "error"
    },
    {
      "inputs": [
        {
          "internalType": "uint256",
          "name": "errorCode",
          "type": "uint256"
        }
      ],
      "name": "LiquidateAccrueCollateralInterestFailed",
      "type": "error"
    },
    {
      "inputs": [],
      "name": "LiquidateCloseAmountIsUintMax",
      "type": "error"
    },
    {
      "inputs": [],
      "name": "LiquidateCloseAmountIsZero",
      "type": "error"
    },
    {
      "inputs": [],
      "name": "LiquidateCollateralFreshnessCheck",
      "type": "error"
    },
    {
      "inputs": [
        {
          "internalType": "uint256",
          "name": "errorCode",
          "type": "uint256"
        }
      ],
      "name": "LiquidateComptrollerRejection",
      "type": "error"
    },
    {
      "inputs": [],
      "name": "LiquidateFreshnessCheck",
      "type": "error"
    },
    {
      "inputs": [],
      "name": "LiquidateLiquidatorIsBorrower",
      "type": "error"
    },
    {
      "inputs": [
        {
          "internalType": "uint256",
          "name": "errorCode",
          "type": "uint256"
        }
      ],
      "name": "LiquidateRepayBorrowFreshFailed",
      "type": "error"
    },
    {
      "inputs": [
        {
          "internalType": "uint256",
          "name": "errorCode",
          "type": "uint256"
        }
      ],
      "name": "LiquidateSeizeComptrollerRejection",
      "type": "error"
    },
    {
      "inputs": [],
      "name": "LiquidateSeizeLiquidatorIsBorrower",
      "type": "error"
    },
    {
      "inputs": [
        {
          "internalType": "uint256",
          "name": "errorCode",
          "type": "uint256"
        }
      ],
      "name": "MintComptrollerRejection",
      "type": "error"
    },
    {
      "inputs": [],
      "name": "MintFreshnessCheck",
      "type": "error"
    },
    {
      "inputs": [
        {
          "internalType": "uint256",
          "name": "errorCode",
          "type": "uint256"
        }
      ],
      "name": "RedeemComptrollerRejection",
      "type": "error"
    },
    {
      "inputs": [],
      "name": "RedeemFreshnessCheck",
      "type": "error"
    },
    {
      "inputs": [],
      "name": "RedeemTransferOutNotPossible",
      "type": "error"
    },
    {
      "inputs": [],
      "name": "ReduceReservesAdminCheck",
      "type": "error"
    },
    {
      "inputs": [],
      "name": "ReduceReservesCashNotAvailable",
      "type": "error"
    },
    {
      "inputs": [],
      "name": "ReduceReservesCashValidation",
      "type": "error"
    },
    {
      "inputs": [],
      "name": "ReduceReservesFreshCheck",
      "type": "error"
    },
    {
      "inputs": [
        {
          "internalType": "uint256",
          "name": "errorCode",
          "type": "uint256"
        }
      ],
      "name": "RepayBorrowComptrollerRejection",
      "type": "error"
    },
    {
      "inputs": [],
      "name": "RepayBorrowFreshnessCheck",
      "type": "error"
    },
    {
      "inputs": [],
      "name": "SetComptrollerOwnerCheck",
      "type": "error"
    },
    {
      "inputs": [],
      "name": "SetInterestRateModelFreshCheck",
      "type": "error"
    },
    {
      "inputs": [],
      "name": "SetInterestRateModelOwnerCheck",
      "type": "error"
    },
    {
      "inputs": [],
      "name": "SetPendingAdminOwnerCheck",
      "type": "error"
    },
    {
      "inputs": [],
      "name": "SetReserveFactorAdminCheck",
      "type": "error"
    },
    {
      "inputs": [],
      "name": "SetReserveFactorBoundsCheck",
      "type": "error"
    },
    {
      "inputs": [],
      "name": "SetReserveFactorFreshCheck",
      "type": "error"
    },
    {
      "inputs": [
        {
          "internalType": "uint256",
          "name": "errorCode",
          "type": "uint256"
        }
      ],
      "name": "TransferComptrollerRejection",
      "type": "error"
    },
    {
      "inputs": [],
      "name": "TransferNotAllowed",
      "type": "error"
    },
    {
      "inputs": [],
      "name": "TransferNotEnough",
      "type": "error"
    },
    {
      "inputs": [],
      "name": "TransferTooMuch",
      "type": "error"
    },
    {
      "anonymous": false,
      "inputs": [
        {
          "indexed": false,
          "internalType": "uint256",
          "name": "cashPrior",
          "type": "uint256"
        },
        {
          "indexed": false,
          "internalType": "uint256",
          "name": "interestAccumulated",
          "type": "uint256"
        },
        {
          "indexed": false,
          "internalType": "uint256",
          "name": "borrowIndex",
          "type": "uint256"
        },
        {
          "indexed": false,
          "internalType": "uint256",
          "name": "totalBorrows",
          "type": "uint256"
        }
      ],
      "name": "AccrueInterest",
      "type": "event"
    },
    {
      "anonymous": false,
      "inputs": [
        {
          "indexed": true,
          "internalType": "address",
          "name": "owner",
          "type": "address"
        },
        {
          "indexed": true,
          "internalType": "address",
          "name": "spender",
          "type": "address"
        },
        {
          "indexed": false,
          "internalType": "uint256",
          "name": "amount",
          "type": "uint256"
        }
      ],
      "name": "Approval",
      "type": "event"
    },
    {
      "anonymous": false,
      "inputs": [
        {
          "indexed": false,
          "internalType": "address",
          "name": "borrower",
          "type": "address"
        },
        {
          "indexed": false,
          "internalType": "uint256",
          "name": "borrowAmount",
          "type": "uint256"
        },
        {
          "indexed": false,
          "internalType": "uint256",
          "name": "accountBorrows",
          "type": "uint256"
        },
        {
          "indexed": false,
          "internalType": "uint256",
          "name": "totalBorrows",
          "type": "uint256"
        }
      ],
      "name": "Borrow",
      "type": "event"
    },
    {
      "anonymous": false,
      "inputs": [
        {
          "indexed": false,
          "internalType": "address",
          "name": "liquidator",
          "type": "address"
        },
        {
          "indexed": false,
          "internalType": "address",
          "name": "borrower",
          "type": "address"
        },
        {
          "indexed": false,
          "internalType": "uint256",
          "name": "repayAmount",
          "type": "uint256"
        },
        {
          "indexed": false,
          "internalType": "address",
          "name": "cTokenCollateral",
          "type": "address"
        },
        {
          "indexed": false,
          "internalType": "uint256",
          "name": "seizeTokens",
          "type": "uint256"
        }
      ],
      "name": "LiquidateBorrow",
      "type": "event"
    },
    {
      "anonymous": false,
      "inputs": [
        {
          "indexed": false,
          "internalType": "address",
          "name": "minter",
          "type": "address"
        },
        {
          "indexed": false,
          "internalType": "uint256",
          "name": "mintAmount",
          "type": "uint256"
        },
        {
          "indexed": false,
          "internalType": "uint256",
          "name": "mintTokens",
          "type": "uint256"
        }
      ],
      "name": "Mint",
      "type": "event"
    },
    {
      "anonymous": false,
      "inputs": [
        {
          "indexed": false,
          "internalType": "address",
          "name": "oldAdmin",
          "type": "address"
        },
        {
          "indexed": false,
          "internalType": "address",
          "name": "newAdmin",
          "type": "address"
        }
      ],
      "name": "NewAdmin",
      "type": "event"
    },
    {
      "anonymous": false,
      "inputs": [
        {
          "indexed": false,
          "internalType": "contract ComptrollerInterface",
          "name": "oldComptroller",
          "type": "address"
        },
        {
          "indexed": false,
          "internalType": "contract ComptrollerInterface",
          "name": "newComptroller",
          "type": "address"
        }
      ],
      "name": "NewComptroller",
      "type": "event"
    },
    {
      "anonymous": false,
      "inputs": [
        {
          "indexed": false,
          "internalType": "contract InterestRateModel",
          "name": "oldInterestRateModel",
          "type": "address"
        },
        {
          "indexed": false,
          "internalType": "contract InterestRateModel",
          "name": "newInterestRateModel",
          "type": "address"
        }
      ],
      "name": "NewMarketInterestRateModel",
      "type": "event"
    },
    {
      "anonymous": false,
      "inputs": [
        {
          "indexed": false,
          "internalType": "address",
          "name": "oldPendingAdmin",
          "type": "address"
        },
        {
          "indexed": false,
          "internalType": "address",
          "name": "newPendingAdmin",
          "type": "address"
        }
      ],
      "name": "NewPendingAdmin",
      "type": "event"
    },
    {
      "anonymous": false,
      "inputs": [
        {
          "indexed": false,
          "internalType": "uint256",
          "name": "oldReserveFactorMantissa",
          "type": "uint256"
        },
        {
          "indexed": false,
          "internalType": "uint256",
          "name": "newReserveFactorMantissa",
          "type": "uint256"
        }
      ],
      "name": "NewReserveFactor",
      "type": "event"
    },
    {
      "anonymous": false,
      "inputs": [
        {
          "indexed": false,
          "internalType": "address",
          "name": "redeemer",
          "type": "address"
        },
        {
          "indexed": false,
          "internalType": "uint256",
          "name": "redeemAmount",
          "type": "uint256"
        },
        {
          "indexed": false,
          "internalType": "uint256",
          "name": "redeemTokens",
          "type": "uint256"
        }
      ],
      "name": "Redeem",
      "type": "event"
    },
    {
      "anonymous": false,
      "inputs": [
        {
          "indexed": false,
          "internalType": "address",
          "name": "payer",
          "type": "address"
        },
        {
          "indexed": false,
          "internalType": "address",
          "name": "borrower",
          "type": "address"
        },
        {
          "indexed": false,
          "internalType": "uint256",
          "name": "repayAmount",
          "type": "uint256"
        },
        {
          "indexed": false,
          "internalType": "uint256",
          "name": "accountBorrows",
          "type": "uint256"
        },
        {
          "indexed": false,
          "internalType": "uint256",
          "name": "totalBorrows",
          "type": "uint256"
        }
      ],
      "name": "RepayBorrow",
      "type": "event"
    },
    {
      "anonymous": false,
      "inputs": [
        {
          "indexed": false,
          "internalType": "address",
          "name": "benefactor",
          "type": "address"
        },
        {
          "indexed": false,
          "internalType": "uint256",
          "name": "addAmount",
          "type": "uint256"
        },
        {
          "indexed": false,
          "internalType": "uint256",
          "name": "newTotalReserves",
          "type": "uint256"
        }
      ],
      "name": "ReservesAdded",
      "type": "event"
    },
    {
      "anonymous": false,
      "inputs": [
        {
          "indexed": false,
          "internalType": "address",
          "name": "admin",
          "type": "address"
        },
        {
          "indexed": false,
          "internalType": "uint256",
          "name": "reduceAmount",
          "type": "uint256"
        },
        {
          "indexed": false,
          "internalType": "uint256",
          "name": "newTotalReserves",
          "type": "uint256"
        }
      ],
      "name": "ReservesReduced",
      "type": "event"
    },
    {
      "anonymous": false,
      "inputs": [
        {
          "indexed": true,
          "internalType": "address",
          "name": "from",
          "type": "address"
        },
        {
          "indexed": true,
          "internalType": "address",
          "name": "to",
          "type": "address"
        },
        {
          "indexed": false,
          "internalType": "uint256",
          "name": "amount",
          "type": "uint256"
        }
      ],
      "name": "Transfer",
      "type": "event"
    },
    {
      "inputs": [],
      "name": "NO_ERROR",
      "outputs": [
        {
          "internalType": "uint256",
          "name": "",
          "type": "uint256"
        }
      ],
      "stateMutability": "view",
      "type": "function"
    },
    {
      "inputs": [],
      "name": "_acceptAdmin",
      "outputs": [
        {
          "internalType": "uint256",
          "name": "",
          "type": "uint256"
        }
      ],
      "stateMutability": "nonpayable",
      "type": "function"
    },
    {
      "inputs": [],
      "name": "_addReserves",
      "outputs": [
        {
          "internalType": "uint256",
          "name": "",
          "type": "uint256"
        }
      ],
      "stateMutability": "payable",
      "type": "function"
    },
    {
      "inputs": [
        {
          "internalType": "address",
          "name": "_receiver",
          "type": "address"
        }
      ],
      "name": "_claimAllYields",
      "outputs": [],
      "stateMutability": "nonpayable",
      "type": "function"
    },
    {
      "inputs": [
        {
          "internalType": "uint256",
          "name": "reduceAmount",
          "type": "uint256"
        }
      ],
      "name": "_reduceReserves",
      "outputs": [
        {
          "internalType": "uint256",
          "name": "",
          "type": "uint256"
        }
      ],
      "stateMutability": "nonpayable",
      "type": "function"
    },
    {
      "inputs": [
        {
          "internalType": "contract ComptrollerInterface",
          "name": "newComptroller",
          "type": "address"
        }
      ],
      "name": "_setComptroller",
      "outputs": [
        {
          "internalType": "uint256",
          "name": "",
          "type": "uint256"
        }
      ],
      "stateMutability": "nonpayable",
      "type": "function"
    },
    {
      "inputs": [
        {
          "internalType": "contract InterestRateModel",
          "name": "newInterestRateModel",
          "type": "address"
        }
      ],
      "name": "_setInterestRateModel",
      "outputs": [
        {
          "internalType": "uint256",
          "name": "",
          "type": "uint256"
        }
      ],
      "stateMutability": "nonpayable",
      "type": "function"
    },
    {
      "inputs": [
        {
          "internalType": "address payable",
          "name": "newPendingAdmin",
          "type": "address"
        }
      ],
      "name": "_setPendingAdmin",
      "outputs": [
        {
          "internalType": "uint256",
          "name": "",
          "type": "uint256"
        }
      ],
      "stateMutability": "nonpayable",
      "type": "function"
    },
    {
      "inputs": [
        {
          "internalType": "uint256",
          "name": "newReserveFactorMantissa",
          "type": "uint256"
        }
      ],
      "name": "_setReserveFactor",
      "outputs": [
        {
          "internalType": "uint256",
          "name": "",
          "type": "uint256"
        }
      ],
      "stateMutability": "nonpayable",
      "type": "function"
    },
    {
      "inputs": [],
      "name": "accrualBlockNumber",
      "outputs": [
        {
          "internalType": "uint256",
          "name": "",
          "type": "uint256"
        }
      ],
      "stateMutability": "view",
      "type": "function"
    },
    {
      "inputs": [],
      "name": "accrueInterest",
      "outputs": [
        {
          "internalType": "uint256",
          "name": "",
          "type": "uint256"
        }
      ],
      "stateMutability": "nonpayable",
      "type": "function"
    },
    {
      "inputs": [],
      "name": "admin",
      "outputs": [
        {
          "internalType": "address payable",
          "name": "",
          "type": "address"
        }
      ],
      "stateMutability": "view",
      "type": "function"
    },
    {
      "inputs": [
        {
          "internalType": "address",
          "name": "owner",
          "type": "address"
        },
        {
          "internalType": "address",
          "name": "spender",
          "type": "address"
        }
      ],
      "name": "allowance",
      "outputs": [
        {
          "internalType": "uint256",
          "name": "",
          "type": "uint256"
        }
      ],
      "stateMutability": "view",
      "type": "function"
    },
    {
      "inputs": [
        {
          "internalType": "address",
          "name": "spender",
          "type": "address"
        },
        {
          "internalType": "uint256",
          "name": "amount",
          "type": "uint256"
        }
      ],
      "name": "approve",
      "outputs": [
        {
          "internalType": "bool",
          "name": "",
          "type": "bool"
        }
      ],
      "stateMutability": "nonpayable",
      "type": "function"
    },
    {
      "inputs": [
        {
          "internalType": "address",
          "name": "owner",
          "type": "address"
        }
      ],
      "name": "balanceOf",
      "outputs": [
        {
          "internalType": "uint256",
          "name": "",
          "type": "uint256"
        }
      ],
      "stateMutability": "view",
      "type": "function"
    },
    {
      "inputs": [
        {
          "internalType": "address",
          "name": "owner",
          "type": "address"
        }
      ],
      "name": "balanceOfUnderlying",
      "outputs": [
        {
          "internalType": "uint256",
          "name": "",
          "type": "uint256"
        }
      ],
      "stateMutability": "nonpayable",
      "type": "function"
    },
    {
      "inputs": [
        {
          "internalType": "uint256",
          "name": "borrowAmount",
          "type": "uint256"
        }
      ],
      "name": "borrow",
      "outputs": [
        {
          "internalType": "uint256",
          "name": "",
          "type": "uint256"
        }
      ],
      "stateMutability": "nonpayable",
      "type": "function"
    },
    {
      "inputs": [
        {
          "internalType": "address",
          "name": "account",
          "type": "address"
        }
      ],
      "name": "borrowBalanceCurrent",
      "outputs": [
        {
          "internalType": "uint256",
          "name": "",
          "type": "uint256"
        }
      ],
      "stateMutability": "nonpayable",
      "type": "function"
    },
    {
      "inputs": [
        {
          "internalType": "address",
          "name": "account",
          "type": "address"
        }
      ],
      "name": "borrowBalanceStored",
      "outputs": [
        {
          "internalType": "uint256",
          "name": "",
          "type": "uint256"
        }
      ],
      "stateMutability": "view",
      "type": "function"
    },
    {
      "inputs": [],
      "name": "borrowIndex",
      "outputs": [
        {
          "internalType": "uint256",
          "name": "",
          "type": "uint256"
        }
      ],
      "stateMutability": "view",
      "type": "function"
    },
    {
      "inputs": [],
      "name": "borrowRatePerBlock",
      "outputs": [
        {
          "internalType": "uint256",
          "name": "",
          "type": "uint256"
        }
      ],
      "stateMutability": "view",
      "type": "function"
    },
    {
      "inputs": [],
      "name": "comptroller",
      "outputs": [
        {
          "internalType": "contract ComptrollerInterface",
          "name": "",
          "type": "address"
        }
      ],
      "stateMutability": "view",
      "type": "function"
    },
    {
      "inputs": [],
      "name": "decimals",
      "outputs": [
        {
          "internalType": "uint8",
          "name": "",
          "type": "uint8"
        }
      ],
      "stateMutability": "view",
      "type": "function"
    },
    {
      "inputs": [],
      "name": "exchangeRateCurrent",
      "outputs": [
        {
          "internalType": "uint256",
          "name": "",
          "type": "uint256"
        }
      ],
      "stateMutability": "nonpayable",
      "type": "function"
    },
    {
      "inputs": [],
      "name": "exchangeRateStored",
      "outputs": [
        {
          "internalType": "uint256",
          "name": "",
          "type": "uint256"
        }
      ],
      "stateMutability": "view",
      "type": "function"
    },
    {
      "inputs": [
        {
          "internalType": "address",
          "name": "account",
          "type": "address"
        }
      ],
      "name": "getAccountSnapshot",
      "outputs": [
        {
          "internalType": "uint256",
          "name": "",
          "type": "uint256"
        },
        {
          "internalType": "uint256",
          "name": "",
          "type": "uint256"
        },
        {
          "internalType": "uint256",
          "name": "",
          "type": "uint256"
        },
        {
          "internalType": "uint256",
          "name": "",
          "type": "uint256"
        }
      ],
      "stateMutability": "view",
      "type": "function"
    },
    {
      "inputs": [],
      "name": "getCash",
      "outputs": [
        {
          "internalType": "uint256",
          "name": "",
          "type": "uint256"
        }
      ],
      "stateMutability": "view",
      "type": "function"
    },
    {
      "inputs": [
        {
          "internalType": "contract ComptrollerInterface",
          "name": "comptroller_",
          "type": "address"
        },
        {
          "internalType": "contract InterestRateModel",
          "name": "interestRateModel_",
          "type": "address"
        },
        {
          "internalType": "uint256",
          "name": "initialExchangeRateMantissa_",
          "type": "uint256"
        },
        {
          "internalType": "string",
          "name": "name_",
          "type": "string"
        },
        {
          "internalType": "string",
          "name": "symbol_",
          "type": "string"
        },
        {
          "internalType": "uint8",
          "name": "decimals_",
          "type": "uint8"
        }
      ],
      "name": "initialize",
      "outputs": [],
      "stateMutability": "nonpayable",
      "type": "function"
    },
    {
      "inputs": [],
      "name": "interestRateModel",
      "outputs": [
        {
          "internalType": "contract InterestRateModel",
          "name": "",
          "type": "address"
        }
      ],
      "stateMutability": "view",
      "type": "function"
    },
    {
      "inputs": [],
      "name": "isCToken",
      "outputs": [
        {
          "internalType": "bool",
          "name": "",
          "type": "bool"
        }
      ],
      "stateMutability": "view",
      "type": "function"
    },
    {
      "inputs": [
        {
          "internalType": "address",
          "name": "borrower",
          "type": "address"
        },
        {
          "internalType": "contract CToken",
          "name": "cTokenCollateral",
          "type": "address"
        }
      ],
      "name": "liquidateBorrow",
      "outputs": [],
      "stateMutability": "payable",
      "type": "function"
    },
    {
      "inputs": [],
      "name": "mint",
      "outputs": [],
      "stateMutability": "payable",
      "type": "function"
    },
    {
      "inputs": [],
      "name": "name",
      "outputs": [
        {
          "internalType": "string",
          "name": "",
          "type": "string"
        }
      ],
      "stateMutability": "view",
      "type": "function"
    },
    {
      "inputs": [],
      "name": "pendingAdmin",
      "outputs": [
        {
          "internalType": "address payable",
          "name": "",
          "type": "address"
        }
      ],
      "stateMutability": "view",
      "type": "function"
    },
    {
      "inputs": [],
      "name": "protocolSeizeShareMantissa",
      "outputs": [
        {
          "internalType": "uint256",
          "name": "",
          "type": "uint256"
        }
      ],
      "stateMutability": "view",
      "type": "function"
    },
    {
      "inputs": [
        {
          "internalType": "uint256",
          "name": "redeemTokens",
          "type": "uint256"
        }
      ],
      "name": "redeem",
      "outputs": [
        {
          "internalType": "uint256",
          "name": "",
          "type": "uint256"
        }
      ],
      "stateMutability": "nonpayable",
      "type": "function"
    },
    {
      "inputs": [
        {
          "internalType": "uint256",
          "name": "redeemAmount",
          "type": "uint256"
        }
      ],
      "name": "redeemUnderlying",
      "outputs": [
        {
          "internalType": "uint256",
          "name": "",
          "type": "uint256"
        }
      ],
      "stateMutability": "nonpayable",
      "type": "function"
    },
    {
      "inputs": [],
      "name": "repayBorrow",
      "outputs": [],
      "stateMutability": "payable",
      "type": "function"
    },
    {
      "inputs": [
        {
          "internalType": "address",
          "name": "borrower",
          "type": "address"
        }
      ],
      "name": "repayBorrowBehalf",
      "outputs": [],
      "stateMutability": "payable",
      "type": "function"
    },
    {
      "inputs": [],
      "name": "reserveFactorMantissa",
      "outputs": [
        {
          "internalType": "uint256",
          "name": "",
          "type": "uint256"
        }
      ],
      "stateMutability": "view",
      "type": "function"
    },
    {
      "inputs": [
        {
          "internalType": "address",
          "name": "liquidator",
          "type": "address"
        },
        {
          "internalType": "address",
          "name": "borrower",
          "type": "address"
        },
        {
          "internalType": "uint256",
          "name": "seizeTokens",
          "type": "uint256"
        }
      ],
      "name": "seize",
      "outputs": [
        {
          "internalType": "uint256",
          "name": "",
          "type": "uint256"
        }
      ],
      "stateMutability": "nonpayable",
      "type": "function"
    },
    {
      "inputs": [],
      "name": "supplyRatePerBlock",
      "outputs": [
        {
          "internalType": "uint256",
          "name": "",
          "type": "uint256"
        }
      ],
      "stateMutability": "view",
      "type": "function"
    },
    {
      "inputs": [],
      "name": "symbol",
      "outputs": [
        {
          "internalType": "string",
          "name": "",
          "type": "string"
        }
      ],
      "stateMutability": "view",
      "type": "function"
    },
    {
      "inputs": [],
      "name": "totalBorrows",
      "outputs": [
        {
          "internalType": "uint256",
          "name": "",
          "type": "uint256"
        }
      ],
      "stateMutability": "view",
      "type": "function"
    },
    {
      "inputs": [],
      "name": "totalBorrowsCurrent",
      "outputs": [
        {
          "internalType": "uint256",
          "name": "",
          "type": "uint256"
        }
      ],
      "stateMutability": "nonpayable",
      "type": "function"
    },
    {
      "inputs": [],
      "name": "totalReserves",
      "outputs": [
        {
          "internalType": "uint256",
          "name": "",
          "type": "uint256"
        }
      ],
      "stateMutability": "view",
      "type": "function"
    },
    {
      "inputs": [],
      "name": "totalSupply",
      "outputs": [
        {
          "internalType": "uint256",
          "name": "",
          "type": "uint256"
        }
      ],
      "stateMutability": "view",
      "type": "function"
    },
    {
      "inputs": [
        {
          "internalType": "address",
          "name": "dst",
          "type": "address"
        },
        {
          "internalType": "uint256",
          "name": "amount",
          "type": "uint256"
        }
      ],
      "name": "transfer",
      "outputs": [
        {
          "internalType": "bool",
          "name": "",
          "type": "bool"
        }
      ],
      "stateMutability": "nonpayable",
      "type": "function"
    },
    {
      "inputs": [
        {
          "internalType": "address",
          "name": "src",
          "type": "address"
        },
        {
          "internalType": "address",
          "name": "dst",
          "type": "address"
        },
        {
          "internalType": "uint256",
          "name": "amount",
          "type": "uint256"
        }
      ],
      "name": "transferFrom",
      "outputs": [
        {
          "internalType": "bool",
          "name": "",
          "type": "bool"
        }
      ],
      "stateMutability": "nonpayable",
      "type": "function"
    },
    {
      "stateMutability": "payable",
      "type": "receive"
    }
  ],
  "transactionHash": "0x20d842c0f44bec3b1579f11d205b84c3979a1a0138e92cccb2fa9146d7d5cd72",
  "receipt": {
    "to": null,
    "from": "0xB43A83d239d32C829AA636bf33bfCD38141B8319",
    "contractAddress": "0xd7d3Af1Fe98fB6aCc05DC1126402dd8ea8aDe293",
    "transactionIndex": 7,
    "gasUsed": "3376633",
    "logsBloom": "0x00000000000000000000000008000000000000000000000000800000000000000000000000000040000000000000000000000000000000000000000800000000000000000000000000000000000000000000000020000000000000000000000000000000002000000000000000000000000000000000000000000000000000000000000000000000000000000800000000000000000000100000000000000000200000000000000100100000000000000000000000000000000000000000000000000004000000000002000000000000000000000000000000000000000000000000400000000000000000000000000000400000000000000000000000000000",
    "blockHash": "0x1918863c8a91b1371a1cfcc127e9b761d6e9e80f78bf5bf03e1bb85cb17a7400",
    "transactionHash": "0x20d842c0f44bec3b1579f11d205b84c3979a1a0138e92cccb2fa9146d7d5cd72",
    "logs": [
      {
        "transactionIndex": 7,
        "blockNumber": 3168768,
        "transactionHash": "0x20d842c0f44bec3b1579f11d205b84c3979a1a0138e92cccb2fa9146d7d5cd72",
        "address": "0xd7d3Af1Fe98fB6aCc05DC1126402dd8ea8aDe293",
        "topics": [
          "0x7ac369dbd14fa5ea3f473ed67cc9d598964a77501540ba6751eb0b3decf5870d"
        ],
        "data": "0x0000000000000000000000000000000000000000000000000000000000000000000000000000000000000000357bfa7d585160373aa41345237b9ef6d49528c6",
        "logIndex": 30,
        "blockHash": "0x1918863c8a91b1371a1cfcc127e9b761d6e9e80f78bf5bf03e1bb85cb17a7400"
      },
      {
        "transactionIndex": 7,
        "blockNumber": 3168768,
        "transactionHash": "0x20d842c0f44bec3b1579f11d205b84c3979a1a0138e92cccb2fa9146d7d5cd72",
        "address": "0xd7d3Af1Fe98fB6aCc05DC1126402dd8ea8aDe293",
        "topics": [
          "0xedffc32e068c7c95dfd4bdfd5c4d939a084d6b11c4199eac8436ed234d72f926"
        ],
        "data": "0x00000000000000000000000000000000000000000000000000000000000000000000000000000000000000007056d65682efc1621eaaeb31d314b66a54fb0724",
        "logIndex": 31,
        "blockHash": "0x1918863c8a91b1371a1cfcc127e9b761d6e9e80f78bf5bf03e1bb85cb17a7400"
      },
      {
        "transactionIndex": 7,
        "blockNumber": 3168768,
        "transactionHash": "0x20d842c0f44bec3b1579f11d205b84c3979a1a0138e92cccb2fa9146d7d5cd72",
        "address": "0x2fc95838c71e76ec69ff817983BFf17c710F34E0",
        "topics": [
          "0x2da9afcf2ffbfd720263cc579aa9f8dfce34b31d447b0ba6d0bfefc40f713c84"
        ],
        "data": "0x000000000000000000000000d7d3af1fe98fb6acc05dc1126402dd8ea8ade293000000000000000000000000ad4707aec9b7a48d21e5915bfa878032cea8737c",
        "logIndex": 32,
        "blockHash": "0x1918863c8a91b1371a1cfcc127e9b761d6e9e80f78bf5bf03e1bb85cb17a7400"
      }
    ],
    "blockNumber": 3168768,
    "cumulativeGasUsed": "4572910",
    "status": 1,
    "byzantium": true
  },
  "args": [
    "0x357bfA7D585160373aA41345237B9eF6D49528c6",
    "0x7056D65682EfC1621eaaEb31D314B66a54FB0724",
    "200000000000000000000000000",
    "Laser ETH",
    "laETH",
    8,
    "0xB43A83d239d32C829AA636bf33bfCD38141B8319",
    "0xaD4707AEc9B7a48D21E5915bFa878032cEa8737c"
  ],
  "numDeployments": 1,
  "solcInputHash": "a43e4584a912d4e55f21be1c37bf77ed",
  "metadata": "{\"compiler\":{\"version\":\"0.8.10+commit.fc410830\"},\"language\":\"Solidity\",\"output\":{\"abi\":[{\"inputs\":[{\"internalType\":\"contract ComptrollerInterface\",\"name\":\"comptroller_\",\"type\":\"address\"},{\"internalType\":\"contract InterestRateModel\",\"name\":\"interestRateModel_\",\"type\":\"address\"},{\"internalType\":\"uint256\",\"name\":\"initialExchangeRateMantissa_\",\"type\":\"uint256\"},{\"internalType\":\"string\",\"name\":\"name_\",\"type\":\"string\"},{\"internalType\":\"string\",\"name\":\"symbol_\",\"type\":\"string\"},{\"internalType\":\"uint8\",\"name\":\"decimals_\",\"type\":\"uint8\"},{\"internalType\":\"address payable\",\"name\":\"admin_\",\"type\":\"address\"},{\"internalType\":\"address\",\"name\":\"_pointsOperator\",\"type\":\"address\"}],\"stateMutability\":\"nonpayable\",\"type\":\"constructor\"},{\"inputs\":[],\"name\":\"AcceptAdminPendingAdminCheck\",\"type\":\"error\"},{\"inputs\":[{\"internalType\":\"uint256\",\"name\":\"actualAddAmount\",\"type\":\"uint256\"}],\"name\":\"AddReservesFactorFreshCheck\",\"type\":\"error\"},{\"inputs\":[],\"name\":\"BorrowCashNotAvailable\",\"type\":\"error\"},{\"inputs\":[{\"internalType\":\"uint256\",\"name\":\"errorCode\",\"type\":\"uint256\"}],\"name\":\"BorrowComptrollerRejection\",\"type\":\"error\"},{\"inputs\":[],\"name\":\"BorrowFreshnessCheck\",\"type\":\"error\"},{\"inputs\":[{\"internalType\":\"uint256\",\"name\":\"errorCode\",\"type\":\"uint256\"}],\"name\":\"LiquidateAccrueBorrowInterestFailed\",\"type\":\"error\"},{\"inputs\":[{\"internalType\":\"uint256\",\"name\":\"errorCode\",\"type\":\"uint256\"}],\"name\":\"LiquidateAccrueCollateralInterestFailed\",\"type\":\"error\"},{\"inputs\":[],\"name\":\"LiquidateCloseAmountIsUintMax\",\"type\":\"error\"},{\"inputs\":[],\"name\":\"LiquidateCloseAmountIsZero\",\"type\":\"error\"},{\"inputs\":[],\"name\":\"LiquidateCollateralFreshnessCheck\",\"type\":\"error\"},{\"inputs\":[{\"internalType\":\"uint256\",\"name\":\"errorCode\",\"type\":\"uint256\"}],\"name\":\"LiquidateComptrollerRejection\",\"type\":\"error\"},{\"inputs\":[],\"name\":\"LiquidateFreshnessCheck\",\"type\":\"error\"},{\"inputs\":[],\"name\":\"LiquidateLiquidatorIsBorrower\",\"type\":\"error\"},{\"inputs\":[{\"internalType\":\"uint256\",\"name\":\"errorCode\",\"type\":\"uint256\"}],\"name\":\"LiquidateRepayBorrowFreshFailed\",\"type\":\"error\"},{\"inputs\":[{\"internalType\":\"uint256\",\"name\":\"errorCode\",\"type\":\"uint256\"}],\"name\":\"LiquidateSeizeComptrollerRejection\",\"type\":\"error\"},{\"inputs\":[],\"name\":\"LiquidateSeizeLiquidatorIsBorrower\",\"type\":\"error\"},{\"inputs\":[{\"internalType\":\"uint256\",\"name\":\"errorCode\",\"type\":\"uint256\"}],\"name\":\"MintComptrollerRejection\",\"type\":\"error\"},{\"inputs\":[],\"name\":\"MintFreshnessCheck\",\"type\":\"error\"},{\"inputs\":[{\"internalType\":\"uint256\",\"name\":\"errorCode\",\"type\":\"uint256\"}],\"name\":\"RedeemComptrollerRejection\",\"type\":\"error\"},{\"inputs\":[],\"name\":\"RedeemFreshnessCheck\",\"type\":\"error\"},{\"inputs\":[],\"name\":\"RedeemTransferOutNotPossible\",\"type\":\"error\"},{\"inputs\":[],\"name\":\"ReduceReservesAdminCheck\",\"type\":\"error\"},{\"inputs\":[],\"name\":\"ReduceReservesCashNotAvailable\",\"type\":\"error\"},{\"inputs\":[],\"name\":\"ReduceReservesCashValidation\",\"type\":\"error\"},{\"inputs\":[],\"name\":\"ReduceReservesFreshCheck\",\"type\":\"error\"},{\"inputs\":[{\"internalType\":\"uint256\",\"name\":\"errorCode\",\"type\":\"uint256\"}],\"name\":\"RepayBorrowComptrollerRejection\",\"type\":\"error\"},{\"inputs\":[],\"name\":\"RepayBorrowFreshnessCheck\",\"type\":\"error\"},{\"inputs\":[],\"name\":\"SetComptrollerOwnerCheck\",\"type\":\"error\"},{\"inputs\":[],\"name\":\"SetInterestRateModelFreshCheck\",\"type\":\"error\"},{\"inputs\":[],\"name\":\"SetInterestRateModelOwnerCheck\",\"type\":\"error\"},{\"inputs\":[],\"name\":\"SetPendingAdminOwnerCheck\",\"type\":\"error\"},{\"inputs\":[],\"name\":\"SetReserveFactorAdminCheck\",\"type\":\"error\"},{\"inputs\":[],\"name\":\"SetReserveFactorBoundsCheck\",\"type\":\"error\"},{\"inputs\":[],\"name\":\"SetReserveFactorFreshCheck\",\"type\":\"error\"},{\"inputs\":[{\"internalType\":\"uint256\",\"name\":\"errorCode\",\"type\":\"uint256\"}],\"name\":\"TransferComptrollerRejection\",\"type\":\"error\"},{\"inputs\":[],\"name\":\"TransferNotAllowed\",\"type\":\"error\"},{\"inputs\":[],\"name\":\"TransferNotEnough\",\"type\":\"error\"},{\"inputs\":[],\"name\":\"TransferTooMuch\",\"type\":\"error\"},{\"anonymous\":false,\"inputs\":[{\"indexed\":false,\"internalType\":\"uint256\",\"name\":\"cashPrior\",\"type\":\"uint256\"},{\"indexed\":false,\"internalType\":\"uint256\",\"name\":\"interestAccumulated\",\"type\":\"uint256\"},{\"indexed\":false,\"internalType\":\"uint256\",\"name\":\"borrowIndex\",\"type\":\"uint256\"},{\"indexed\":false,\"internalType\":\"uint256\",\"name\":\"totalBorrows\",\"type\":\"uint256\"}],\"name\":\"AccrueInterest\",\"type\":\"event\"},{\"anonymous\":false,\"inputs\":[{\"indexed\":true,\"internalType\":\"address\",\"name\":\"owner\",\"type\":\"address\"},{\"indexed\":true,\"internalType\":\"address\",\"name\":\"spender\",\"type\":\"address\"},{\"indexed\":false,\"internalType\":\"uint256\",\"name\":\"amount\",\"type\":\"uint256\"}],\"name\":\"Approval\",\"type\":\"event\"},{\"anonymous\":false,\"inputs\":[{\"indexed\":false,\"internalType\":\"address\",\"name\":\"borrower\",\"type\":\"address\"},{\"indexed\":false,\"internalType\":\"uint256\",\"name\":\"borrowAmount\",\"type\":\"uint256\"},{\"indexed\":false,\"internalType\":\"uint256\",\"name\":\"accountBorrows\",\"type\":\"uint256\"},{\"indexed\":false,\"internalType\":\"uint256\",\"name\":\"totalBorrows\",\"type\":\"uint256\"}],\"name\":\"Borrow\",\"type\":\"event\"},{\"anonymous\":false,\"inputs\":[{\"indexed\":false,\"internalType\":\"address\",\"name\":\"liquidator\",\"type\":\"address\"},{\"indexed\":false,\"internalType\":\"address\",\"name\":\"borrower\",\"type\":\"address\"},{\"indexed\":false,\"internalType\":\"uint256\",\"name\":\"repayAmount\",\"type\":\"uint256\"},{\"indexed\":false,\"internalType\":\"address\",\"name\":\"cTokenCollateral\",\"type\":\"address\"},{\"indexed\":false,\"internalType\":\"uint256\",\"name\":\"seizeTokens\",\"type\":\"uint256\"}],\"name\":\"LiquidateBorrow\",\"type\":\"event\"},{\"anonymous\":false,\"inputs\":[{\"indexed\":false,\"internalType\":\"address\",\"name\":\"minter\",\"type\":\"address\"},{\"indexed\":false,\"internalType\":\"uint256\",\"name\":\"mintAmount\",\"type\":\"uint256\"},{\"indexed\":false,\"internalType\":\"uint256\",\"name\":\"mintTokens\",\"type\":\"uint256\"}],\"name\":\"Mint\",\"type\":\"event\"},{\"anonymous\":false,\"inputs\":[{\"indexed\":false,\"internalType\":\"address\",\"name\":\"oldAdmin\",\"type\":\"address\"},{\"indexed\":false,\"internalType\":\"address\",\"name\":\"newAdmin\",\"type\":\"address\"}],\"name\":\"NewAdmin\",\"type\":\"event\"},{\"anonymous\":false,\"inputs\":[{\"indexed\":false,\"internalType\":\"contract ComptrollerInterface\",\"name\":\"oldComptroller\",\"type\":\"address\"},{\"indexed\":false,\"internalType\":\"contract ComptrollerInterface\",\"name\":\"newComptroller\",\"type\":\"address\"}],\"name\":\"NewComptroller\",\"type\":\"event\"},{\"anonymous\":false,\"inputs\":[{\"indexed\":false,\"internalType\":\"contract InterestRateModel\",\"name\":\"oldInterestRateModel\",\"type\":\"address\"},{\"indexed\":false,\"internalType\":\"contract InterestRateModel\",\"name\":\"newInterestRateModel\",\"type\":\"address\"}],\"name\":\"NewMarketInterestRateModel\",\"type\":\"event\"},{\"anonymous\":false,\"inputs\":[{\"indexed\":false,\"internalType\":\"address\",\"name\":\"oldPendingAdmin\",\"type\":\"address\"},{\"indexed\":false,\"internalType\":\"address\",\"name\":\"newPendingAdmin\",\"type\":\"address\"}],\"name\":\"NewPendingAdmin\",\"type\":\"event\"},{\"anonymous\":false,\"inputs\":[{\"indexed\":false,\"internalType\":\"uint256\",\"name\":\"oldReserveFactorMantissa\",\"type\":\"uint256\"},{\"indexed\":false,\"internalType\":\"uint256\",\"name\":\"newReserveFactorMantissa\",\"type\":\"uint256\"}],\"name\":\"NewReserveFactor\",\"type\":\"event\"},{\"anonymous\":false,\"inputs\":[{\"indexed\":false,\"internalType\":\"address\",\"name\":\"redeemer\",\"type\":\"address\"},{\"indexed\":false,\"internalType\":\"uint256\",\"name\":\"redeemAmount\",\"type\":\"uint256\"},{\"indexed\":false,\"internalType\":\"uint256\",\"name\":\"redeemTokens\",\"type\":\"uint256\"}],\"name\":\"Redeem\",\"type\":\"event\"},{\"anonymous\":false,\"inputs\":[{\"indexed\":false,\"internalType\":\"address\",\"name\":\"payer\",\"type\":\"address\"},{\"indexed\":false,\"internalType\":\"address\",\"name\":\"borrower\",\"type\":\"address\"},{\"indexed\":false,\"internalType\":\"uint256\",\"name\":\"repayAmount\",\"type\":\"uint256\"},{\"indexed\":false,\"internalType\":\"uint256\",\"name\":\"accountBorrows\",\"type\":\"uint256\"},{\"indexed\":false,\"internalType\":\"uint256\",\"name\":\"totalBorrows\",\"type\":\"uint256\"}],\"name\":\"RepayBorrow\",\"type\":\"event\"},{\"anonymous\":false,\"inputs\":[{\"indexed\":false,\"internalType\":\"address\",\"name\":\"benefactor\",\"type\":\"address\"},{\"indexed\":false,\"internalType\":\"uint256\",\"name\":\"addAmount\",\"type\":\"uint256\"},{\"indexed\":false,\"internalType\":\"uint256\",\"name\":\"newTotalReserves\",\"type\":\"uint256\"}],\"name\":\"ReservesAdded\",\"type\":\"event\"},{\"anonymous\":false,\"inputs\":[{\"indexed\":false,\"internalType\":\"address\",\"name\":\"admin\",\"type\":\"address\"},{\"indexed\":false,\"internalType\":\"uint256\",\"name\":\"reduceAmount\",\"type\":\"uint256\"},{\"indexed\":false,\"internalType\":\"uint256\",\"name\":\"newTotalReserves\",\"type\":\"uint256\"}],\"name\":\"ReservesReduced\",\"type\":\"event\"},{\"anonymous\":false,\"inputs\":[{\"indexed\":true,\"internalType\":\"address\",\"name\":\"from\",\"type\":\"address\"},{\"indexed\":true,\"internalType\":\"address\",\"name\":\"to\",\"type\":\"address\"},{\"indexed\":false,\"internalType\":\"uint256\",\"name\":\"amount\",\"type\":\"uint256\"}],\"name\":\"Transfer\",\"type\":\"event\"},{\"inputs\":[],\"name\":\"NO_ERROR\",\"outputs\":[{\"internalType\":\"uint256\",\"name\":\"\",\"type\":\"uint256\"}],\"stateMutability\":\"view\",\"type\":\"function\"},{\"inputs\":[],\"name\":\"_acceptAdmin\",\"outputs\":[{\"internalType\":\"uint256\",\"name\":\"\",\"type\":\"uint256\"}],\"stateMutability\":\"nonpayable\",\"type\":\"function\"},{\"inputs\":[],\"name\":\"_addReserves\",\"outputs\":[{\"internalType\":\"uint256\",\"name\":\"\",\"type\":\"uint256\"}],\"stateMutability\":\"payable\",\"type\":\"function\"},{\"inputs\":[{\"internalType\":\"address\",\"name\":\"_receiver\",\"type\":\"address\"}],\"name\":\"_claimAllYields\",\"outputs\":[],\"stateMutability\":\"nonpayable\",\"type\":\"function\"},{\"inputs\":[{\"internalType\":\"uint256\",\"name\":\"reduceAmount\",\"type\":\"uint256\"}],\"name\":\"_reduceReserves\",\"outputs\":[{\"internalType\":\"uint256\",\"name\":\"\",\"type\":\"uint256\"}],\"stateMutability\":\"nonpayable\",\"type\":\"function\"},{\"inputs\":[{\"internalType\":\"contract ComptrollerInterface\",\"name\":\"newComptroller\",\"type\":\"address\"}],\"name\":\"_setComptroller\",\"outputs\":[{\"internalType\":\"uint256\",\"name\":\"\",\"type\":\"uint256\"}],\"stateMutability\":\"nonpayable\",\"type\":\"function\"},{\"inputs\":[{\"internalType\":\"contract InterestRateModel\",\"name\":\"newInterestRateModel\",\"type\":\"address\"}],\"name\":\"_setInterestRateModel\",\"outputs\":[{\"internalType\":\"uint256\",\"name\":\"\",\"type\":\"uint256\"}],\"stateMutability\":\"nonpayable\",\"type\":\"function\"},{\"inputs\":[{\"internalType\":\"address payable\",\"name\":\"newPendingAdmin\",\"type\":\"address\"}],\"name\":\"_setPendingAdmin\",\"outputs\":[{\"internalType\":\"uint256\",\"name\":\"\",\"type\":\"uint256\"}],\"stateMutability\":\"nonpayable\",\"type\":\"function\"},{\"inputs\":[{\"internalType\":\"uint256\",\"name\":\"newReserveFactorMantissa\",\"type\":\"uint256\"}],\"name\":\"_setReserveFactor\",\"outputs\":[{\"internalType\":\"uint256\",\"name\":\"\",\"type\":\"uint256\"}],\"stateMutability\":\"nonpayable\",\"type\":\"function\"},{\"inputs\":[],\"name\":\"accrualBlockNumber\",\"outputs\":[{\"internalType\":\"uint256\",\"name\":\"\",\"type\":\"uint256\"}],\"stateMutability\":\"view\",\"type\":\"function\"},{\"inputs\":[],\"name\":\"accrueInterest\",\"outputs\":[{\"internalType\":\"uint256\",\"name\":\"\",\"type\":\"uint256\"}],\"stateMutability\":\"nonpayable\",\"type\":\"function\"},{\"inputs\":[],\"name\":\"admin\",\"outputs\":[{\"internalType\":\"address payable\",\"name\":\"\",\"type\":\"address\"}],\"stateMutability\":\"view\",\"type\":\"function\"},{\"inputs\":[{\"internalType\":\"address\",\"name\":\"owner\",\"type\":\"address\"},{\"internalType\":\"address\",\"name\":\"spender\",\"type\":\"address\"}],\"name\":\"allowance\",\"outputs\":[{\"internalType\":\"uint256\",\"name\":\"\",\"type\":\"uint256\"}],\"stateMutability\":\"view\",\"type\":\"function\"},{\"inputs\":[{\"internalType\":\"address\",\"name\":\"spender\",\"type\":\"address\"},{\"internalType\":\"uint256\",\"name\":\"amount\",\"type\":\"uint256\"}],\"name\":\"approve\",\"outputs\":[{\"internalType\":\"bool\",\"name\":\"\",\"type\":\"bool\"}],\"stateMutability\":\"nonpayable\",\"type\":\"function\"},{\"inputs\":[{\"internalType\":\"address\",\"name\":\"owner\",\"type\":\"address\"}],\"name\":\"balanceOf\",\"outputs\":[{\"internalType\":\"uint256\",\"name\":\"\",\"type\":\"uint256\"}],\"stateMutability\":\"view\",\"type\":\"function\"},{\"inputs\":[{\"internalType\":\"address\",\"name\":\"owner\",\"type\":\"address\"}],\"name\":\"balanceOfUnderlying\",\"outputs\":[{\"internalType\":\"uint256\",\"name\":\"\",\"type\":\"uint256\"}],\"stateMutability\":\"nonpayable\",\"type\":\"function\"},{\"inputs\":[{\"internalType\":\"uint256\",\"name\":\"borrowAmount\",\"type\":\"uint256\"}],\"name\":\"borrow\",\"outputs\":[{\"internalType\":\"uint256\",\"name\":\"\",\"type\":\"uint256\"}],\"stateMutability\":\"nonpayable\",\"type\":\"function\"},{\"inputs\":[{\"internalType\":\"address\",\"name\":\"account\",\"type\":\"address\"}],\"name\":\"borrowBalanceCurrent\",\"outputs\":[{\"internalType\":\"uint256\",\"name\":\"\",\"type\":\"uint256\"}],\"stateMutability\":\"nonpayable\",\"type\":\"function\"},{\"inputs\":[{\"internalType\":\"address\",\"name\":\"account\",\"type\":\"address\"}],\"name\":\"borrowBalanceStored\",\"outputs\":[{\"internalType\":\"uint256\",\"name\":\"\",\"type\":\"uint256\"}],\"stateMutability\":\"view\",\"type\":\"function\"},{\"inputs\":[],\"name\":\"borrowIndex\",\"outputs\":[{\"internalType\":\"uint256\",\"name\":\"\",\"type\":\"uint256\"}],\"stateMutability\":\"view\",\"type\":\"function\"},{\"inputs\":[],\"name\":\"borrowRatePerBlock\",\"outputs\":[{\"internalType\":\"uint256\",\"name\":\"\",\"type\":\"uint256\"}],\"stateMutability\":\"view\",\"type\":\"function\"},{\"inputs\":[],\"name\":\"comptroller\",\"outputs\":[{\"internalType\":\"contract ComptrollerInterface\",\"name\":\"\",\"type\":\"address\"}],\"stateMutability\":\"view\",\"type\":\"function\"},{\"inputs\":[],\"name\":\"decimals\",\"outputs\":[{\"internalType\":\"uint8\",\"name\":\"\",\"type\":\"uint8\"}],\"stateMutability\":\"view\",\"type\":\"function\"},{\"inputs\":[],\"name\":\"exchangeRateCurrent\",\"outputs\":[{\"internalType\":\"uint256\",\"name\":\"\",\"type\":\"uint256\"}],\"stateMutability\":\"nonpayable\",\"type\":\"function\"},{\"inputs\":[],\"name\":\"exchangeRateStored\",\"outputs\":[{\"internalType\":\"uint256\",\"name\":\"\",\"type\":\"uint256\"}],\"stateMutability\":\"view\",\"type\":\"function\"},{\"inputs\":[{\"internalType\":\"address\",\"name\":\"account\",\"type\":\"address\"}],\"name\":\"getAccountSnapshot\",\"outputs\":[{\"internalType\":\"uint256\",\"name\":\"\",\"type\":\"uint256\"},{\"internalType\":\"uint256\",\"name\":\"\",\"type\":\"uint256\"},{\"internalType\":\"uint256\",\"name\":\"\",\"type\":\"uint256\"},{\"internalType\":\"uint256\",\"name\":\"\",\"type\":\"uint256\"}],\"stateMutability\":\"view\",\"type\":\"function\"},{\"inputs\":[],\"name\":\"getCash\",\"outputs\":[{\"internalType\":\"uint256\",\"name\":\"\",\"type\":\"uint256\"}],\"stateMutability\":\"view\",\"type\":\"function\"},{\"inputs\":[{\"internalType\":\"contract ComptrollerInterface\",\"name\":\"comptroller_\",\"type\":\"address\"},{\"internalType\":\"contract InterestRateModel\",\"name\":\"interestRateModel_\",\"type\":\"address\"},{\"internalType\":\"uint256\",\"name\":\"initialExchangeRateMantissa_\",\"type\":\"uint256\"},{\"internalType\":\"string\",\"name\":\"name_\",\"type\":\"string\"},{\"internalType\":\"string\",\"name\":\"symbol_\",\"type\":\"string\"},{\"internalType\":\"uint8\",\"name\":\"decimals_\",\"type\":\"uint8\"}],\"name\":\"initialize\",\"outputs\":[],\"stateMutability\":\"nonpayable\",\"type\":\"function\"},{\"inputs\":[],\"name\":\"interestRateModel\",\"outputs\":[{\"internalType\":\"contract InterestRateModel\",\"name\":\"\",\"type\":\"address\"}],\"stateMutability\":\"view\",\"type\":\"function\"},{\"inputs\":[],\"name\":\"isCToken\",\"outputs\":[{\"internalType\":\"bool\",\"name\":\"\",\"type\":\"bool\"}],\"stateMutability\":\"view\",\"type\":\"function\"},{\"inputs\":[{\"internalType\":\"address\",\"name\":\"borrower\",\"type\":\"address\"},{\"internalType\":\"contract CToken\",\"name\":\"cTokenCollateral\",\"type\":\"address\"}],\"name\":\"liquidateBorrow\",\"outputs\":[],\"stateMutability\":\"payable\",\"type\":\"function\"},{\"inputs\":[],\"name\":\"mint\",\"outputs\":[],\"stateMutability\":\"payable\",\"type\":\"function\"},{\"inputs\":[],\"name\":\"name\",\"outputs\":[{\"internalType\":\"string\",\"name\":\"\",\"type\":\"string\"}],\"stateMutability\":\"view\",\"type\":\"function\"},{\"inputs\":[],\"name\":\"pendingAdmin\",\"outputs\":[{\"internalType\":\"address payable\",\"name\":\"\",\"type\":\"address\"}],\"stateMutability\":\"view\",\"type\":\"function\"},{\"inputs\":[],\"name\":\"protocolSeizeShareMantissa\",\"outputs\":[{\"internalType\":\"uint256\",\"name\":\"\",\"type\":\"uint256\"}],\"stateMutability\":\"view\",\"type\":\"function\"},{\"inputs\":[{\"internalType\":\"uint256\",\"name\":\"redeemTokens\",\"type\":\"uint256\"}],\"name\":\"redeem\",\"outputs\":[{\"internalType\":\"uint256\",\"name\":\"\",\"type\":\"uint256\"}],\"stateMutability\":\"nonpayable\",\"type\":\"function\"},{\"inputs\":[{\"internalType\":\"uint256\",\"name\":\"redeemAmount\",\"type\":\"uint256\"}],\"name\":\"redeemUnderlying\",\"outputs\":[{\"internalType\":\"uint256\",\"name\":\"\",\"type\":\"uint256\"}],\"stateMutability\":\"nonpayable\",\"type\":\"function\"},{\"inputs\":[],\"name\":\"repayBorrow\",\"outputs\":[],\"stateMutability\":\"payable\",\"type\":\"function\"},{\"inputs\":[{\"internalType\":\"address\",\"name\":\"borrower\",\"type\":\"address\"}],\"name\":\"repayBorrowBehalf\",\"outputs\":[],\"stateMutability\":\"payable\",\"type\":\"function\"},{\"inputs\":[],\"name\":\"reserveFactorMantissa\",\"outputs\":[{\"internalType\":\"uint256\",\"name\":\"\",\"type\":\"uint256\"}],\"stateMutability\":\"view\",\"type\":\"function\"},{\"inputs\":[{\"internalType\":\"address\",\"name\":\"liquidator\",\"type\":\"address\"},{\"internalType\":\"address\",\"name\":\"borrower\",\"type\":\"address\"},{\"internalType\":\"uint256\",\"name\":\"seizeTokens\",\"type\":\"uint256\"}],\"name\":\"seize\",\"outputs\":[{\"internalType\":\"uint256\",\"name\":\"\",\"type\":\"uint256\"}],\"stateMutability\":\"nonpayable\",\"type\":\"function\"},{\"inputs\":[],\"name\":\"supplyRatePerBlock\",\"outputs\":[{\"internalType\":\"uint256\",\"name\":\"\",\"type\":\"uint256\"}],\"stateMutability\":\"view\",\"type\":\"function\"},{\"inputs\":[],\"name\":\"symbol\",\"outputs\":[{\"internalType\":\"string\",\"name\":\"\",\"type\":\"string\"}],\"stateMutability\":\"view\",\"type\":\"function\"},{\"inputs\":[],\"name\":\"totalBorrows\",\"outputs\":[{\"internalType\":\"uint256\",\"name\":\"\",\"type\":\"uint256\"}],\"stateMutability\":\"view\",\"type\":\"function\"},{\"inputs\":[],\"name\":\"totalBorrowsCurrent\",\"outputs\":[{\"internalType\":\"uint256\",\"name\":\"\",\"type\":\"uint256\"}],\"stateMutability\":\"nonpayable\",\"type\":\"function\"},{\"inputs\":[],\"name\":\"totalReserves\",\"outputs\":[{\"internalType\":\"uint256\",\"name\":\"\",\"type\":\"uint256\"}],\"stateMutability\":\"view\",\"type\":\"function\"},{\"inputs\":[],\"name\":\"totalSupply\",\"outputs\":[{\"internalType\":\"uint256\",\"name\":\"\",\"type\":\"uint256\"}],\"stateMutability\":\"view\",\"type\":\"function\"},{\"inputs\":[{\"internalType\":\"address\",\"name\":\"dst\",\"type\":\"address\"},{\"internalType\":\"uint256\",\"name\":\"amount\",\"type\":\"uint256\"}],\"name\":\"transfer\",\"outputs\":[{\"internalType\":\"bool\",\"name\":\"\",\"type\":\"bool\"}],\"stateMutability\":\"nonpayable\",\"type\":\"function\"},{\"inputs\":[{\"internalType\":\"address\",\"name\":\"src\",\"type\":\"address\"},{\"internalType\":\"address\",\"name\":\"dst\",\"type\":\"address\"},{\"internalType\":\"uint256\",\"name\":\"amount\",\"type\":\"uint256\"}],\"name\":\"transferFrom\",\"outputs\":[{\"internalType\":\"bool\",\"name\":\"\",\"type\":\"bool\"}],\"stateMutability\":\"nonpayable\",\"type\":\"function\"},{\"stateMutability\":\"payable\",\"type\":\"receive\"}],\"devdoc\":{\"author\":\"Compound\",\"kind\":\"dev\",\"methods\":{\"_acceptAdmin()\":{\"details\":\"Admin function for pending admin to accept role and update admin\",\"returns\":{\"_0\":\"uint 0=success, otherwise a failure (see ErrorReporter.sol for details)\"}},\"_addReserves()\":{\"returns\":{\"_0\":\"uint 0=success, otherwise a failure (see ErrorReporter.sol for details)\"}},\"_claimAllYields(address)\":{\"params\":{\"_receiver\":\"Treasury address\"}},\"_reduceReserves(uint256)\":{\"params\":{\"reduceAmount\":\"Amount of reduction to reserves\"},\"returns\":{\"_0\":\"uint 0=success, otherwise a failure (see ErrorReporter.sol for details)\"}},\"_setComptroller(address)\":{\"details\":\"Admin function to set a new comptroller\",\"returns\":{\"_0\":\"uint 0=success, otherwise a failure (see ErrorReporter.sol for details)\"}},\"_setInterestRateModel(address)\":{\"details\":\"Admin function to accrue interest and update the interest rate model\",\"params\":{\"newInterestRateModel\":\"the new interest rate model to use\"},\"returns\":{\"_0\":\"uint 0=success, otherwise a failure (see ErrorReporter.sol for details)\"}},\"_setPendingAdmin(address)\":{\"details\":\"Admin function to begin change of admin. The newPendingAdmin must call `_acceptAdmin` to finalize the transfer.\",\"params\":{\"newPendingAdmin\":\"New pending admin.\"},\"returns\":{\"_0\":\"uint 0=success, otherwise a failure (see ErrorReporter.sol for details)\"}},\"_setReserveFactor(uint256)\":{\"details\":\"Admin function to accrue interest and set a new reserve factor\",\"returns\":{\"_0\":\"uint 0=success, otherwise a failure (see ErrorReporter.sol for details)\"}},\"accrueInterest()\":{\"details\":\"This calculates interest accrued from the last checkpointed block   up to the current block and writes new checkpoint to storage.\"},\"allowance(address,address)\":{\"params\":{\"owner\":\"The address of the account which owns the tokens to be spent\",\"spender\":\"The address of the account which may transfer tokens\"},\"returns\":{\"_0\":\"The number of tokens allowed to be spent (-1 means infinite)\"}},\"approve(address,uint256)\":{\"details\":\"This will overwrite the approval amount for `spender`  and is subject to issues noted [here](https://eips.ethereum.org/EIPS/eip-20#approve)\",\"params\":{\"amount\":\"The number of tokens that are approved (uint256.max means infinite)\",\"spender\":\"The address of the account which may transfer tokens\"},\"returns\":{\"_0\":\"Whether or not the approval succeeded\"}},\"balanceOf(address)\":{\"params\":{\"owner\":\"The address of the account to query\"},\"returns\":{\"_0\":\"The number of tokens owned by `owner`\"}},\"balanceOfUnderlying(address)\":{\"details\":\"This also accrues interest in a transaction\",\"params\":{\"owner\":\"The address of the account to query\"},\"returns\":{\"_0\":\"The amount of underlying owned by `owner`\"}},\"borrow(uint256)\":{\"params\":{\"borrowAmount\":\"The amount of the underlying asset to borrow\"},\"returns\":{\"_0\":\"uint 0=success, otherwise a failure (see ErrorReporter.sol for details)\"}},\"borrowBalanceCurrent(address)\":{\"params\":{\"account\":\"The address whose balance should be calculated after updating borrowIndex\"},\"returns\":{\"_0\":\"The calculated balance\"}},\"borrowBalanceStored(address)\":{\"params\":{\"account\":\"The address whose balance should be calculated\"},\"returns\":{\"_0\":\"The calculated balance\"}},\"borrowRatePerBlock()\":{\"returns\":{\"_0\":\"The borrow interest rate per block, scaled by 1e18\"}},\"constructor\":{\"params\":{\"admin_\":\"Address of the administrator of this token\",\"comptroller_\":\"The address of the Comptroller\",\"decimals_\":\"ERC-20 decimal precision of this token\",\"initialExchangeRateMantissa_\":\"The initial exchange rate, scaled by 1e18\",\"interestRateModel_\":\"The address of the interest rate model\",\"name_\":\"ERC-20 name of this token\",\"symbol_\":\"ERC-20 symbol of this token\"}},\"exchangeRateCurrent()\":{\"returns\":{\"_0\":\"Calculated exchange rate scaled by 1e18\"}},\"exchangeRateStored()\":{\"details\":\"This function does not accrue interest before calculating the exchange rate\",\"returns\":{\"_0\":\"Calculated exchange rate scaled by 1e18\"}},\"getAccountSnapshot(address)\":{\"details\":\"This is used by comptroller to more efficiently perform liquidity checks.\",\"params\":{\"account\":\"Address of the account to snapshot\"},\"returns\":{\"_0\":\"(possible error, token balance, borrow balance, exchange rate mantissa)\"}},\"getCash()\":{\"returns\":{\"_0\":\"The quantity of underlying asset owned by this contract\"}},\"initialize(address,address,uint256,string,string,uint8)\":{\"params\":{\"comptroller_\":\"The address of the Comptroller\",\"decimals_\":\"EIP-20 decimal precision of this token\",\"initialExchangeRateMantissa_\":\"The initial exchange rate, scaled by 1e18\",\"interestRateModel_\":\"The address of the interest rate model\",\"name_\":\"EIP-20 name of this token\",\"symbol_\":\"EIP-20 symbol of this token\"}},\"liquidateBorrow(address,address)\":{\"details\":\"Reverts upon any failure\",\"params\":{\"borrower\":\"The borrower of this cToken to be liquidated\",\"cTokenCollateral\":\"The market in which to seize collateral from the borrower\"}},\"mint()\":{\"details\":\"Reverts upon any failure\"},\"redeem(uint256)\":{\"details\":\"Accrues interest whether or not the operation succeeds, unless reverted\",\"params\":{\"redeemTokens\":\"The number of cTokens to redeem into underlying\"},\"returns\":{\"_0\":\"uint 0=success, otherwise a failure (see ErrorReporter.sol for details)\"}},\"redeemUnderlying(uint256)\":{\"details\":\"Accrues interest whether or not the operation succeeds, unless reverted\",\"params\":{\"redeemAmount\":\"The amount of underlying to redeem\"},\"returns\":{\"_0\":\"uint 0=success, otherwise a failure (see ErrorReporter.sol for details)\"}},\"repayBorrow()\":{\"details\":\"Reverts upon any failure\"},\"repayBorrowBehalf(address)\":{\"details\":\"Reverts upon any failure\",\"params\":{\"borrower\":\"the account with the debt being payed off\"}},\"seize(address,address,uint256)\":{\"details\":\"Will fail unless called by another cToken during the process of liquidation.  Its absolutely critical to use msg.sender as the borrowed cToken and not a parameter.\",\"params\":{\"borrower\":\"The account having collateral seized\",\"liquidator\":\"The account receiving seized collateral\",\"seizeTokens\":\"The number of cTokens to seize\"},\"returns\":{\"_0\":\"uint 0=success, otherwise a failure (see ErrorReporter.sol for details)\"}},\"supplyRatePerBlock()\":{\"returns\":{\"_0\":\"The supply interest rate per block, scaled by 1e18\"}},\"totalBorrowsCurrent()\":{\"returns\":{\"_0\":\"The total borrows with interest\"}},\"transfer(address,uint256)\":{\"params\":{\"amount\":\"The number of tokens to transfer\",\"dst\":\"The address of the destination account\"},\"returns\":{\"_0\":\"Whether or not the transfer succeeded\"}},\"transferFrom(address,address,uint256)\":{\"params\":{\"amount\":\"The number of tokens to transfer\",\"dst\":\"The address of the destination account\",\"src\":\"The address of the source account\"},\"returns\":{\"_0\":\"Whether or not the transfer succeeded\"}}},\"title\":\"Compound's CEther Contract\",\"version\":1},\"userdoc\":{\"events\":{\"AccrueInterest(uint256,uint256,uint256,uint256)\":{\"notice\":\"Event emitted when interest is accrued\"},\"Approval(address,address,uint256)\":{\"notice\":\"EIP20 Approval event\"},\"Borrow(address,uint256,uint256,uint256)\":{\"notice\":\"Event emitted when underlying is borrowed\"},\"LiquidateBorrow(address,address,uint256,address,uint256)\":{\"notice\":\"Event emitted when a borrow is liquidated\"},\"Mint(address,uint256,uint256)\":{\"notice\":\"Event emitted when tokens are minted\"},\"NewAdmin(address,address)\":{\"notice\":\"Event emitted when pendingAdmin is accepted, which means admin is updated\"},\"NewComptroller(address,address)\":{\"notice\":\"Event emitted when comptroller is changed\"},\"NewMarketInterestRateModel(address,address)\":{\"notice\":\"Event emitted when interestRateModel is changed\"},\"NewPendingAdmin(address,address)\":{\"notice\":\"Event emitted when pendingAdmin is changed\"},\"NewReserveFactor(uint256,uint256)\":{\"notice\":\"Event emitted when the reserve factor is changed\"},\"Redeem(address,uint256,uint256)\":{\"notice\":\"Event emitted when tokens are redeemed\"},\"RepayBorrow(address,address,uint256,uint256,uint256)\":{\"notice\":\"Event emitted when a borrow is repaid\"},\"ReservesAdded(address,uint256,uint256)\":{\"notice\":\"Event emitted when the reserves are added\"},\"ReservesReduced(address,uint256,uint256)\":{\"notice\":\"Event emitted when the reserves are reduced\"},\"Transfer(address,address,uint256)\":{\"notice\":\"EIP20 Transfer event\"}},\"kind\":\"user\",\"methods\":{\"_acceptAdmin()\":{\"notice\":\"Accepts transfer of admin rights. msg.sender must be pendingAdmin\"},\"_addReserves()\":{\"notice\":\"The sender adds to reserves.\"},\"_claimAllYields(address)\":{\"notice\":\"Admin only blast integration\"},\"_reduceReserves(uint256)\":{\"notice\":\"Accrues interest and reduces reserves by transferring to admin\"},\"_setComptroller(address)\":{\"notice\":\"Sets a new comptroller for the market\"},\"_setInterestRateModel(address)\":{\"notice\":\"accrues interest and updates the interest rate model using _setInterestRateModelFresh\"},\"_setPendingAdmin(address)\":{\"notice\":\"Begins transfer of admin rights. The newPendingAdmin must call `_acceptAdmin` to finalize the transfer.\"},\"_setReserveFactor(uint256)\":{\"notice\":\"accrues interest and sets a new reserve factor for the protocol using _setReserveFactorFresh\"},\"accrualBlockNumber()\":{\"notice\":\"Block number that interest was last accrued at\"},\"accrueInterest()\":{\"notice\":\"Applies accrued interest to total borrows and reserves\"},\"admin()\":{\"notice\":\"Administrator for this contract\"},\"allowance(address,address)\":{\"notice\":\"Get the current allowance from `owner` for `spender`\"},\"approve(address,uint256)\":{\"notice\":\"Approve `spender` to transfer up to `amount` from `src`\"},\"balanceOf(address)\":{\"notice\":\"Get the token balance of the `owner`\"},\"balanceOfUnderlying(address)\":{\"notice\":\"Get the underlying balance of the `owner`\"},\"borrow(uint256)\":{\"notice\":\"Sender borrows assets from the protocol to their own address\"},\"borrowBalanceCurrent(address)\":{\"notice\":\"Accrue interest to updated borrowIndex and then calculate account's borrow balance using the updated borrowIndex\"},\"borrowBalanceStored(address)\":{\"notice\":\"Return the borrow balance of account based on stored data\"},\"borrowIndex()\":{\"notice\":\"Accumulator of the total earned interest rate since the opening of the market\"},\"borrowRatePerBlock()\":{\"notice\":\"Returns the current per-block borrow interest rate for this cToken\"},\"comptroller()\":{\"notice\":\"Contract which oversees inter-cToken operations\"},\"constructor\":{\"notice\":\"Construct a new CEther money market\"},\"decimals()\":{\"notice\":\"EIP-20 token decimals for this token\"},\"exchangeRateCurrent()\":{\"notice\":\"Accrue interest then return the up-to-date exchange rate\"},\"exchangeRateStored()\":{\"notice\":\"Calculates the exchange rate from the underlying to the CToken\"},\"getAccountSnapshot(address)\":{\"notice\":\"Get a snapshot of the account's balances, and the cached exchange rate\"},\"getCash()\":{\"notice\":\"Get cash balance of this cToken in the underlying asset\"},\"initialize(address,address,uint256,string,string,uint8)\":{\"notice\":\"Initialize the money market\"},\"interestRateModel()\":{\"notice\":\"Model which tells what the current interest rate should be\"},\"isCToken()\":{\"notice\":\"Indicator that this is a CToken contract (for inspection)\"},\"liquidateBorrow(address,address)\":{\"notice\":\"The sender liquidates the borrowers collateral.  The collateral seized is transferred to the liquidator.\"},\"mint()\":{\"notice\":\"Sender supplies assets into the market and receives cTokens in exchange\"},\"name()\":{\"notice\":\"EIP-20 token name for this token\"},\"pendingAdmin()\":{\"notice\":\"Pending administrator for this contract\"},\"protocolSeizeShareMantissa()\":{\"notice\":\"Share of seized collateral that is added to reserves\"},\"redeem(uint256)\":{\"notice\":\"Sender redeems cTokens in exchange for the underlying asset\"},\"redeemUnderlying(uint256)\":{\"notice\":\"Sender redeems cTokens in exchange for a specified amount of underlying asset\"},\"repayBorrow()\":{\"notice\":\"Sender repays their own borrow\"},\"repayBorrowBehalf(address)\":{\"notice\":\"Sender repays a borrow belonging to borrower\"},\"reserveFactorMantissa()\":{\"notice\":\"Fraction of interest currently set aside for reserves\"},\"seize(address,address,uint256)\":{\"notice\":\"Transfers collateral tokens (this market) to the liquidator.\"},\"supplyRatePerBlock()\":{\"notice\":\"Returns the current per-block supply interest rate for this cToken\"},\"symbol()\":{\"notice\":\"EIP-20 token symbol for this token\"},\"totalBorrows()\":{\"notice\":\"Total amount of outstanding borrows of the underlying in this market\"},\"totalBorrowsCurrent()\":{\"notice\":\"Returns the current total borrows plus accrued interest\"},\"totalReserves()\":{\"notice\":\"Total amount of reserves of the underlying held in this market\"},\"totalSupply()\":{\"notice\":\"Total number of tokens in circulation\"},\"transfer(address,uint256)\":{\"notice\":\"Transfer `amount` tokens from `msg.sender` to `dst`\"},\"transferFrom(address,address,uint256)\":{\"notice\":\"Transfer `amount` tokens from `src` to `dst`\"}},\"notice\":\"CToken which wraps Ether\",\"version\":1}},\"settings\":{\"compilationTarget\":{\"contracts/CEtherImmutable.sol\":\"CEtherImmutable\"},\"evmVersion\":\"london\",\"libraries\":{},\"metadata\":{\"bytecodeHash\":\"ipfs\",\"useLiteralContent\":true},\"optimizer\":{\"enabled\":true,\"runs\":200},\"remappings\":[]},\"sources\":{\"contracts/CEtherImmutable.sol\":{\"content\":\"// SPDX-License-Identifier: BSD-3-Clause\\npragma solidity ^0.8.10;\\n\\nimport \\\"./CToken.sol\\\";\\n\\n/**\\n * @title Compound's CEther Contract\\n * @notice CToken which wraps Ether\\n * @author Compound\\n */\\ncontract CEtherImmutable is CToken {\\n    /**\\n     * @notice Construct a new CEther money market\\n     * @param comptroller_ The address of the Comptroller\\n     * @param interestRateModel_ The address of the interest rate model\\n     * @param initialExchangeRateMantissa_ The initial exchange rate, scaled by 1e18\\n     * @param name_ ERC-20 name of this token\\n     * @param symbol_ ERC-20 symbol of this token\\n     * @param decimals_ ERC-20 decimal precision of this token\\n     * @param admin_ Address of the administrator of this token\\n     */\\n    constructor(ComptrollerInterface comptroller_,\\n                InterestRateModel interestRateModel_,\\n                uint initialExchangeRateMantissa_,\\n                string memory name_,\\n                string memory symbol_,\\n                uint8 decimals_,\\n                address payable admin_,\\n                address _pointsOperator) {\\n        // Creator of the contract is admin during initialization\\n        admin = payable(msg.sender);\\n\\n        initialize(comptroller_, interestRateModel_, initialExchangeRateMantissa_, name_, symbol_, decimals_);\\n\\n        // Set the proper admin now that initialization is done\\n        admin = admin_;\\n\\n        // Blast fancy\\n        IBlastPoints(0x2fc95838c71e76ec69ff817983BFf17c710F34E0).configurePointsOperator(_pointsOperator);\\n        IBlast(0x4300000000000000000000000000000000000002).configureClaimableGas(); \\n        IBlast(0x4300000000000000000000000000000000000002).configureClaimableYield();\\n        IBlast(0x4300000000000000000000000000000000000002).configureGovernor(_pointsOperator);\\n    }\\n\\n\\n    /*** User Interface ***/\\n\\n    /**\\n     * @notice Sender supplies assets into the market and receives cTokens in exchange\\n     * @dev Reverts upon any failure\\n     */\\n    function mint() external payable {\\n        mintInternal(msg.value);\\n    }\\n\\n    /**\\n     * @notice Sender redeems cTokens in exchange for the underlying asset\\n     * @dev Accrues interest whether or not the operation succeeds, unless reverted\\n     * @param redeemTokens The number of cTokens to redeem into underlying\\n     * @return uint 0=success, otherwise a failure (see ErrorReporter.sol for details)\\n     */\\n    function redeem(uint redeemTokens) external returns (uint) {\\n        redeemInternal(redeemTokens);\\n        return NO_ERROR;\\n    }\\n\\n    /**\\n     * @notice Sender redeems cTokens in exchange for a specified amount of underlying asset\\n     * @dev Accrues interest whether or not the operation succeeds, unless reverted\\n     * @param redeemAmount The amount of underlying to redeem\\n     * @return uint 0=success, otherwise a failure (see ErrorReporter.sol for details)\\n     */\\n    function redeemUnderlying(uint redeemAmount) external returns (uint) {\\n        redeemUnderlyingInternal(redeemAmount);\\n        return NO_ERROR;\\n    }\\n\\n    /**\\n      * @notice Sender borrows assets from the protocol to their own address\\n      * @param borrowAmount The amount of the underlying asset to borrow\\n      * @return uint 0=success, otherwise a failure (see ErrorReporter.sol for details)\\n      */\\n    function borrow(uint borrowAmount) external returns (uint) {\\n        borrowInternal(borrowAmount);\\n        return NO_ERROR;\\n    }\\n\\n    /**\\n     * @notice Sender repays their own borrow\\n     * @dev Reverts upon any failure\\n     */\\n    function repayBorrow() external payable {\\n        repayBorrowInternal(msg.value);\\n    }\\n\\n    /**\\n     * @notice Sender repays a borrow belonging to borrower\\n     * @dev Reverts upon any failure\\n     * @param borrower the account with the debt being payed off\\n     */\\n    function repayBorrowBehalf(address borrower) external payable {\\n        repayBorrowBehalfInternal(borrower, msg.value);\\n    }\\n\\n    /**\\n     * @notice The sender liquidates the borrowers collateral.\\n     *  The collateral seized is transferred to the liquidator.\\n     * @dev Reverts upon any failure\\n     * @param borrower The borrower of this cToken to be liquidated\\n     * @param cTokenCollateral The market in which to seize collateral from the borrower\\n     */\\n    function liquidateBorrow(address borrower, CToken cTokenCollateral) external payable {\\n        liquidateBorrowInternal(borrower, msg.value, cTokenCollateral);\\n    }\\n\\n    /**\\n     * @notice The sender adds to reserves.\\n     * @return uint 0=success, otherwise a failure (see ErrorReporter.sol for details)\\n     */\\n    function _addReserves() external payable returns (uint) {\\n        return _addReservesInternal(msg.value);\\n    }\\n\\n    /**\\n     * @notice Send Ether to CEther to mint\\n     */\\n    receive() external payable {\\n        mintInternal(msg.value);\\n    }\\n\\n    /*** Safe Token ***/\\n\\n    /**\\n     * @notice Gets balance of this contract in terms of Ether, before this message\\n     * @dev This excludes the value of the current message, if any\\n     * @return The quantity of Ether owned by this contract\\n     */\\n    function getCashPrior() override internal view returns (uint) {\\n        return address(this).balance - msg.value;\\n    }\\n\\n    /**\\n     * @notice Perform the actual transfer in, which is a no-op\\n     * @param from Address sending the Ether\\n     * @param amount Amount of Ether being sent\\n     * @return The actual amount of Ether transferred\\n     */\\n    function doTransferIn(address from, uint amount) override internal returns (uint) {\\n        // Sanity checks\\n        require(msg.sender == from, \\\"sender mismatch\\\");\\n        require(msg.value == amount, \\\"value mismatch\\\");\\n        return amount;\\n    }\\n\\n    function doTransferOut(address payable to, uint amount) virtual override internal {\\n        /* Send the Ether, with minimal gas and revert on failure */\\n        to.transfer(amount);\\n    }\\n\\n    /**\\n     * @notice Admin only blast integration\\n     * @param _receiver Treasury address\\n     */\\n    function _claimAllYields(address _receiver) external {\\n        if (msg.sender != admin) {\\n            revert (\\\"Admin check\\\");\\n        }\\n        IBlast(0x4300000000000000000000000000000000000002).claimAllGas(address(this), _receiver);\\n        IBlast(0x4300000000000000000000000000000000000002).claimAllYield(address(this), _receiver);\\n    }\\n}\",\"keccak256\":\"0x6f22cec5672701533db2a4c18737fc0dd89fbe2823161038679963081cbbd6b8\",\"license\":\"BSD-3-Clause\"},\"contracts/CToken.sol\":{\"content\":\"// SPDX-License-Identifier: BSD-3-Clause\\r\\npragma solidity ^0.8.10;\\r\\n\\r\\nimport \\\"./ComptrollerInterface.sol\\\";\\r\\nimport \\\"./CTokenInterfaces.sol\\\";\\r\\nimport \\\"./ErrorReporter.sol\\\";\\r\\nimport \\\"./EIP20Interface.sol\\\";\\r\\nimport \\\"./InterestRateModel.sol\\\";\\r\\nimport \\\"./ExponentialNoError.sol\\\";\\r\\nimport \\\"./IBlastPoints.sol\\\";\\r\\n\\r\\n/**\\r\\n * @title Compound's CToken Contract\\r\\n * @notice Abstract base for CTokens\\r\\n * @author Compound\\r\\n */\\r\\nabstract contract CToken is\\r\\n    CTokenInterface,\\r\\n    ExponentialNoError,\\r\\n    TokenErrorReporter\\r\\n{\\r\\n    /**\\r\\n     * @notice Initialize the money market\\r\\n     * @param comptroller_ The address of the Comptroller\\r\\n     * @param interestRateModel_ The address of the interest rate model\\r\\n     * @param initialExchangeRateMantissa_ The initial exchange rate, scaled by 1e18\\r\\n     * @param name_ EIP-20 name of this token\\r\\n     * @param symbol_ EIP-20 symbol of this token\\r\\n     * @param decimals_ EIP-20 decimal precision of this token\\r\\n     */\\r\\n    function initialize(\\r\\n        ComptrollerInterface comptroller_,\\r\\n        InterestRateModel interestRateModel_,\\r\\n        uint256 initialExchangeRateMantissa_,\\r\\n        string memory name_,\\r\\n        string memory symbol_,\\r\\n        uint8 decimals_\\r\\n    ) public {\\r\\n        require(msg.sender == admin, \\\"only admin may initialize the market\\\");\\r\\n        require(\\r\\n            accrualBlockNumber == 0 && borrowIndex == 0,\\r\\n            \\\"market may only be initialized once\\\"\\r\\n        );\\r\\n\\r\\n        // Set initial exchange rate\\r\\n        initialExchangeRateMantissa = initialExchangeRateMantissa_;\\r\\n        require(\\r\\n            initialExchangeRateMantissa > 0,\\r\\n            \\\"initial exchange rate must be greater than zero.\\\"\\r\\n        );\\r\\n\\r\\n        // Set the comptroller\\r\\n        uint256 err = _setComptroller(comptroller_);\\r\\n        require(err == NO_ERROR, \\\"setting comptroller failed\\\");\\r\\n\\r\\n        // Initialize block number and borrow index (block number mocks depend on comptroller being set)\\r\\n        accrualBlockNumber = getBlockNumber();\\r\\n        borrowIndex = mantissaOne;\\r\\n\\r\\n        // Set the interest rate model (depends on block number / borrow index)\\r\\n        err = _setInterestRateModelFresh(interestRateModel_);\\r\\n        require(err == NO_ERROR, \\\"setting interest rate model failed\\\");\\r\\n\\r\\n        name = name_;\\r\\n        symbol = symbol_;\\r\\n        decimals = decimals_;\\r\\n\\r\\n        // The counter starts true to prevent changing it from zero to non-zero (i.e. smaller cost/refund)\\r\\n        _notEntered = true;\\r\\n    }\\r\\n\\r\\n    /**\\r\\n     * @notice Transfer `tokens` tokens from `src` to `dst` by `spender`\\r\\n     * @dev Called by both `transfer` and `transferFrom` internally\\r\\n     * @param spender The address of the account performing the transfer\\r\\n     * @param src The address of the source account\\r\\n     * @param dst The address of the destination account\\r\\n     * @param tokens The number of tokens to transfer\\r\\n     * @return 0 if the transfer succeeded, else revert\\r\\n     */\\r\\n    function transferTokens(\\r\\n        address spender,\\r\\n        address src,\\r\\n        address dst,\\r\\n        uint256 tokens\\r\\n    ) internal returns (uint256) {\\r\\n        /* Fail if transfer not allowed */\\r\\n        uint256 allowed = comptroller.transferAllowed(\\r\\n            address(this),\\r\\n            src,\\r\\n            dst,\\r\\n            tokens\\r\\n        );\\r\\n        if (allowed != 0) {\\r\\n            revert TransferComptrollerRejection(allowed);\\r\\n        }\\r\\n\\r\\n        /* Do not allow self-transfers */\\r\\n        if (src == dst) {\\r\\n            revert TransferNotAllowed();\\r\\n        }\\r\\n\\r\\n        /* Get the allowance, infinite for the account owner */\\r\\n        uint256 startingAllowance = 0;\\r\\n        if (spender == src) {\\r\\n            startingAllowance = type(uint256).max;\\r\\n        } else {\\r\\n            startingAllowance = transferAllowances[src][spender];\\r\\n        }\\r\\n\\r\\n        /* Do the calculations, checking for {under,over}flow */\\r\\n        uint256 allowanceNew = startingAllowance - tokens;\\r\\n        uint256 srcTokensNew = accountTokens[src] - tokens;\\r\\n        uint256 dstTokensNew = accountTokens[dst] + tokens;\\r\\n\\r\\n        /////////////////////////\\r\\n        // EFFECTS & INTERACTIONS\\r\\n        // (No safe failures beyond this point)\\r\\n\\r\\n        accountTokens[src] = srcTokensNew;\\r\\n        accountTokens[dst] = dstTokensNew;\\r\\n\\r\\n        /* Eat some of the allowance (if necessary) */\\r\\n        if (startingAllowance != type(uint256).max) {\\r\\n            transferAllowances[src][spender] = allowanceNew;\\r\\n        }\\r\\n\\r\\n        /* We emit a Transfer event */\\r\\n        emit Transfer(src, dst, tokens);\\r\\n\\r\\n        // unused function\\r\\n        // comptroller.transferVerify(address(this), src, dst, tokens);\\r\\n\\r\\n        return NO_ERROR;\\r\\n    }\\r\\n\\r\\n    /**\\r\\n     * @notice Transfer `amount` tokens from `msg.sender` to `dst`\\r\\n     * @param dst The address of the destination account\\r\\n     * @param amount The number of tokens to transfer\\r\\n     * @return Whether or not the transfer succeeded\\r\\n     */\\r\\n    function transfer(address dst, uint256 amount)\\r\\n        external\\r\\n        override\\r\\n        nonReentrant\\r\\n        returns (bool)\\r\\n    {\\r\\n        return transferTokens(msg.sender, msg.sender, dst, amount) == NO_ERROR;\\r\\n    }\\r\\n\\r\\n    /**\\r\\n     * @notice Transfer `amount` tokens from `src` to `dst`\\r\\n     * @param src The address of the source account\\r\\n     * @param dst The address of the destination account\\r\\n     * @param amount The number of tokens to transfer\\r\\n     * @return Whether or not the transfer succeeded\\r\\n     */\\r\\n    function transferFrom(\\r\\n        address src,\\r\\n        address dst,\\r\\n        uint256 amount\\r\\n    ) external override nonReentrant returns (bool) {\\r\\n        return transferTokens(msg.sender, src, dst, amount) == NO_ERROR;\\r\\n    }\\r\\n\\r\\n    /**\\r\\n     * @notice Approve `spender` to transfer up to `amount` from `src`\\r\\n     * @dev This will overwrite the approval amount for `spender`\\r\\n     *  and is subject to issues noted [here](https://eips.ethereum.org/EIPS/eip-20#approve)\\r\\n     * @param spender The address of the account which may transfer tokens\\r\\n     * @param amount The number of tokens that are approved (uint256.max means infinite)\\r\\n     * @return Whether or not the approval succeeded\\r\\n     */\\r\\n    function approve(address spender, uint256 amount)\\r\\n        external\\r\\n        override\\r\\n        returns (bool)\\r\\n    {\\r\\n        address src = msg.sender;\\r\\n        transferAllowances[src][spender] = amount;\\r\\n        emit Approval(src, spender, amount);\\r\\n        return true;\\r\\n    }\\r\\n\\r\\n    /**\\r\\n     * @notice Get the current allowance from `owner` for `spender`\\r\\n     * @param owner The address of the account which owns the tokens to be spent\\r\\n     * @param spender The address of the account which may transfer tokens\\r\\n     * @return The number of tokens allowed to be spent (-1 means infinite)\\r\\n     */\\r\\n    function allowance(address owner, address spender)\\r\\n        external\\r\\n        view\\r\\n        override\\r\\n        returns (uint256)\\r\\n    {\\r\\n        return transferAllowances[owner][spender];\\r\\n    }\\r\\n\\r\\n    /**\\r\\n     * @notice Get the token balance of the `owner`\\r\\n     * @param owner The address of the account to query\\r\\n     * @return The number of tokens owned by `owner`\\r\\n     */\\r\\n    function balanceOf(address owner) external view override returns (uint256) {\\r\\n        return accountTokens[owner];\\r\\n    }\\r\\n\\r\\n    /**\\r\\n     * @notice Get the underlying balance of the `owner`\\r\\n     * @dev This also accrues interest in a transaction\\r\\n     * @param owner The address of the account to query\\r\\n     * @return The amount of underlying owned by `owner`\\r\\n     */\\r\\n    function balanceOfUnderlying(address owner)\\r\\n        external\\r\\n        override\\r\\n        returns (uint256)\\r\\n    {\\r\\n        Exp memory exchangeRate = Exp({mantissa: exchangeRateCurrent()});\\r\\n        return mul_ScalarTruncate(exchangeRate, accountTokens[owner]);\\r\\n    }\\r\\n\\r\\n    /**\\r\\n     * @notice Get a snapshot of the account's balances, and the cached exchange rate\\r\\n     * @dev This is used by comptroller to more efficiently perform liquidity checks.\\r\\n     * @param account Address of the account to snapshot\\r\\n     * @return (possible error, token balance, borrow balance, exchange rate mantissa)\\r\\n     */\\r\\n    function getAccountSnapshot(address account)\\r\\n        external\\r\\n        view\\r\\n        override\\r\\n        returns (\\r\\n            uint256,\\r\\n            uint256,\\r\\n            uint256,\\r\\n            uint256\\r\\n        )\\r\\n    {\\r\\n        return (\\r\\n            NO_ERROR,\\r\\n            accountTokens[account],\\r\\n            borrowBalanceStoredInternal(account),\\r\\n            exchangeRateStoredInternal()\\r\\n        );\\r\\n    }\\r\\n\\r\\n    /**\\r\\n     * @dev Function to simply retrieve block number\\r\\n     *  This exists mainly for inheriting test contracts to stub this result.\\r\\n     */\\r\\n    function getBlockNumber() internal view virtual returns (uint256) {\\r\\n        return block.timestamp;\\r\\n    }\\r\\n\\r\\n    /**\\r\\n     * @notice Returns the current per-block borrow interest rate for this cToken\\r\\n     * @return The borrow interest rate per block, scaled by 1e18\\r\\n     */\\r\\n    function borrowRatePerBlock() external view override returns (uint256) {\\r\\n        return\\r\\n            interestRateModel.getBorrowRate(\\r\\n                getCashPrior(),\\r\\n                totalBorrows,\\r\\n                totalReserves\\r\\n            );\\r\\n    }\\r\\n\\r\\n    /**\\r\\n     * @notice Returns the current per-block supply interest rate for this cToken\\r\\n     * @return The supply interest rate per block, scaled by 1e18\\r\\n     */\\r\\n    function supplyRatePerBlock() external view override returns (uint256) {\\r\\n        return\\r\\n            interestRateModel.getSupplyRate(\\r\\n                getCashPrior(),\\r\\n                totalBorrows,\\r\\n                totalReserves,\\r\\n                reserveFactorMantissa\\r\\n            );\\r\\n    }\\r\\n\\r\\n    /**\\r\\n     * @notice Returns the current total borrows plus accrued interest\\r\\n     * @return The total borrows with interest\\r\\n     */\\r\\n    function totalBorrowsCurrent()\\r\\n        external\\r\\n        override\\r\\n        nonReentrant\\r\\n        returns (uint256)\\r\\n    {\\r\\n        accrueInterest();\\r\\n        return totalBorrows;\\r\\n    }\\r\\n\\r\\n    /**\\r\\n     * @notice Accrue interest to updated borrowIndex and then calculate account's borrow balance using the updated borrowIndex\\r\\n     * @param account The address whose balance should be calculated after updating borrowIndex\\r\\n     * @return The calculated balance\\r\\n     */\\r\\n    function borrowBalanceCurrent(address account)\\r\\n        external\\r\\n        override\\r\\n        nonReentrant\\r\\n        returns (uint256)\\r\\n    {\\r\\n        accrueInterest();\\r\\n        return borrowBalanceStored(account);\\r\\n    }\\r\\n\\r\\n    /**\\r\\n     * @notice Return the borrow balance of account based on stored data\\r\\n     * @param account The address whose balance should be calculated\\r\\n     * @return The calculated balance\\r\\n     */\\r\\n    function borrowBalanceStored(address account)\\r\\n        public\\r\\n        view\\r\\n        override\\r\\n        returns (uint256)\\r\\n    {\\r\\n        return borrowBalanceStoredInternal(account);\\r\\n    }\\r\\n\\r\\n    /**\\r\\n     * @notice Return the borrow balance of account based on stored data\\r\\n     * @param account The address whose balance should be calculated\\r\\n     * @return (error code, the calculated balance or 0 if error code is non-zero)\\r\\n     */\\r\\n    function borrowBalanceStoredInternal(address account)\\r\\n        internal\\r\\n        view\\r\\n        returns (uint256)\\r\\n    {\\r\\n        /* Get borrowBalance and borrowIndex */\\r\\n        BorrowSnapshot storage borrowSnapshot = accountBorrows[account];\\r\\n\\r\\n        /* If borrowBalance = 0 then borrowIndex is likely also 0.\\r\\n         * Rather than failing the calculation with a division by 0, we immediately return 0 in this case.\\r\\n         */\\r\\n        if (borrowSnapshot.principal == 0) {\\r\\n            return 0;\\r\\n        }\\r\\n\\r\\n        /* Calculate new borrow balance using the interest index:\\r\\n         *  recentBorrowBalance = borrower.borrowBalance * market.borrowIndex / borrower.borrowIndex\\r\\n         */\\r\\n        uint256 principalTimesIndex = borrowSnapshot.principal * borrowIndex;\\r\\n        return principalTimesIndex / borrowSnapshot.interestIndex;\\r\\n    }\\r\\n\\r\\n    /**\\r\\n     * @notice Accrue interest then return the up-to-date exchange rate\\r\\n     * @return Calculated exchange rate scaled by 1e18\\r\\n     */\\r\\n    function exchangeRateCurrent()\\r\\n        public\\r\\n        override\\r\\n        nonReentrant\\r\\n        returns (uint256)\\r\\n    {\\r\\n        accrueInterest();\\r\\n        return exchangeRateStored();\\r\\n    }\\r\\n\\r\\n    /**\\r\\n     * @notice Calculates the exchange rate from the underlying to the CToken\\r\\n     * @dev This function does not accrue interest before calculating the exchange rate\\r\\n     * @return Calculated exchange rate scaled by 1e18\\r\\n     */\\r\\n    function exchangeRateStored() public view override returns (uint256) {\\r\\n        return exchangeRateStoredInternal();\\r\\n    }\\r\\n\\r\\n    /**\\r\\n     * @notice Calculates the exchange rate from the underlying to the CToken\\r\\n     * @dev This function does not accrue interest before calculating the exchange rate\\r\\n     * @return calculated exchange rate scaled by 1e18\\r\\n     */\\r\\n    function exchangeRateStoredInternal()\\r\\n        internal\\r\\n        view\\r\\n        virtual\\r\\n        returns (uint256)\\r\\n    {\\r\\n        uint256 _totalSupply = totalSupply;\\r\\n        if (_totalSupply == 0) {\\r\\n            /*\\r\\n             * If there are no tokens minted:\\r\\n             *  exchangeRate = initialExchangeRate\\r\\n             */\\r\\n            return initialExchangeRateMantissa;\\r\\n        } else {\\r\\n            /*\\r\\n             * Otherwise:\\r\\n             *  exchangeRate = (totalCash + totalBorrows - totalReserves) / totalSupply\\r\\n             */\\r\\n            uint256 totalCash = getCashPrior();\\r\\n            uint256 cashPlusBorrowsMinusReserves = totalCash +\\r\\n                totalBorrows -\\r\\n                totalReserves;\\r\\n            uint256 exchangeRate = (cashPlusBorrowsMinusReserves * expScale) /\\r\\n                _totalSupply;\\r\\n\\r\\n            return exchangeRate;\\r\\n        }\\r\\n    }\\r\\n\\r\\n    /**\\r\\n     * @notice Get cash balance of this cToken in the underlying asset\\r\\n     * @return The quantity of underlying asset owned by this contract\\r\\n     */\\r\\n    function getCash() external view override returns (uint256) {\\r\\n        return getCashPrior();\\r\\n    }\\r\\n\\r\\n    /**\\r\\n     * @notice Applies accrued interest to total borrows and reserves\\r\\n     * @dev This calculates interest accrued from the last checkpointed block\\r\\n     *   up to the current block and writes new checkpoint to storage.\\r\\n     */\\r\\n    function accrueInterest() public virtual override returns (uint256) {\\r\\n        /* Remember the initial block number */\\r\\n        uint256 currentBlockNumber = getBlockNumber();\\r\\n        uint256 accrualBlockNumberPrior = accrualBlockNumber;\\r\\n\\r\\n        /* Short-circuit accumulating 0 interest */\\r\\n        if (accrualBlockNumberPrior == currentBlockNumber) {\\r\\n            return NO_ERROR;\\r\\n        }\\r\\n\\r\\n        /* Read the previous values out of storage */\\r\\n        uint256 cashPrior = getCashPrior();\\r\\n        uint256 borrowsPrior = totalBorrows;\\r\\n        uint256 reservesPrior = totalReserves;\\r\\n        uint256 borrowIndexPrior = borrowIndex;\\r\\n\\r\\n        /* Calculate the current borrow interest rate */\\r\\n        uint256 borrowRateMantissa = interestRateModel.getBorrowRate(\\r\\n            cashPrior,\\r\\n            borrowsPrior,\\r\\n            reservesPrior\\r\\n        );\\r\\n        require(\\r\\n            borrowRateMantissa <= borrowRateMaxMantissa,\\r\\n            \\\"borrow rate is absurdly high\\\"\\r\\n        );\\r\\n\\r\\n        /* Calculate the number of blocks elapsed since the last accrual */\\r\\n        uint256 blockDelta = currentBlockNumber - accrualBlockNumberPrior;\\r\\n\\r\\n        /*\\r\\n         * Calculate the interest accumulated into borrows and reserves and the new index:\\r\\n         *  simpleInterestFactor = borrowRate * blockDelta\\r\\n         *  interestAccumulated = simpleInterestFactor * totalBorrows\\r\\n         *  totalBorrowsNew = interestAccumulated + totalBorrows\\r\\n         *  totalReservesNew = interestAccumulated * reserveFactor + totalReserves\\r\\n         *  borrowIndexNew = simpleInterestFactor * borrowIndex + borrowIndex\\r\\n         */\\r\\n\\r\\n        Exp memory simpleInterestFactor = mul_(\\r\\n            Exp({mantissa: borrowRateMantissa}),\\r\\n            blockDelta\\r\\n        );\\r\\n        uint256 interestAccumulated = mul_ScalarTruncate(\\r\\n            simpleInterestFactor,\\r\\n            borrowsPrior\\r\\n        );\\r\\n        uint256 totalBorrowsNew = interestAccumulated + borrowsPrior;\\r\\n        uint256 totalReservesNew = mul_ScalarTruncateAddUInt(\\r\\n            Exp({mantissa: reserveFactorMantissa}),\\r\\n            interestAccumulated,\\r\\n            reservesPrior\\r\\n        );\\r\\n        uint256 borrowIndexNew = mul_ScalarTruncateAddUInt(\\r\\n            simpleInterestFactor,\\r\\n            borrowIndexPrior,\\r\\n            borrowIndexPrior\\r\\n        );\\r\\n\\r\\n        /////////////////////////\\r\\n        // EFFECTS & INTERACTIONS\\r\\n        // (No safe failures beyond this point)\\r\\n\\r\\n        /* We write the previously calculated values into storage */\\r\\n        accrualBlockNumber = currentBlockNumber;\\r\\n        borrowIndex = borrowIndexNew;\\r\\n        totalBorrows = totalBorrowsNew;\\r\\n        totalReserves = totalReservesNew;\\r\\n\\r\\n        /* We emit an AccrueInterest event */\\r\\n        emit AccrueInterest(\\r\\n            cashPrior,\\r\\n            interestAccumulated,\\r\\n            borrowIndexNew,\\r\\n            totalBorrowsNew\\r\\n        );\\r\\n\\r\\n        return NO_ERROR;\\r\\n    }\\r\\n\\r\\n    /**\\r\\n     * @notice Sender supplies assets into the market and receives cTokens in exchange\\r\\n     * @dev Accrues interest whether or not the operation succeeds, unless reverted\\r\\n     * @param mintAmount The amount of the underlying asset to supply\\r\\n     */\\r\\n    function mintInternal(uint256 mintAmount) internal nonReentrant {\\r\\n        accrueInterest();\\r\\n        // mintFresh emits the actual Mint event if successful and logs on errors, so we don't need to\\r\\n        mintFresh(msg.sender, mintAmount);\\r\\n    }\\r\\n\\r\\n    /**\\r\\n     * @notice User supplies assets into the market and receives cTokens in exchange\\r\\n     * @dev Assumes interest has already been accrued up to the current block\\r\\n     * @param minter The address of the account which is supplying the assets\\r\\n     * @param mintAmount The amount of the underlying asset to supply\\r\\n     */\\r\\n    function mintFresh(address minter, uint256 mintAmount) internal {\\r\\n        /* Fail if mint not allowed */\\r\\n        uint256 allowed = comptroller.mintAllowed(\\r\\n            address(this),\\r\\n            minter,\\r\\n            mintAmount\\r\\n        );\\r\\n        if (allowed != 0) {\\r\\n            revert MintComptrollerRejection(allowed);\\r\\n        }\\r\\n\\r\\n        /* Verify market's block number equals current block number */\\r\\n        if (accrualBlockNumber != getBlockNumber()) {\\r\\n            revert MintFreshnessCheck();\\r\\n        }\\r\\n\\r\\n        Exp memory exchangeRate = Exp({mantissa: exchangeRateStoredInternal()});\\r\\n\\r\\n        /////////////////////////\\r\\n        // EFFECTS & INTERACTIONS\\r\\n        // (No safe failures beyond this point)\\r\\n\\r\\n        /*\\r\\n         *  We call `doTransferIn` for the minter and the mintAmount.\\r\\n         *  Note: The cToken must handle variations between ERC-20 and ETH underlying.\\r\\n         *  `doTransferIn` reverts if anything goes wrong, since we can't be sure if\\r\\n         *  side-effects occurred. The function returns the amount actually transferred,\\r\\n         *  in case of a fee. On success, the cToken holds an additional `actualMintAmount`\\r\\n         *  of cash.\\r\\n         */\\r\\n        uint256 actualMintAmount = doTransferIn(minter, mintAmount);\\r\\n\\r\\n        /*\\r\\n         * We get the current exchange rate and calculate the number of cTokens to be minted:\\r\\n         *  mintTokens = actualMintAmount / exchangeRate\\r\\n         */\\r\\n\\r\\n        uint256 mintTokens = div_(actualMintAmount, exchangeRate);\\r\\n\\r\\n        /*\\r\\n         * We calculate the new total supply of cTokens and minter token balance, checking for overflow:\\r\\n         *  totalSupplyNew = totalSupply + mintTokens\\r\\n         *  accountTokensNew = accountTokens[minter] + mintTokens\\r\\n         * And write them into storage\\r\\n         */\\r\\n        totalSupply = totalSupply + mintTokens;\\r\\n        accountTokens[minter] = accountTokens[minter] + mintTokens;\\r\\n\\r\\n        /* We emit a Mint event, and a Transfer event */\\r\\n        emit Mint(minter, actualMintAmount, mintTokens);\\r\\n        emit Transfer(address(this), minter, mintTokens);\\r\\n\\r\\n        /* We call the defense hook */\\r\\n        // unused function\\r\\n        // comptroller.mintVerify(address(this), minter, actualMintAmount, mintTokens);\\r\\n    }\\r\\n\\r\\n    /**\\r\\n     * @notice Sender redeems cTokens in exchange for the underlying asset\\r\\n     * @dev Accrues interest whether or not the operation succeeds, unless reverted\\r\\n     * @param redeemTokens The number of cTokens to redeem into underlying\\r\\n     */\\r\\n    function redeemInternal(uint256 redeemTokens) internal nonReentrant {\\r\\n        accrueInterest();\\r\\n        // redeemFresh emits redeem-specific logs on errors, so we don't need to\\r\\n        redeemFresh(payable(msg.sender), redeemTokens, 0);\\r\\n    }\\r\\n\\r\\n    /**\\r\\n     * @notice Sender redeems cTokens in exchange for a specified amount of underlying asset\\r\\n     * @dev Accrues interest whether or not the operation succeeds, unless reverted\\r\\n     * @param redeemAmount The amount of underlying to receive from redeeming cTokens\\r\\n     */\\r\\n    function redeemUnderlyingInternal(uint256 redeemAmount)\\r\\n        internal\\r\\n        nonReentrant\\r\\n    {\\r\\n        accrueInterest();\\r\\n        // redeemFresh emits redeem-specific logs on errors, so we don't need to\\r\\n        redeemFresh(payable(msg.sender), 0, redeemAmount);\\r\\n    }\\r\\n\\r\\n    /**\\r\\n     * @notice User redeems cTokens in exchange for the underlying asset\\r\\n     * @dev Assumes interest has already been accrued up to the current block\\r\\n     * @param redeemer The address of the account which is redeeming the tokens\\r\\n     * @param redeemTokensIn The number of cTokens to redeem into underlying (only one of redeemTokensIn or redeemAmountIn may be non-zero)\\r\\n     * @param redeemAmountIn The number of underlying tokens to receive from redeeming cTokens (only one of redeemTokensIn or redeemAmountIn may be non-zero)\\r\\n     */\\r\\n    function redeemFresh(\\r\\n        address payable redeemer,\\r\\n        uint256 redeemTokensIn,\\r\\n        uint256 redeemAmountIn\\r\\n    ) internal {\\r\\n        require(\\r\\n            redeemTokensIn == 0 || redeemAmountIn == 0,\\r\\n            \\\"one of redeemTokensIn or redeemAmountIn must be zero\\\"\\r\\n        );\\r\\n\\r\\n        /* exchangeRate = invoke Exchange Rate Stored() */\\r\\n        Exp memory exchangeRate = Exp({mantissa: exchangeRateStoredInternal()});\\r\\n\\r\\n        uint256 redeemTokens;\\r\\n        uint256 redeemAmount;\\r\\n        /* If redeemTokensIn > 0: */\\r\\n        if (redeemTokensIn > 0) {\\r\\n            /*\\r\\n             * We calculate the exchange rate and the amount of underlying to be redeemed:\\r\\n             *  redeemTokens = redeemTokensIn\\r\\n             *  redeemAmount = redeemTokensIn x exchangeRateCurrent\\r\\n             */\\r\\n            redeemTokens = redeemTokensIn;\\r\\n            redeemAmount = mul_ScalarTruncate(exchangeRate, redeemTokensIn);\\r\\n        } else {\\r\\n            /*\\r\\n             * We get the current exchange rate and calculate the amount to be redeemed:\\r\\n             *  redeemTokens = redeemAmountIn / exchangeRate\\r\\n             *  redeemAmount = redeemAmountIn\\r\\n             */\\r\\n            redeemTokens = div_(redeemAmountIn, exchangeRate);\\r\\n            redeemAmount = redeemAmountIn;\\r\\n        }\\r\\n\\r\\n        /* Fail if redeem not allowed */\\r\\n        uint256 allowed = comptroller.redeemAllowed(\\r\\n            address(this),\\r\\n            redeemer,\\r\\n            redeemTokens\\r\\n        );\\r\\n        if (allowed != 0) {\\r\\n            revert RedeemComptrollerRejection(allowed);\\r\\n        }\\r\\n\\r\\n        /* Verify market's block number equals current block number */\\r\\n        if (accrualBlockNumber != getBlockNumber()) {\\r\\n            revert RedeemFreshnessCheck();\\r\\n        }\\r\\n\\r\\n        /* Fail gracefully if protocol has insufficient cash */\\r\\n        if (getCashPrior() < redeemAmount) {\\r\\n            revert RedeemTransferOutNotPossible();\\r\\n        }\\r\\n\\r\\n        /////////////////////////\\r\\n        // EFFECTS & INTERACTIONS\\r\\n        // (No safe failures beyond this point)\\r\\n\\r\\n        /*\\r\\n         * We write the previously calculated values into storage.\\r\\n         *  Note: Avoid token reentrancy attacks by writing reduced supply before external transfer.\\r\\n         */\\r\\n        totalSupply = totalSupply - redeemTokens;\\r\\n        accountTokens[redeemer] = accountTokens[redeemer] - redeemTokens;\\r\\n\\r\\n        /*\\r\\n         * We invoke doTransferOut for the redeemer and the redeemAmount.\\r\\n         *  Note: The cToken must handle variations between ERC-20 and ETH underlying.\\r\\n         *  On success, the cToken has redeemAmount less of cash.\\r\\n         *  doTransferOut reverts if anything goes wrong, since we can't be sure if side effects occurred.\\r\\n         */\\r\\n        doTransferOut(redeemer, redeemAmount);\\r\\n\\r\\n        /* We emit a Transfer event, and a Redeem event */\\r\\n        emit Transfer(redeemer, address(this), redeemTokens);\\r\\n        emit Redeem(redeemer, redeemAmount, redeemTokens);\\r\\n\\r\\n        /* We call the defense hook */\\r\\n        comptroller.redeemVerify(\\r\\n            address(this),\\r\\n            redeemer,\\r\\n            redeemAmount,\\r\\n            redeemTokens\\r\\n        );\\r\\n    }\\r\\n\\r\\n    /**\\r\\n     * @notice Sender borrows assets from the protocol to their own address\\r\\n     * @param borrowAmount The amount of the underlying asset to borrow\\r\\n     */\\r\\n    function borrowInternal(uint256 borrowAmount) internal nonReentrant {\\r\\n        accrueInterest();\\r\\n        // borrowFresh emits borrow-specific logs on errors, so we don't need to\\r\\n        borrowFresh(payable(msg.sender), borrowAmount);\\r\\n    }\\r\\n\\r\\n    /**\\r\\n     * @notice Users borrow assets from the protocol to their own address\\r\\n     * @param borrowAmount The amount of the underlying asset to borrow\\r\\n     */\\r\\n    function borrowFresh(address payable borrower, uint256 borrowAmount)\\r\\n        internal\\r\\n    {\\r\\n        /* Fail if borrow not allowed */\\r\\n        uint256 allowed = comptroller.borrowAllowed(\\r\\n            address(this),\\r\\n            borrower,\\r\\n            borrowAmount\\r\\n        );\\r\\n        if (allowed != 0) {\\r\\n            revert BorrowComptrollerRejection(allowed);\\r\\n        }\\r\\n\\r\\n        /* Verify market's block number equals current block number */\\r\\n        if (accrualBlockNumber != getBlockNumber()) {\\r\\n            revert BorrowFreshnessCheck();\\r\\n        }\\r\\n\\r\\n        /* Fail gracefully if protocol has insufficient underlying cash */\\r\\n        if (getCashPrior() < borrowAmount) {\\r\\n            revert BorrowCashNotAvailable();\\r\\n        }\\r\\n\\r\\n        /*\\r\\n         * We calculate the new borrower and total borrow balances, failing on overflow:\\r\\n         *  accountBorrowNew = accountBorrow + borrowAmount\\r\\n         *  totalBorrowsNew = totalBorrows + borrowAmount\\r\\n         */\\r\\n        uint256 accountBorrowsPrev = borrowBalanceStoredInternal(borrower);\\r\\n        uint256 accountBorrowsNew = accountBorrowsPrev + borrowAmount;\\r\\n        uint256 totalBorrowsNew = totalBorrows + borrowAmount;\\r\\n\\r\\n        /////////////////////////\\r\\n        // EFFECTS & INTERACTIONS\\r\\n        // (No safe failures beyond this point)\\r\\n\\r\\n        /*\\r\\n         * We write the previously calculated values into storage.\\r\\n         *  Note: Avoid token reentrancy attacks by writing increased borrow before external transfer.\\r\\n        `*/\\r\\n        accountBorrows[borrower].principal = accountBorrowsNew;\\r\\n        accountBorrows[borrower].interestIndex = borrowIndex;\\r\\n        totalBorrows = totalBorrowsNew;\\r\\n\\r\\n        /*\\r\\n         * We invoke doTransferOut for the borrower and the borrowAmount.\\r\\n         *  Note: The cToken must handle variations between ERC-20 and ETH underlying.\\r\\n         *  On success, the cToken borrowAmount less of cash.\\r\\n         *  doTransferOut reverts if anything goes wrong, since we can't be sure if side effects occurred.\\r\\n         */\\r\\n        doTransferOut(borrower, borrowAmount);\\r\\n\\r\\n        /* We emit a Borrow event */\\r\\n        emit Borrow(borrower, borrowAmount, accountBorrowsNew, totalBorrowsNew);\\r\\n    }\\r\\n\\r\\n    /**\\r\\n     * @notice Sender repays their own borrow\\r\\n     * @param repayAmount The amount to repay, or -1 for the full outstanding amount\\r\\n     */\\r\\n    function repayBorrowInternal(uint256 repayAmount) internal nonReentrant {\\r\\n        accrueInterest();\\r\\n        // repayBorrowFresh emits repay-borrow-specific logs on errors, so we don't need to\\r\\n        repayBorrowFresh(msg.sender, msg.sender, repayAmount);\\r\\n    }\\r\\n\\r\\n    /**\\r\\n     * @notice Sender repays a borrow belonging to borrower\\r\\n     * @param borrower the account with the debt being payed off\\r\\n     * @param repayAmount The amount to repay, or -1 for the full outstanding amount\\r\\n     */\\r\\n    function repayBorrowBehalfInternal(address borrower, uint256 repayAmount)\\r\\n        internal\\r\\n        nonReentrant\\r\\n    {\\r\\n        accrueInterest();\\r\\n        // repayBorrowFresh emits repay-borrow-specific logs on errors, so we don't need to\\r\\n        repayBorrowFresh(msg.sender, borrower, repayAmount);\\r\\n    }\\r\\n\\r\\n    /**\\r\\n     * @notice Borrows are repaid by another user (possibly the borrower).\\r\\n     * @param payer the account paying off the borrow\\r\\n     * @param borrower the account with the debt being payed off\\r\\n     * @param repayAmount the amount of underlying tokens being returned, or -1 for the full outstanding amount\\r\\n     * @return (uint) the actual repayment amount.\\r\\n     */\\r\\n    function repayBorrowFresh(\\r\\n        address payer,\\r\\n        address borrower,\\r\\n        uint256 repayAmount\\r\\n    ) internal returns (uint256) {\\r\\n        /* Fail if repayBorrow not allowed */\\r\\n        uint256 allowed = comptroller.repayBorrowAllowed(\\r\\n            address(this),\\r\\n            payer,\\r\\n            borrower,\\r\\n            repayAmount\\r\\n        );\\r\\n        if (allowed != 0) {\\r\\n            revert RepayBorrowComptrollerRejection(allowed);\\r\\n        }\\r\\n\\r\\n        /* Verify market's block number equals current block number */\\r\\n        if (accrualBlockNumber != getBlockNumber()) {\\r\\n            revert RepayBorrowFreshnessCheck();\\r\\n        }\\r\\n\\r\\n        /* We fetch the amount the borrower owes, with accumulated interest */\\r\\n        uint256 accountBorrowsPrev = borrowBalanceStoredInternal(borrower);\\r\\n\\r\\n        /* If repayAmount == -1, repayAmount = accountBorrows */\\r\\n        uint256 repayAmountFinal = repayAmount == type(uint256).max\\r\\n            ? accountBorrowsPrev\\r\\n            : repayAmount;\\r\\n\\r\\n        /////////////////////////\\r\\n        // EFFECTS & INTERACTIONS\\r\\n        // (No safe failures beyond this point)\\r\\n\\r\\n        /*\\r\\n         * We call doTransferIn for the payer and the repayAmount\\r\\n         *  Note: The cToken must handle variations between ERC-20 and ETH underlying.\\r\\n         *  On success, the cToken holds an additional repayAmount of cash.\\r\\n         *  doTransferIn reverts if anything goes wrong, since we can't be sure if side effects occurred.\\r\\n         *   it returns the amount actually transferred, in case of a fee.\\r\\n         */\\r\\n        uint256 actualRepayAmount = doTransferIn(payer, repayAmountFinal);\\r\\n\\r\\n        /*\\r\\n         * We calculate the new borrower and total borrow balances, failing on underflow:\\r\\n         *  accountBorrowsNew = accountBorrows - actualRepayAmount\\r\\n         *  totalBorrowsNew = totalBorrows - actualRepayAmount\\r\\n         */\\r\\n        uint256 accountBorrowsNew = accountBorrowsPrev - actualRepayAmount;\\r\\n        uint256 totalBorrowsNew = totalBorrows - actualRepayAmount;\\r\\n\\r\\n        /* We write the previously calculated values into storage */\\r\\n        accountBorrows[borrower].principal = accountBorrowsNew;\\r\\n        accountBorrows[borrower].interestIndex = borrowIndex;\\r\\n        totalBorrows = totalBorrowsNew;\\r\\n\\r\\n        /* We emit a RepayBorrow event */\\r\\n        emit RepayBorrow(\\r\\n            payer,\\r\\n            borrower,\\r\\n            actualRepayAmount,\\r\\n            accountBorrowsNew,\\r\\n            totalBorrowsNew\\r\\n        );\\r\\n\\r\\n        return actualRepayAmount;\\r\\n    }\\r\\n\\r\\n    /**\\r\\n     * @notice The sender liquidates the borrowers collateral.\\r\\n     *  The collateral seized is transferred to the liquidator.\\r\\n     * @param borrower The borrower of this cToken to be liquidated\\r\\n     * @param cTokenCollateral The market in which to seize collateral from the borrower\\r\\n     * @param repayAmount The amount of the underlying borrowed asset to repay\\r\\n     */\\r\\n    function liquidateBorrowInternal(\\r\\n        address borrower,\\r\\n        uint256 repayAmount,\\r\\n        CTokenInterface cTokenCollateral\\r\\n    ) internal nonReentrant {\\r\\n        accrueInterest();\\r\\n\\r\\n        uint256 error = cTokenCollateral.accrueInterest();\\r\\n        if (error != NO_ERROR) {\\r\\n            // accrueInterest emits logs on errors, but we still want to log the fact that an attempted liquidation failed\\r\\n            revert LiquidateAccrueCollateralInterestFailed(error);\\r\\n        }\\r\\n\\r\\n        // liquidateBorrowFresh emits borrow-specific logs on errors, so we don't need to\\r\\n        liquidateBorrowFresh(\\r\\n            msg.sender,\\r\\n            borrower,\\r\\n            repayAmount,\\r\\n            cTokenCollateral\\r\\n        );\\r\\n    }\\r\\n\\r\\n    /**\\r\\n     * @notice The liquidator liquidates the borrowers collateral.\\r\\n     *  The collateral seized is transferred to the liquidator.\\r\\n     * @param borrower The borrower of this cToken to be liquidated\\r\\n     * @param liquidator The address repaying the borrow and seizing collateral\\r\\n     * @param cTokenCollateral The market in which to seize collateral from the borrower\\r\\n     * @param repayAmount The amount of the underlying borrowed asset to repay\\r\\n     */\\r\\n    function liquidateBorrowFresh(\\r\\n        address liquidator,\\r\\n        address borrower,\\r\\n        uint256 repayAmount,\\r\\n        CTokenInterface cTokenCollateral\\r\\n    ) internal {\\r\\n        /* Fail if liquidate not allowed */\\r\\n        uint256 allowed = comptroller.liquidateBorrowAllowed(\\r\\n            address(this),\\r\\n            address(cTokenCollateral),\\r\\n            liquidator,\\r\\n            borrower,\\r\\n            repayAmount\\r\\n        );\\r\\n        if (allowed != 0) {\\r\\n            revert LiquidateComptrollerRejection(allowed);\\r\\n        }\\r\\n\\r\\n        /* Verify market's block number equals current block number */\\r\\n        if (accrualBlockNumber != getBlockNumber()) {\\r\\n            revert LiquidateFreshnessCheck();\\r\\n        }\\r\\n\\r\\n        /* Verify cTokenCollateral market's block number equals current block number */\\r\\n        if (cTokenCollateral.accrualBlockNumber() != getBlockNumber()) {\\r\\n            revert LiquidateCollateralFreshnessCheck();\\r\\n        }\\r\\n\\r\\n        /* Fail if borrower = liquidator */\\r\\n        if (borrower == liquidator) {\\r\\n            revert LiquidateLiquidatorIsBorrower();\\r\\n        }\\r\\n\\r\\n        /* Fail if repayAmount = 0 */\\r\\n        if (repayAmount == 0) {\\r\\n            revert LiquidateCloseAmountIsZero();\\r\\n        }\\r\\n\\r\\n        /* Fail if repayAmount = -1 */\\r\\n        if (repayAmount == type(uint256).max) {\\r\\n            revert LiquidateCloseAmountIsUintMax();\\r\\n        }\\r\\n\\r\\n        /* Fail if repayBorrow fails */\\r\\n        uint256 actualRepayAmount = repayBorrowFresh(\\r\\n            liquidator,\\r\\n            borrower,\\r\\n            repayAmount\\r\\n        );\\r\\n\\r\\n        /////////////////////////\\r\\n        // EFFECTS & INTERACTIONS\\r\\n        // (No safe failures beyond this point)\\r\\n\\r\\n        /* We calculate the number of collateral tokens that will be seized */\\r\\n        (uint256 amountSeizeError, uint256 seizeTokens) = comptroller\\r\\n            .liquidateCalculateSeizeTokens(\\r\\n                address(this),\\r\\n                address(cTokenCollateral),\\r\\n                actualRepayAmount\\r\\n            );\\r\\n        require(\\r\\n            amountSeizeError == NO_ERROR,\\r\\n            \\\"LIQUIDATE_COMPTROLLER_CALCULATE_AMOUNT_SEIZE_FAILED\\\"\\r\\n        );\\r\\n\\r\\n        /* Revert if borrower collateral token balance < seizeTokens */\\r\\n        require(\\r\\n            cTokenCollateral.balanceOf(borrower) >= seizeTokens,\\r\\n            \\\"LIQUIDATE_SEIZE_TOO_MUCH\\\"\\r\\n        );\\r\\n\\r\\n        // If this is also the collateral, run seizeInternal to avoid re-entrancy, otherwise make an external call\\r\\n        if (address(cTokenCollateral) == address(this)) {\\r\\n            seizeInternal(address(this), liquidator, borrower, seizeTokens);\\r\\n        } else {\\r\\n            require(\\r\\n                cTokenCollateral.seize(liquidator, borrower, seizeTokens) ==\\r\\n                    NO_ERROR,\\r\\n                \\\"token seizure failed\\\"\\r\\n            );\\r\\n        }\\r\\n\\r\\n        /* We emit a LiquidateBorrow event */\\r\\n        emit LiquidateBorrow(\\r\\n            liquidator,\\r\\n            borrower,\\r\\n            actualRepayAmount,\\r\\n            address(cTokenCollateral),\\r\\n            seizeTokens\\r\\n        );\\r\\n    }\\r\\n\\r\\n    /**\\r\\n     * @notice Transfers collateral tokens (this market) to the liquidator.\\r\\n     * @dev Will fail unless called by another cToken during the process of liquidation.\\r\\n     *  Its absolutely critical to use msg.sender as the borrowed cToken and not a parameter.\\r\\n     * @param liquidator The account receiving seized collateral\\r\\n     * @param borrower The account having collateral seized\\r\\n     * @param seizeTokens The number of cTokens to seize\\r\\n     * @return uint 0=success, otherwise a failure (see ErrorReporter.sol for details)\\r\\n     */\\r\\n    function seize(\\r\\n        address liquidator,\\r\\n        address borrower,\\r\\n        uint256 seizeTokens\\r\\n    ) external override nonReentrant returns (uint256) {\\r\\n        seizeInternal(msg.sender, liquidator, borrower, seizeTokens);\\r\\n\\r\\n        return NO_ERROR;\\r\\n    }\\r\\n\\r\\n    /**\\r\\n     * @notice Transfers collateral tokens (this market) to the liquidator.\\r\\n     * @dev Called only during an in-kind liquidation, or by liquidateBorrow during the liquidation of another CToken.\\r\\n     *  Its absolutely critical to use msg.sender as the seizer cToken and not a parameter.\\r\\n     * @param seizerToken The contract seizing the collateral (i.e. borrowed cToken)\\r\\n     * @param liquidator The account receiving seized collateral\\r\\n     * @param borrower The account having collateral seized\\r\\n     * @param seizeTokens The number of cTokens to seize\\r\\n     */\\r\\n    function seizeInternal(\\r\\n        address seizerToken,\\r\\n        address liquidator,\\r\\n        address borrower,\\r\\n        uint256 seizeTokens\\r\\n    ) internal {\\r\\n        /* Fail if seize not allowed */\\r\\n        uint256 allowed = comptroller.seizeAllowed(\\r\\n            address(this),\\r\\n            seizerToken,\\r\\n            liquidator,\\r\\n            borrower,\\r\\n            seizeTokens\\r\\n        );\\r\\n        if (allowed != 0) {\\r\\n            revert LiquidateSeizeComptrollerRejection(allowed);\\r\\n        }\\r\\n\\r\\n        /* Fail if borrower = liquidator */\\r\\n        if (borrower == liquidator) {\\r\\n            revert LiquidateSeizeLiquidatorIsBorrower();\\r\\n        }\\r\\n\\r\\n        /*\\r\\n         * We calculate the new borrower and liquidator token balances, failing on underflow/overflow:\\r\\n         *  borrowerTokensNew = accountTokens[borrower] - seizeTokens\\r\\n         *  liquidatorTokensNew = accountTokens[liquidator] + seizeTokens\\r\\n         */\\r\\n        uint256 protocolSeizeTokens = mul_(\\r\\n            seizeTokens,\\r\\n            Exp({mantissa: protocolSeizeShareMantissa})\\r\\n        );\\r\\n        uint256 liquidatorSeizeTokens = seizeTokens - protocolSeizeTokens;\\r\\n        Exp memory exchangeRate = Exp({mantissa: exchangeRateStoredInternal()});\\r\\n        uint256 protocolSeizeAmount = mul_ScalarTruncate(\\r\\n            exchangeRate,\\r\\n            protocolSeizeTokens\\r\\n        );\\r\\n        uint256 totalReservesNew = totalReserves + protocolSeizeAmount;\\r\\n\\r\\n        /////////////////////////\\r\\n        // EFFECTS & INTERACTIONS\\r\\n        // (No safe failures beyond this point)\\r\\n\\r\\n        /* We write the calculated values into storage */\\r\\n        totalReserves = totalReservesNew;\\r\\n        totalSupply = totalSupply - protocolSeizeTokens;\\r\\n        accountTokens[borrower] = accountTokens[borrower] - seizeTokens;\\r\\n        accountTokens[liquidator] =\\r\\n            accountTokens[liquidator] +\\r\\n            liquidatorSeizeTokens;\\r\\n\\r\\n        /* Emit a Transfer event */\\r\\n        emit Transfer(borrower, liquidator, liquidatorSeizeTokens);\\r\\n        emit Transfer(borrower, address(this), protocolSeizeTokens);\\r\\n        emit ReservesAdded(\\r\\n            address(this),\\r\\n            protocolSeizeAmount,\\r\\n            totalReservesNew\\r\\n        );\\r\\n    }\\r\\n\\r\\n    /*** Admin Functions ***/\\r\\n\\r\\n    /**\\r\\n     * @notice Begins transfer of admin rights. The newPendingAdmin must call `_acceptAdmin` to finalize the transfer.\\r\\n     * @dev Admin function to begin change of admin. The newPendingAdmin must call `_acceptAdmin` to finalize the transfer.\\r\\n     * @param newPendingAdmin New pending admin.\\r\\n     * @return uint 0=success, otherwise a failure (see ErrorReporter.sol for details)\\r\\n     */\\r\\n    function _setPendingAdmin(address payable newPendingAdmin)\\r\\n        external\\r\\n        override\\r\\n        returns (uint256)\\r\\n    {\\r\\n        // Check caller = admin\\r\\n        if (msg.sender != admin) {\\r\\n            revert SetPendingAdminOwnerCheck();\\r\\n        }\\r\\n\\r\\n        // Save current value, if any, for inclusion in log\\r\\n        address oldPendingAdmin = pendingAdmin;\\r\\n\\r\\n        // Store pendingAdmin with value newPendingAdmin\\r\\n        pendingAdmin = newPendingAdmin;\\r\\n\\r\\n        // Emit NewPendingAdmin(oldPendingAdmin, newPendingAdmin)\\r\\n        emit NewPendingAdmin(oldPendingAdmin, newPendingAdmin);\\r\\n\\r\\n        return NO_ERROR;\\r\\n    }\\r\\n\\r\\n    /**\\r\\n     * @notice Accepts transfer of admin rights. msg.sender must be pendingAdmin\\r\\n     * @dev Admin function for pending admin to accept role and update admin\\r\\n     * @return uint 0=success, otherwise a failure (see ErrorReporter.sol for details)\\r\\n     */\\r\\n    function _acceptAdmin() external override returns (uint256) {\\r\\n        // Check caller is pendingAdmin and pendingAdmin \\u2260 address(0)\\r\\n        if (msg.sender != pendingAdmin || msg.sender == address(0)) {\\r\\n            revert AcceptAdminPendingAdminCheck();\\r\\n        }\\r\\n\\r\\n        // Save current values for inclusion in log\\r\\n        address oldAdmin = admin;\\r\\n        address oldPendingAdmin = pendingAdmin;\\r\\n\\r\\n        // Store admin with value pendingAdmin\\r\\n        admin = pendingAdmin;\\r\\n\\r\\n        // Clear the pending value\\r\\n        pendingAdmin = payable(address(0));\\r\\n\\r\\n        emit NewAdmin(oldAdmin, admin);\\r\\n        emit NewPendingAdmin(oldPendingAdmin, pendingAdmin);\\r\\n\\r\\n        return NO_ERROR;\\r\\n    }\\r\\n\\r\\n    /**\\r\\n     * @notice Sets a new comptroller for the market\\r\\n     * @dev Admin function to set a new comptroller\\r\\n     * @return uint 0=success, otherwise a failure (see ErrorReporter.sol for details)\\r\\n     */\\r\\n    function _setComptroller(ComptrollerInterface newComptroller)\\r\\n        public\\r\\n        override\\r\\n        returns (uint256)\\r\\n    {\\r\\n        // Check caller is admin\\r\\n        if (msg.sender != admin) {\\r\\n            revert SetComptrollerOwnerCheck();\\r\\n        }\\r\\n\\r\\n        ComptrollerInterface oldComptroller = comptroller;\\r\\n        // Ensure invoke comptroller.isComptroller() returns true\\r\\n        require(newComptroller.isComptroller(), \\\"marker method returned false\\\");\\r\\n\\r\\n        // Set market's comptroller to newComptroller\\r\\n        comptroller = newComptroller;\\r\\n\\r\\n        // Emit NewComptroller(oldComptroller, newComptroller)\\r\\n        emit NewComptroller(oldComptroller, newComptroller);\\r\\n\\r\\n        return NO_ERROR;\\r\\n    }\\r\\n\\r\\n    /**\\r\\n     * @notice accrues interest and sets a new reserve factor for the protocol using _setReserveFactorFresh\\r\\n     * @dev Admin function to accrue interest and set a new reserve factor\\r\\n     * @return uint 0=success, otherwise a failure (see ErrorReporter.sol for details)\\r\\n     */\\r\\n    function _setReserveFactor(uint256 newReserveFactorMantissa)\\r\\n        external\\r\\n        override\\r\\n        nonReentrant\\r\\n        returns (uint256)\\r\\n    {\\r\\n        accrueInterest();\\r\\n        // _setReserveFactorFresh emits reserve-factor-specific logs on errors, so we don't need to.\\r\\n        return _setReserveFactorFresh(newReserveFactorMantissa);\\r\\n    }\\r\\n\\r\\n    /**\\r\\n     * @notice Sets a new reserve factor for the protocol (*requires fresh interest accrual)\\r\\n     * @dev Admin function to set a new reserve factor\\r\\n     * @return uint 0=success, otherwise a failure (see ErrorReporter.sol for details)\\r\\n     */\\r\\n    function _setReserveFactorFresh(uint256 newReserveFactorMantissa)\\r\\n        internal\\r\\n        returns (uint256)\\r\\n    {\\r\\n        // Check caller is admin\\r\\n        if (msg.sender != admin) {\\r\\n            revert SetReserveFactorAdminCheck();\\r\\n        }\\r\\n\\r\\n        // Verify market's block number equals current block number\\r\\n        if (accrualBlockNumber != getBlockNumber()) {\\r\\n            revert SetReserveFactorFreshCheck();\\r\\n        }\\r\\n\\r\\n        // Check newReserveFactor \\u2264 maxReserveFactor\\r\\n        if (newReserveFactorMantissa > reserveFactorMaxMantissa) {\\r\\n            revert SetReserveFactorBoundsCheck();\\r\\n        }\\r\\n\\r\\n        uint256 oldReserveFactorMantissa = reserveFactorMantissa;\\r\\n        reserveFactorMantissa = newReserveFactorMantissa;\\r\\n\\r\\n        emit NewReserveFactor(\\r\\n            oldReserveFactorMantissa,\\r\\n            newReserveFactorMantissa\\r\\n        );\\r\\n\\r\\n        return NO_ERROR;\\r\\n    }\\r\\n\\r\\n    /**\\r\\n     * @notice Accrues interest and reduces reserves by transferring from msg.sender\\r\\n     * @param addAmount Amount of addition to reserves\\r\\n     * @return uint 0=success, otherwise a failure (see ErrorReporter.sol for details)\\r\\n     */\\r\\n    function _addReservesInternal(uint256 addAmount)\\r\\n        internal\\r\\n        nonReentrant\\r\\n        returns (uint256)\\r\\n    {\\r\\n        accrueInterest();\\r\\n\\r\\n        // _addReservesFresh emits reserve-addition-specific logs on errors, so we don't need to.\\r\\n        _addReservesFresh(addAmount);\\r\\n        return NO_ERROR;\\r\\n    }\\r\\n\\r\\n    /**\\r\\n     * @notice Add reserves by transferring from caller\\r\\n     * @dev Requires fresh interest accrual\\r\\n     * @param addAmount Amount of addition to reserves\\r\\n     * @return (uint, uint) An error code (0=success, otherwise a failure (see ErrorReporter.sol for details)) and the actual amount added, net token fees\\r\\n     */\\r\\n    function _addReservesFresh(uint256 addAmount)\\r\\n        internal\\r\\n        returns (uint256, uint256)\\r\\n    {\\r\\n        // totalReserves + actualAddAmount\\r\\n        uint256 totalReservesNew;\\r\\n        uint256 actualAddAmount;\\r\\n\\r\\n        // We fail gracefully unless market's block number equals current block number\\r\\n        if (accrualBlockNumber != getBlockNumber()) {\\r\\n            revert AddReservesFactorFreshCheck(actualAddAmount);\\r\\n        }\\r\\n\\r\\n        /////////////////////////\\r\\n        // EFFECTS & INTERACTIONS\\r\\n        // (No safe failures beyond this point)\\r\\n\\r\\n        /*\\r\\n         * We call doTransferIn for the caller and the addAmount\\r\\n         *  Note: The cToken must handle variations between ERC-20 and ETH underlying.\\r\\n         *  On success, the cToken holds an additional addAmount of cash.\\r\\n         *  doTransferIn reverts if anything goes wrong, since we can't be sure if side effects occurred.\\r\\n         *  it returns the amount actually transferred, in case of a fee.\\r\\n         */\\r\\n\\r\\n        actualAddAmount = doTransferIn(msg.sender, addAmount);\\r\\n\\r\\n        totalReservesNew = totalReserves + actualAddAmount;\\r\\n\\r\\n        // Store reserves[n+1] = reserves[n] + actualAddAmount\\r\\n        totalReserves = totalReservesNew;\\r\\n\\r\\n        /* Emit NewReserves(admin, actualAddAmount, reserves[n+1]) */\\r\\n        emit ReservesAdded(msg.sender, actualAddAmount, totalReservesNew);\\r\\n\\r\\n        /* Return (NO_ERROR, actualAddAmount) */\\r\\n        return (NO_ERROR, actualAddAmount);\\r\\n    }\\r\\n\\r\\n    /**\\r\\n     * @notice Accrues interest and reduces reserves by transferring to admin\\r\\n     * @param reduceAmount Amount of reduction to reserves\\r\\n     * @return uint 0=success, otherwise a failure (see ErrorReporter.sol for details)\\r\\n     */\\r\\n    function _reduceReserves(uint256 reduceAmount)\\r\\n        external\\r\\n        override\\r\\n        nonReentrant\\r\\n        returns (uint256)\\r\\n    {\\r\\n        accrueInterest();\\r\\n        // _reduceReservesFresh emits reserve-reduction-specific logs on errors, so we don't need to.\\r\\n        return _reduceReservesFresh(reduceAmount);\\r\\n    }\\r\\n\\r\\n    /**\\r\\n     * @notice Reduces reserves by transferring to admin\\r\\n     * @dev Requires fresh interest accrual\\r\\n     * @param reduceAmount Amount of reduction to reserves\\r\\n     * @return uint 0=success, otherwise a failure (see ErrorReporter.sol for details)\\r\\n     */\\r\\n    function _reduceReservesFresh(uint256 reduceAmount)\\r\\n        internal\\r\\n        returns (uint256)\\r\\n    {\\r\\n        // totalReserves - reduceAmount\\r\\n        uint256 totalReservesNew;\\r\\n\\r\\n        // Check caller is admin\\r\\n        if (msg.sender != admin) {\\r\\n            revert ReduceReservesAdminCheck();\\r\\n        }\\r\\n\\r\\n        // We fail gracefully unless market's block number equals current block number\\r\\n        if (accrualBlockNumber != getBlockNumber()) {\\r\\n            revert ReduceReservesFreshCheck();\\r\\n        }\\r\\n\\r\\n        // Fail gracefully if protocol has insufficient underlying cash\\r\\n        if (getCashPrior() < reduceAmount) {\\r\\n            revert ReduceReservesCashNotAvailable();\\r\\n        }\\r\\n\\r\\n        // Check reduceAmount \\u2264 reserves[n] (totalReserves)\\r\\n        if (reduceAmount > totalReserves) {\\r\\n            revert ReduceReservesCashValidation();\\r\\n        }\\r\\n\\r\\n        /////////////////////////\\r\\n        // EFFECTS & INTERACTIONS\\r\\n        // (No safe failures beyond this point)\\r\\n\\r\\n        totalReservesNew = totalReserves - reduceAmount;\\r\\n\\r\\n        // Store reserves[n+1] = reserves[n] - reduceAmount\\r\\n        totalReserves = totalReservesNew;\\r\\n\\r\\n        // doTransferOut reverts if anything goes wrong, since we can't be sure if side effects occurred.\\r\\n        doTransferOut(admin, reduceAmount);\\r\\n\\r\\n        emit ReservesReduced(admin, reduceAmount, totalReservesNew);\\r\\n\\r\\n        return NO_ERROR;\\r\\n    }\\r\\n\\r\\n    /**\\r\\n     * @notice accrues interest and updates the interest rate model using _setInterestRateModelFresh\\r\\n     * @dev Admin function to accrue interest and update the interest rate model\\r\\n     * @param newInterestRateModel the new interest rate model to use\\r\\n     * @return uint 0=success, otherwise a failure (see ErrorReporter.sol for details)\\r\\n     */\\r\\n    function _setInterestRateModel(InterestRateModel newInterestRateModel)\\r\\n        public\\r\\n        override\\r\\n        returns (uint256)\\r\\n    {\\r\\n        accrueInterest();\\r\\n        // _setInterestRateModelFresh emits interest-rate-model-update-specific logs on errors, so we don't need to.\\r\\n        return _setInterestRateModelFresh(newInterestRateModel);\\r\\n    }\\r\\n\\r\\n    /**\\r\\n     * @notice updates the interest rate model (*requires fresh interest accrual)\\r\\n     * @dev Admin function to update the interest rate model\\r\\n     * @param newInterestRateModel the new interest rate model to use\\r\\n     * @return uint 0=success, otherwise a failure (see ErrorReporter.sol for details)\\r\\n     */\\r\\n    function _setInterestRateModelFresh(InterestRateModel newInterestRateModel)\\r\\n        internal\\r\\n        returns (uint256)\\r\\n    {\\r\\n        // Used to store old model for use in the event that is emitted on success\\r\\n        InterestRateModel oldInterestRateModel;\\r\\n\\r\\n        // Check caller is admin\\r\\n        if (msg.sender != admin) {\\r\\n            revert SetInterestRateModelOwnerCheck();\\r\\n        }\\r\\n\\r\\n        // We fail gracefully unless market's block number equals current block number\\r\\n        if (accrualBlockNumber != getBlockNumber()) {\\r\\n            revert SetInterestRateModelFreshCheck();\\r\\n        }\\r\\n\\r\\n        // Track the market's current interest rate model\\r\\n        oldInterestRateModel = interestRateModel;\\r\\n\\r\\n        // Ensure invoke newInterestRateModel.isInterestRateModel() returns true\\r\\n        require(\\r\\n            newInterestRateModel.isInterestRateModel(),\\r\\n            \\\"marker method returned false\\\"\\r\\n        );\\r\\n\\r\\n        // Set the interest rate model to newInterestRateModel\\r\\n        interestRateModel = newInterestRateModel;\\r\\n\\r\\n        // Emit NewMarketInterestRateModel(oldInterestRateModel, newInterestRateModel)\\r\\n        emit NewMarketInterestRateModel(\\r\\n            oldInterestRateModel,\\r\\n            newInterestRateModel\\r\\n        );\\r\\n\\r\\n        return NO_ERROR;\\r\\n    }\\r\\n\\r\\n    /*** Safe Token ***/\\r\\n\\r\\n    /**\\r\\n     * @notice Gets balance of this contract in terms of the underlying\\r\\n     * @dev This excludes the value of the current message, if any\\r\\n     * @return The quantity of underlying owned by this contract\\r\\n     */\\r\\n    function getCashPrior() internal view virtual returns (uint256);\\r\\n\\r\\n    /**\\r\\n     * @dev Performs a transfer in, reverting upon failure. Returns the amount actually transferred to the protocol, in case of a fee.\\r\\n     *  This may revert due to insufficient balance or insufficient allowance.\\r\\n     */\\r\\n    function doTransferIn(address from, uint256 amount)\\r\\n        internal\\r\\n        virtual\\r\\n        returns (uint256);\\r\\n\\r\\n    /**\\r\\n     * @dev Performs a transfer out, ideally returning an explanatory error code upon failure rather than reverting.\\r\\n     *  If caller has not called checked protocol's balance, may revert due to insufficient cash held in the contract.\\r\\n     *  If caller has checked protocol's balance, and verified it is >= amount, this should not revert in normal conditions.\\r\\n     */\\r\\n    function doTransferOut(address payable to, uint256 amount) internal virtual;\\r\\n\\r\\n    /*** Reentrancy Guard ***/\\r\\n\\r\\n    /**\\r\\n     * @dev Prevents a contract from calling itself, directly or indirectly.\\r\\n     */\\r\\n    modifier nonReentrant() {\\r\\n        require(_notEntered, \\\"re-entered\\\");\\r\\n        _notEntered = false;\\r\\n        _;\\r\\n        _notEntered = true; // get a gas-refund post-Istanbul\\r\\n    }\\r\\n}\\r\\n\",\"keccak256\":\"0xccfd28f61bbdf109f815c7f2671e22b2b0f9c878d6d1502644728e61b217bca1\",\"license\":\"BSD-3-Clause\"},\"contracts/CTokenInterfaces.sol\":{\"content\":\"// SPDX-License-Identifier: BSD-3-Clause\\r\\npragma solidity ^0.8.10;\\r\\n\\r\\nimport \\\"./ComptrollerInterface.sol\\\";\\r\\nimport \\\"./InterestRateModel.sol\\\";\\r\\nimport \\\"./EIP20NonStandardInterface.sol\\\";\\r\\nimport \\\"./ErrorReporter.sol\\\";\\r\\n\\r\\ncontract CTokenStorage {\\r\\n    /**\\r\\n     * @dev Guard variable for re-entrancy checks\\r\\n     */\\r\\n    bool internal _notEntered;\\r\\n\\r\\n    /**\\r\\n     * @notice EIP-20 token name for this token\\r\\n     */\\r\\n    string public name;\\r\\n\\r\\n    /**\\r\\n     * @notice EIP-20 token symbol for this token\\r\\n     */\\r\\n    string public symbol;\\r\\n\\r\\n    /**\\r\\n     * @notice EIP-20 token decimals for this token\\r\\n     */\\r\\n    uint8 public decimals;\\r\\n\\r\\n    // Maximum borrow rate that can ever be applied (.00004% / block)\\r\\n    uint internal constant borrowRateMaxMantissa = 0.00004e16;\\r\\n\\r\\n    // Maximum fraction of interest that can be set aside for reserves\\r\\n    uint internal constant reserveFactorMaxMantissa = 1e18;\\r\\n\\r\\n    /**\\r\\n     * @notice Administrator for this contract\\r\\n     */\\r\\n    address payable public admin;\\r\\n\\r\\n    /**\\r\\n     * @notice Pending administrator for this contract\\r\\n     */\\r\\n    address payable public pendingAdmin;\\r\\n\\r\\n    /**\\r\\n     * @notice Contract which oversees inter-cToken operations\\r\\n     */\\r\\n    ComptrollerInterface public comptroller;\\r\\n\\r\\n    /**\\r\\n     * @notice Model which tells what the current interest rate should be\\r\\n     */\\r\\n    InterestRateModel public interestRateModel;\\r\\n\\r\\n    // Initial exchange rate used when minting the first CTokens (used when totalSupply = 0)\\r\\n    uint internal initialExchangeRateMantissa;\\r\\n\\r\\n    /**\\r\\n     * @notice Fraction of interest currently set aside for reserves\\r\\n     */\\r\\n    uint public reserveFactorMantissa;\\r\\n\\r\\n    /**\\r\\n     * @notice Block number that interest was last accrued at\\r\\n     */\\r\\n    uint public accrualBlockNumber;\\r\\n\\r\\n    /**\\r\\n     * @notice Accumulator of the total earned interest rate since the opening of the market\\r\\n     */\\r\\n    uint public borrowIndex;\\r\\n\\r\\n    /**\\r\\n     * @notice Total amount of outstanding borrows of the underlying in this market\\r\\n     */\\r\\n    uint public totalBorrows;\\r\\n\\r\\n    /**\\r\\n     * @notice Total amount of reserves of the underlying held in this market\\r\\n     */\\r\\n    uint public totalReserves;\\r\\n\\r\\n    /**\\r\\n     * @notice Total number of tokens in circulation\\r\\n     */\\r\\n    uint public totalSupply;\\r\\n\\r\\n    // Official record of token balances for each account\\r\\n    mapping (address => uint) internal accountTokens;\\r\\n\\r\\n    // Approved token transfer amounts on behalf of others\\r\\n    mapping (address => mapping (address => uint)) internal transferAllowances;\\r\\n\\r\\n    /**\\r\\n     * @notice Container for borrow balance information\\r\\n     * @member principal Total balance (with accrued interest), after applying the most recent balance-changing action\\r\\n     * @member interestIndex Global borrowIndex as of the most recent balance-changing action\\r\\n     */\\r\\n    struct BorrowSnapshot {\\r\\n        uint principal;\\r\\n        uint interestIndex;\\r\\n    }\\r\\n\\r\\n    // Mapping of account addresses to outstanding borrow balances\\r\\n    mapping(address => BorrowSnapshot) internal accountBorrows;\\r\\n\\r\\n    /**\\r\\n     * @notice Share of seized collateral that is added to reserves\\r\\n     */\\r\\n    uint public constant protocolSeizeShareMantissa = 2.8e16; //2.8%\\r\\n}\\r\\n\\r\\nabstract contract CTokenInterface is CTokenStorage {\\r\\n    /**\\r\\n     * @notice Indicator that this is a CToken contract (for inspection)\\r\\n     */\\r\\n    bool public constant isCToken = true;\\r\\n\\r\\n\\r\\n    /*** Market Events ***/\\r\\n\\r\\n    /**\\r\\n     * @notice Event emitted when interest is accrued\\r\\n     */\\r\\n    event AccrueInterest(uint cashPrior, uint interestAccumulated, uint borrowIndex, uint totalBorrows);\\r\\n\\r\\n    /**\\r\\n     * @notice Event emitted when tokens are minted\\r\\n     */\\r\\n    event Mint(address minter, uint mintAmount, uint mintTokens);\\r\\n\\r\\n    /**\\r\\n     * @notice Event emitted when tokens are redeemed\\r\\n     */\\r\\n    event Redeem(address redeemer, uint redeemAmount, uint redeemTokens);\\r\\n\\r\\n    /**\\r\\n     * @notice Event emitted when underlying is borrowed\\r\\n     */\\r\\n    event Borrow(address borrower, uint borrowAmount, uint accountBorrows, uint totalBorrows);\\r\\n\\r\\n    /**\\r\\n     * @notice Event emitted when a borrow is repaid\\r\\n     */\\r\\n    event RepayBorrow(address payer, address borrower, uint repayAmount, uint accountBorrows, uint totalBorrows);\\r\\n\\r\\n    /**\\r\\n     * @notice Event emitted when a borrow is liquidated\\r\\n     */\\r\\n    event LiquidateBorrow(address liquidator, address borrower, uint repayAmount, address cTokenCollateral, uint seizeTokens);\\r\\n\\r\\n\\r\\n    /*** Admin Events ***/\\r\\n\\r\\n    /**\\r\\n     * @notice Event emitted when pendingAdmin is changed\\r\\n     */\\r\\n    event NewPendingAdmin(address oldPendingAdmin, address newPendingAdmin);\\r\\n\\r\\n    /**\\r\\n     * @notice Event emitted when pendingAdmin is accepted, which means admin is updated\\r\\n     */\\r\\n    event NewAdmin(address oldAdmin, address newAdmin);\\r\\n\\r\\n    /**\\r\\n     * @notice Event emitted when comptroller is changed\\r\\n     */\\r\\n    event NewComptroller(ComptrollerInterface oldComptroller, ComptrollerInterface newComptroller);\\r\\n\\r\\n    /**\\r\\n     * @notice Event emitted when interestRateModel is changed\\r\\n     */\\r\\n    event NewMarketInterestRateModel(InterestRateModel oldInterestRateModel, InterestRateModel newInterestRateModel);\\r\\n\\r\\n    /**\\r\\n     * @notice Event emitted when the reserve factor is changed\\r\\n     */\\r\\n    event NewReserveFactor(uint oldReserveFactorMantissa, uint newReserveFactorMantissa);\\r\\n\\r\\n    /**\\r\\n     * @notice Event emitted when the reserves are added\\r\\n     */\\r\\n    event ReservesAdded(address benefactor, uint addAmount, uint newTotalReserves);\\r\\n\\r\\n    /**\\r\\n     * @notice Event emitted when the reserves are reduced\\r\\n     */\\r\\n    event ReservesReduced(address admin, uint reduceAmount, uint newTotalReserves);\\r\\n\\r\\n    /**\\r\\n     * @notice EIP20 Transfer event\\r\\n     */\\r\\n    event Transfer(address indexed from, address indexed to, uint amount);\\r\\n\\r\\n    /**\\r\\n     * @notice EIP20 Approval event\\r\\n     */\\r\\n    event Approval(address indexed owner, address indexed spender, uint amount);\\r\\n\\r\\n\\r\\n    /*** User Interface ***/\\r\\n\\r\\n    function transfer(address dst, uint amount) virtual external returns (bool);\\r\\n    function transferFrom(address src, address dst, uint amount) virtual external returns (bool);\\r\\n    function approve(address spender, uint amount) virtual external returns (bool);\\r\\n    function allowance(address owner, address spender) virtual external view returns (uint);\\r\\n    function balanceOf(address owner) virtual external view returns (uint);\\r\\n    function balanceOfUnderlying(address owner) virtual external returns (uint);\\r\\n    function getAccountSnapshot(address account) virtual external view returns (uint, uint, uint, uint);\\r\\n    function borrowRatePerBlock() virtual external view returns (uint);\\r\\n    function supplyRatePerBlock() virtual external view returns (uint);\\r\\n    function totalBorrowsCurrent() virtual external returns (uint);\\r\\n    function borrowBalanceCurrent(address account) virtual external returns (uint);\\r\\n    function borrowBalanceStored(address account) virtual external view returns (uint);\\r\\n    function exchangeRateCurrent() virtual external returns (uint);\\r\\n    function exchangeRateStored() virtual external view returns (uint);\\r\\n    function getCash() virtual external view returns (uint);\\r\\n    function accrueInterest() virtual external returns (uint);\\r\\n    function seize(address liquidator, address borrower, uint seizeTokens) virtual external returns (uint);\\r\\n\\r\\n\\r\\n    /*** Admin Functions ***/\\r\\n\\r\\n    function _setPendingAdmin(address payable newPendingAdmin) virtual external returns (uint);\\r\\n    function _acceptAdmin() virtual external returns (uint);\\r\\n    function _setComptroller(ComptrollerInterface newComptroller) virtual external returns (uint);\\r\\n    function _setReserveFactor(uint newReserveFactorMantissa) virtual external returns (uint);\\r\\n    function _reduceReserves(uint reduceAmount) virtual external returns (uint);\\r\\n    function _setInterestRateModel(InterestRateModel newInterestRateModel) virtual external returns (uint);\\r\\n}\\r\\n\\r\\ncontract CErc20Storage {\\r\\n    /**\\r\\n     * @notice Underlying asset for this CToken\\r\\n     */\\r\\n    address public underlying;\\r\\n}\\r\\n\\r\\nabstract contract CErc20Interface is CErc20Storage {\\r\\n\\r\\n    /*** User Interface ***/\\r\\n\\r\\n    function mint(uint mintAmount) virtual external returns (uint);\\r\\n    function redeem(uint redeemTokens) virtual external returns (uint);\\r\\n    function redeemUnderlying(uint redeemAmount) virtual external returns (uint);\\r\\n    function borrow(uint borrowAmount) virtual external returns (uint);\\r\\n    function repayBorrow(uint repayAmount) virtual external returns (uint);\\r\\n    function repayBorrowBehalf(address borrower, uint repayAmount) virtual external returns (uint);\\r\\n    function liquidateBorrow(address borrower, uint repayAmount, CTokenInterface cTokenCollateral) virtual external returns (uint);\\r\\n    function sweepToken(EIP20NonStandardInterface token) virtual external;\\r\\n\\r\\n\\r\\n    /*** Admin Functions ***/\\r\\n\\r\\n    function _addReserves(uint addAmount) virtual external returns (uint);\\r\\n}\\r\\n\\r\\ncontract CDelegationStorage {\\r\\n    /**\\r\\n     * @notice Implementation address for this contract\\r\\n     */\\r\\n    address public implementation;\\r\\n}\\r\\n\\r\\nabstract contract CDelegatorInterface is CDelegationStorage {\\r\\n    /**\\r\\n     * @notice Emitted when implementation is changed\\r\\n     */\\r\\n    event NewImplementation(address oldImplementation, address newImplementation);\\r\\n\\r\\n    /**\\r\\n     * @notice Called by the admin to update the implementation of the delegator\\r\\n     * @param implementation_ The address of the new implementation for delegation\\r\\n     * @param allowResign Flag to indicate whether to call _resignImplementation on the old implementation\\r\\n     * @param becomeImplementationData The encoded bytes data to be passed to _becomeImplementation\\r\\n     */\\r\\n    function _setImplementation(address implementation_, bool allowResign, bytes memory becomeImplementationData) virtual external;\\r\\n}\\r\\n\\r\\nabstract contract CDelegateInterface is CDelegationStorage {\\r\\n    /**\\r\\n     * @notice Called by the delegator on a delegate to initialize it for duty\\r\\n     * @dev Should revert if any issues arise which make it unfit for delegation\\r\\n     * @param data The encoded bytes data for any initialization\\r\\n     */\\r\\n    function _becomeImplementation(bytes memory data) virtual external;\\r\\n\\r\\n    /**\\r\\n     * @notice Called by the delegator on a delegate to forfeit its responsibility\\r\\n     */\\r\\n    function _resignImplementation() virtual external;\\r\\n}\\r\\n\",\"keccak256\":\"0xb8a954ad43ef40d3ef7f3b0cc0786e1fb346a8cbed0c7e760d83ab796bbae0a1\",\"license\":\"BSD-3-Clause\"},\"contracts/ComptrollerInterface.sol\":{\"content\":\"// SPDX-License-Identifier: BSD-3-Clause\\r\\npragma solidity ^0.8.10;\\r\\n\\r\\nabstract contract ComptrollerInterface {\\r\\n    /// @notice Indicator that this is a Comptroller contract (for inspection)\\r\\n    bool public constant isComptroller = true;\\r\\n\\r\\n    /*** Assets You Are In ***/\\r\\n\\r\\n    function enterMarkets(address[] calldata cTokens) virtual external returns (uint[] memory);\\r\\n    function exitMarket(address cToken) virtual external returns (uint);\\r\\n\\r\\n    /*** Policy Hooks ***/\\r\\n\\r\\n    function mintAllowed(address cToken, address minter, uint mintAmount) virtual external returns (uint);\\r\\n    function mintVerify(address cToken, address minter, uint mintAmount, uint mintTokens) virtual external;\\r\\n\\r\\n    function redeemAllowed(address cToken, address redeemer, uint redeemTokens) virtual external returns (uint);\\r\\n    function redeemVerify(address cToken, address redeemer, uint redeemAmount, uint redeemTokens) virtual external;\\r\\n\\r\\n    function borrowAllowed(address cToken, address borrower, uint borrowAmount) virtual external returns (uint);\\r\\n    function borrowVerify(address cToken, address borrower, uint borrowAmount) virtual external;\\r\\n\\r\\n    function repayBorrowAllowed(\\r\\n        address cToken,\\r\\n        address payer,\\r\\n        address borrower,\\r\\n        uint repayAmount) virtual external returns (uint);\\r\\n    function repayBorrowVerify(\\r\\n        address cToken,\\r\\n        address payer,\\r\\n        address borrower,\\r\\n        uint repayAmount,\\r\\n        uint borrowerIndex) virtual external;\\r\\n\\r\\n    function liquidateBorrowAllowed(\\r\\n        address cTokenBorrowed,\\r\\n        address cTokenCollateral,\\r\\n        address liquidator,\\r\\n        address borrower,\\r\\n        uint repayAmount) virtual external returns (uint);\\r\\n    function liquidateBorrowVerify(\\r\\n        address cTokenBorrowed,\\r\\n        address cTokenCollateral,\\r\\n        address liquidator,\\r\\n        address borrower,\\r\\n        uint repayAmount,\\r\\n        uint seizeTokens) virtual external;\\r\\n\\r\\n    function seizeAllowed(\\r\\n        address cTokenCollateral,\\r\\n        address cTokenBorrowed,\\r\\n        address liquidator,\\r\\n        address borrower,\\r\\n        uint seizeTokens) virtual external returns (uint);\\r\\n    function seizeVerify(\\r\\n        address cTokenCollateral,\\r\\n        address cTokenBorrowed,\\r\\n        address liquidator,\\r\\n        address borrower,\\r\\n        uint seizeTokens) virtual external;\\r\\n\\r\\n    function transferAllowed(address cToken, address src, address dst, uint transferTokens) virtual external returns (uint);\\r\\n    function transferVerify(address cToken, address src, address dst, uint transferTokens) virtual external;\\r\\n\\r\\n    /*** Liquidity/Liquidation Calculations ***/\\r\\n\\r\\n    function liquidateCalculateSeizeTokens(\\r\\n        address cTokenBorrowed,\\r\\n        address cTokenCollateral,\\r\\n        uint repayAmount) virtual external view returns (uint, uint);\\r\\n}\\r\\n\",\"keccak256\":\"0x35b21331eeb8adcbe6c81ef059f467051db884d42a5816c9254ad5df33e1ddc1\",\"license\":\"BSD-3-Clause\"},\"contracts/EIP20Interface.sol\":{\"content\":\"// SPDX-License-Identifier: BSD-3-Clause\\r\\npragma solidity ^0.8.10;\\r\\n\\r\\n/**\\r\\n * @title ERC 20 Token Standard Interface\\r\\n *  https://eips.ethereum.org/EIPS/eip-20\\r\\n */\\r\\ninterface EIP20Interface {\\r\\n    function name() external view returns (string memory);\\r\\n    function symbol() external view returns (string memory);\\r\\n    function decimals() external view returns (uint8);\\r\\n\\r\\n    /**\\r\\n      * @notice Get the total number of tokens in circulation\\r\\n      * @return The supply of tokens\\r\\n      */\\r\\n    function totalSupply() external view returns (uint256);\\r\\n\\r\\n    /**\\r\\n     * @notice Gets the balance of the specified address\\r\\n     * @param owner The address from which the balance will be retrieved\\r\\n     * @return balance The balance\\r\\n     */\\r\\n    function balanceOf(address owner) external view returns (uint256 balance);\\r\\n\\r\\n    /**\\r\\n      * @notice Transfer `amount` tokens from `msg.sender` to `dst`\\r\\n      * @param dst The address of the destination account\\r\\n      * @param amount The number of tokens to transfer\\r\\n      * @return success Whether or not the transfer succeeded\\r\\n      */\\r\\n    function transfer(address dst, uint256 amount) external returns (bool success);\\r\\n\\r\\n    /**\\r\\n      * @notice Transfer `amount` tokens from `src` to `dst`\\r\\n      * @param src The address of the source account\\r\\n      * @param dst The address of the destination account\\r\\n      * @param amount The number of tokens to transfer\\r\\n      * @return success Whether or not the transfer succeeded\\r\\n      */\\r\\n    function transferFrom(address src, address dst, uint256 amount) external returns (bool success);\\r\\n\\r\\n    /**\\r\\n      * @notice Approve `spender` to transfer up to `amount` from `src`\\r\\n      * @dev This will overwrite the approval amount for `spender`\\r\\n      *  and is subject to issues noted [here](https://eips.ethereum.org/EIPS/eip-20#approve)\\r\\n      * @param spender The address of the account which may transfer tokens\\r\\n      * @param amount The number of tokens that are approved (-1 means infinite)\\r\\n      * @return success Whether or not the approval succeeded\\r\\n      */\\r\\n    function approve(address spender, uint256 amount) external returns (bool success);\\r\\n\\r\\n    /**\\r\\n      * @notice Get the current allowance from `owner` for `spender`\\r\\n      * @param owner The address of the account which owns the tokens to be spent\\r\\n      * @param spender The address of the account which may transfer tokens\\r\\n      * @return remaining The number of tokens allowed to be spent (-1 means infinite)\\r\\n      */\\r\\n    function allowance(address owner, address spender) external view returns (uint256 remaining);\\r\\n\\r\\n    event Transfer(address indexed from, address indexed to, uint256 amount);\\r\\n    event Approval(address indexed owner, address indexed spender, uint256 amount);\\r\\n}\\r\\n\",\"keccak256\":\"0x6766042a407f17e340589ec7c0205456ddb83db990fe917586cbaec8e381e506\",\"license\":\"BSD-3-Clause\"},\"contracts/EIP20NonStandardInterface.sol\":{\"content\":\"// SPDX-License-Identifier: BSD-3-Clause\\r\\npragma solidity ^0.8.10;\\r\\n\\r\\n/**\\r\\n * @title EIP20NonStandardInterface\\r\\n * @dev Version of ERC20 with no return values for `transfer` and `transferFrom`\\r\\n *  See https://medium.com/coinmonks/missing-return-value-bug-at-least-130-tokens-affected-d67bf08521ca\\r\\n */\\r\\ninterface EIP20NonStandardInterface {\\r\\n\\r\\n    /**\\r\\n     * @notice Get the total number of tokens in circulation\\r\\n     * @return The supply of tokens\\r\\n     */\\r\\n    function totalSupply() external view returns (uint256);\\r\\n\\r\\n    /**\\r\\n     * @notice Gets the balance of the specified address\\r\\n     * @param owner The address from which the balance will be retrieved\\r\\n     * @return balance The balance\\r\\n     */\\r\\n    function balanceOf(address owner) external view returns (uint256 balance);\\r\\n\\r\\n    ///\\r\\n    /// !!!!!!!!!!!!!!\\r\\n    /// !!! NOTICE !!! `transfer` does not return a value, in violation of the ERC-20 specification\\r\\n    /// !!!!!!!!!!!!!!\\r\\n    ///\\r\\n\\r\\n    /**\\r\\n      * @notice Transfer `amount` tokens from `msg.sender` to `dst`\\r\\n      * @param dst The address of the destination account\\r\\n      * @param amount The number of tokens to transfer\\r\\n      */\\r\\n    function transfer(address dst, uint256 amount) external;\\r\\n\\r\\n    ///\\r\\n    /// !!!!!!!!!!!!!!\\r\\n    /// !!! NOTICE !!! `transferFrom` does not return a value, in violation of the ERC-20 specification\\r\\n    /// !!!!!!!!!!!!!!\\r\\n    ///\\r\\n\\r\\n    /**\\r\\n      * @notice Transfer `amount` tokens from `src` to `dst`\\r\\n      * @param src The address of the source account\\r\\n      * @param dst The address of the destination account\\r\\n      * @param amount The number of tokens to transfer\\r\\n      */\\r\\n    function transferFrom(address src, address dst, uint256 amount) external;\\r\\n\\r\\n    /**\\r\\n      * @notice Approve `spender` to transfer up to `amount` from `src`\\r\\n      * @dev This will overwrite the approval amount for `spender`\\r\\n      *  and is subject to issues noted [here](https://eips.ethereum.org/EIPS/eip-20#approve)\\r\\n      * @param spender The address of the account which may transfer tokens\\r\\n      * @param amount The number of tokens that are approved\\r\\n      * @return success Whether or not the approval succeeded\\r\\n      */\\r\\n    function approve(address spender, uint256 amount) external returns (bool success);\\r\\n\\r\\n    /**\\r\\n      * @notice Get the current allowance from `owner` for `spender`\\r\\n      * @param owner The address of the account which owns the tokens to be spent\\r\\n      * @param spender The address of the account which may transfer tokens\\r\\n      * @return remaining The number of tokens allowed to be spent\\r\\n      */\\r\\n    function allowance(address owner, address spender) external view returns (uint256 remaining);\\r\\n\\r\\n    event Transfer(address indexed from, address indexed to, uint256 amount);\\r\\n    event Approval(address indexed owner, address indexed spender, uint256 amount);\\r\\n}\\r\\n\",\"keccak256\":\"0xc73640b236e5f5993d48ea7b8607c1825d700b852fe3fbc2bc07112b62bd249e\",\"license\":\"BSD-3-Clause\"},\"contracts/ErrorReporter.sol\":{\"content\":\"// SPDX-License-Identifier: BSD-3-Clause\\r\\npragma solidity ^0.8.10;\\r\\n\\r\\ncontract ComptrollerErrorReporter {\\r\\n    enum Error {\\r\\n        NO_ERROR,\\r\\n        UNAUTHORIZED,\\r\\n        COMPTROLLER_MISMATCH,\\r\\n        INSUFFICIENT_SHORTFALL,\\r\\n        INSUFFICIENT_LIQUIDITY,\\r\\n        INVALID_CLOSE_FACTOR,\\r\\n        INVALID_COLLATERAL_FACTOR,\\r\\n        INVALID_LIQUIDATION_INCENTIVE,\\r\\n        MARKET_NOT_ENTERED, // no longer possible\\r\\n        MARKET_NOT_LISTED,\\r\\n        MARKET_ALREADY_LISTED,\\r\\n        MATH_ERROR,\\r\\n        NONZERO_BORROW_BALANCE,\\r\\n        PRICE_ERROR,\\r\\n        REJECTION,\\r\\n        SNAPSHOT_ERROR,\\r\\n        TOO_MANY_ASSETS,\\r\\n        TOO_MUCH_REPAY\\r\\n    }\\r\\n\\r\\n    enum FailureInfo {\\r\\n        ACCEPT_ADMIN_PENDING_ADMIN_CHECK,\\r\\n        ACCEPT_PENDING_IMPLEMENTATION_ADDRESS_CHECK,\\r\\n        EXIT_MARKET_BALANCE_OWED,\\r\\n        EXIT_MARKET_REJECTION,\\r\\n        SET_CLOSE_FACTOR_OWNER_CHECK,\\r\\n        SET_CLOSE_FACTOR_VALIDATION,\\r\\n        SET_COLLATERAL_FACTOR_OWNER_CHECK,\\r\\n        SET_COLLATERAL_FACTOR_NO_EXISTS,\\r\\n        SET_COLLATERAL_FACTOR_VALIDATION,\\r\\n        SET_COLLATERAL_FACTOR_WITHOUT_PRICE,\\r\\n        SET_IMPLEMENTATION_OWNER_CHECK,\\r\\n        SET_LIQUIDATION_INCENTIVE_OWNER_CHECK,\\r\\n        SET_LIQUIDATION_INCENTIVE_VALIDATION,\\r\\n        SET_MAX_ASSETS_OWNER_CHECK,\\r\\n        SET_PENDING_ADMIN_OWNER_CHECK,\\r\\n        SET_PENDING_IMPLEMENTATION_OWNER_CHECK,\\r\\n        SET_PRICE_ORACLE_OWNER_CHECK,\\r\\n        SUPPORT_MARKET_EXISTS,\\r\\n        SUPPORT_MARKET_OWNER_CHECK,\\r\\n        SET_PAUSE_GUARDIAN_OWNER_CHECK\\r\\n    }\\r\\n\\r\\n    /**\\r\\n      * @dev `error` corresponds to enum Error; `info` corresponds to enum FailureInfo, and `detail` is an arbitrary\\r\\n      * contract-specific code that enables us to report opaque error codes from upgradeable contracts.\\r\\n      **/\\r\\n    event Failure(uint error, uint info, uint detail);\\r\\n\\r\\n    /**\\r\\n      * @dev use this when reporting a known error from the money market or a non-upgradeable collaborator\\r\\n      */\\r\\n    function fail(Error err, FailureInfo info) internal returns (uint) {\\r\\n        emit Failure(uint(err), uint(info), 0);\\r\\n\\r\\n        return uint(err);\\r\\n    }\\r\\n\\r\\n    /**\\r\\n      * @dev use this when reporting an opaque error from an upgradeable collaborator contract\\r\\n      */\\r\\n    function failOpaque(Error err, FailureInfo info, uint opaqueError) internal returns (uint) {\\r\\n        emit Failure(uint(err), uint(info), opaqueError);\\r\\n\\r\\n        return uint(err);\\r\\n    }\\r\\n}\\r\\n\\r\\ncontract TokenErrorReporter {\\r\\n    uint public constant NO_ERROR = 0; // support legacy return codes\\r\\n\\r\\n    error TransferComptrollerRejection(uint256 errorCode);\\r\\n    error TransferNotAllowed();\\r\\n    error TransferNotEnough();\\r\\n    error TransferTooMuch();\\r\\n\\r\\n    error MintComptrollerRejection(uint256 errorCode);\\r\\n    error MintFreshnessCheck();\\r\\n\\r\\n    error RedeemComptrollerRejection(uint256 errorCode);\\r\\n    error RedeemFreshnessCheck();\\r\\n    error RedeemTransferOutNotPossible();\\r\\n\\r\\n    error BorrowComptrollerRejection(uint256 errorCode);\\r\\n    error BorrowFreshnessCheck();\\r\\n    error BorrowCashNotAvailable();\\r\\n\\r\\n    error RepayBorrowComptrollerRejection(uint256 errorCode);\\r\\n    error RepayBorrowFreshnessCheck();\\r\\n\\r\\n    error LiquidateComptrollerRejection(uint256 errorCode);\\r\\n    error LiquidateFreshnessCheck();\\r\\n    error LiquidateCollateralFreshnessCheck();\\r\\n    error LiquidateAccrueBorrowInterestFailed(uint256 errorCode);\\r\\n    error LiquidateAccrueCollateralInterestFailed(uint256 errorCode);\\r\\n    error LiquidateLiquidatorIsBorrower();\\r\\n    error LiquidateCloseAmountIsZero();\\r\\n    error LiquidateCloseAmountIsUintMax();\\r\\n    error LiquidateRepayBorrowFreshFailed(uint256 errorCode);\\r\\n\\r\\n    error LiquidateSeizeComptrollerRejection(uint256 errorCode);\\r\\n    error LiquidateSeizeLiquidatorIsBorrower();\\r\\n\\r\\n    error AcceptAdminPendingAdminCheck();\\r\\n\\r\\n    error SetComptrollerOwnerCheck();\\r\\n    error SetPendingAdminOwnerCheck();\\r\\n\\r\\n    error SetReserveFactorAdminCheck();\\r\\n    error SetReserveFactorFreshCheck();\\r\\n    error SetReserveFactorBoundsCheck();\\r\\n\\r\\n    error AddReservesFactorFreshCheck(uint256 actualAddAmount);\\r\\n\\r\\n    error ReduceReservesAdminCheck();\\r\\n    error ReduceReservesFreshCheck();\\r\\n    error ReduceReservesCashNotAvailable();\\r\\n    error ReduceReservesCashValidation();\\r\\n\\r\\n    error SetInterestRateModelOwnerCheck();\\r\\n    error SetInterestRateModelFreshCheck();\\r\\n}\\r\\n\",\"keccak256\":\"0x3f8fa3350921f633b45a9312a90b3375db3c6844dca40daaf8256ab4f32d902c\",\"license\":\"BSD-3-Clause\"},\"contracts/ExponentialNoError.sol\":{\"content\":\"// SPDX-License-Identifier: BSD-3-Clause\\r\\npragma solidity ^0.8.10;\\r\\n\\r\\n/**\\r\\n * @title Exponential module for storing fixed-precision decimals\\r\\n * @author Compound\\r\\n * @notice Exp is a struct which stores decimals with a fixed precision of 18 decimal places.\\r\\n *         Thus, if we wanted to store the 5.1, mantissa would store 5.1e18. That is:\\r\\n *         `Exp({mantissa: 5100000000000000000})`.\\r\\n */\\r\\ncontract ExponentialNoError {\\r\\n    uint constant expScale = 1e18;\\r\\n    uint constant doubleScale = 1e36;\\r\\n    uint constant halfExpScale = expScale/2;\\r\\n    uint constant mantissaOne = expScale;\\r\\n\\r\\n    struct Exp {\\r\\n        uint mantissa;\\r\\n    }\\r\\n\\r\\n    struct Double {\\r\\n        uint mantissa;\\r\\n    }\\r\\n\\r\\n    /**\\r\\n     * @dev Truncates the given exp to a whole number value.\\r\\n     *      For example, truncate(Exp{mantissa: 15 * expScale}) = 15\\r\\n     */\\r\\n    function truncate(Exp memory exp) pure internal returns (uint) {\\r\\n        // Note: We are not using careful math here as we're performing a division that cannot fail\\r\\n        return exp.mantissa / expScale;\\r\\n    }\\r\\n\\r\\n    /**\\r\\n     * @dev Multiply an Exp by a scalar, then truncate to return an unsigned integer.\\r\\n     */\\r\\n    function mul_ScalarTruncate(Exp memory a, uint scalar) pure internal returns (uint) {\\r\\n        Exp memory product = mul_(a, scalar);\\r\\n        return truncate(product);\\r\\n    }\\r\\n\\r\\n    /**\\r\\n     * @dev Multiply an Exp by a scalar, truncate, then add an to an unsigned integer, returning an unsigned integer.\\r\\n     */\\r\\n    function mul_ScalarTruncateAddUInt(Exp memory a, uint scalar, uint addend) pure internal returns (uint) {\\r\\n        Exp memory product = mul_(a, scalar);\\r\\n        return add_(truncate(product), addend);\\r\\n    }\\r\\n\\r\\n    /**\\r\\n     * @dev Checks if first Exp is less than second Exp.\\r\\n     */\\r\\n    function lessThanExp(Exp memory left, Exp memory right) pure internal returns (bool) {\\r\\n        return left.mantissa < right.mantissa;\\r\\n    }\\r\\n\\r\\n    /**\\r\\n     * @dev Checks if left Exp <= right Exp.\\r\\n     */\\r\\n    function lessThanOrEqualExp(Exp memory left, Exp memory right) pure internal returns (bool) {\\r\\n        return left.mantissa <= right.mantissa;\\r\\n    }\\r\\n\\r\\n    /**\\r\\n     * @dev Checks if left Exp > right Exp.\\r\\n     */\\r\\n    function greaterThanExp(Exp memory left, Exp memory right) pure internal returns (bool) {\\r\\n        return left.mantissa > right.mantissa;\\r\\n    }\\r\\n\\r\\n    /**\\r\\n     * @dev returns true if Exp is exactly zero\\r\\n     */\\r\\n    function isZeroExp(Exp memory value) pure internal returns (bool) {\\r\\n        return value.mantissa == 0;\\r\\n    }\\r\\n\\r\\n    function safe224(uint n, string memory errorMessage) pure internal returns (uint224) {\\r\\n        require(n < 2**224, errorMessage);\\r\\n        return uint224(n);\\r\\n    }\\r\\n\\r\\n    function safe32(uint n, string memory errorMessage) pure internal returns (uint32) {\\r\\n        require(n < 2**32, errorMessage);\\r\\n        return uint32(n);\\r\\n    }\\r\\n\\r\\n    function add_(Exp memory a, Exp memory b) pure internal returns (Exp memory) {\\r\\n        return Exp({mantissa: add_(a.mantissa, b.mantissa)});\\r\\n    }\\r\\n\\r\\n    function add_(Double memory a, Double memory b) pure internal returns (Double memory) {\\r\\n        return Double({mantissa: add_(a.mantissa, b.mantissa)});\\r\\n    }\\r\\n\\r\\n    function add_(uint a, uint b) pure internal returns (uint) {\\r\\n        return a + b;\\r\\n    }\\r\\n\\r\\n    function sub_(Exp memory a, Exp memory b) pure internal returns (Exp memory) {\\r\\n        return Exp({mantissa: sub_(a.mantissa, b.mantissa)});\\r\\n    }\\r\\n\\r\\n    function sub_(Double memory a, Double memory b) pure internal returns (Double memory) {\\r\\n        return Double({mantissa: sub_(a.mantissa, b.mantissa)});\\r\\n    }\\r\\n\\r\\n    function sub_(uint a, uint b) pure internal returns (uint) {\\r\\n        return a - b;\\r\\n    }\\r\\n\\r\\n    function mul_(Exp memory a, Exp memory b) pure internal returns (Exp memory) {\\r\\n        return Exp({mantissa: mul_(a.mantissa, b.mantissa) / expScale});\\r\\n    }\\r\\n\\r\\n    function mul_(Exp memory a, uint b) pure internal returns (Exp memory) {\\r\\n        return Exp({mantissa: mul_(a.mantissa, b)});\\r\\n    }\\r\\n\\r\\n    function mul_(uint a, Exp memory b) pure internal returns (uint) {\\r\\n        return mul_(a, b.mantissa) / expScale;\\r\\n    }\\r\\n\\r\\n    function mul_(Double memory a, Double memory b) pure internal returns (Double memory) {\\r\\n        return Double({mantissa: mul_(a.mantissa, b.mantissa) / doubleScale});\\r\\n    }\\r\\n\\r\\n    function mul_(Double memory a, uint b) pure internal returns (Double memory) {\\r\\n        return Double({mantissa: mul_(a.mantissa, b)});\\r\\n    }\\r\\n\\r\\n    function mul_(uint a, Double memory b) pure internal returns (uint) {\\r\\n        return mul_(a, b.mantissa) / doubleScale;\\r\\n    }\\r\\n\\r\\n    function mul_(uint a, uint b) pure internal returns (uint) {\\r\\n        return a * b;\\r\\n    }\\r\\n\\r\\n    function div_(Exp memory a, Exp memory b) pure internal returns (Exp memory) {\\r\\n        return Exp({mantissa: div_(mul_(a.mantissa, expScale), b.mantissa)});\\r\\n    }\\r\\n\\r\\n    function div_(Exp memory a, uint b) pure internal returns (Exp memory) {\\r\\n        return Exp({mantissa: div_(a.mantissa, b)});\\r\\n    }\\r\\n\\r\\n    function div_(uint a, Exp memory b) pure internal returns (uint) {\\r\\n        return div_(mul_(a, expScale), b.mantissa);\\r\\n    }\\r\\n\\r\\n    function div_(Double memory a, Double memory b) pure internal returns (Double memory) {\\r\\n        return Double({mantissa: div_(mul_(a.mantissa, doubleScale), b.mantissa)});\\r\\n    }\\r\\n\\r\\n    function div_(Double memory a, uint b) pure internal returns (Double memory) {\\r\\n        return Double({mantissa: div_(a.mantissa, b)});\\r\\n    }\\r\\n\\r\\n    function div_(uint a, Double memory b) pure internal returns (uint) {\\r\\n        return div_(mul_(a, doubleScale), b.mantissa);\\r\\n    }\\r\\n\\r\\n    function div_(uint a, uint b) pure internal returns (uint) {\\r\\n        return a / b;\\r\\n    }\\r\\n\\r\\n    function fraction(uint a, uint b) pure internal returns (Double memory) {\\r\\n        return Double({mantissa: div_(mul_(a, doubleScale), b)});\\r\\n    }\\r\\n}\\r\\n\",\"keccak256\":\"0x37e1a38f9d77e12761f079a277904f2fd20b80fb79da9f5854851fefe1b5d358\",\"license\":\"BSD-3-Clause\"},\"contracts/IBlastPoints.sol\":{\"content\":\"pragma solidity ^0.8.10;\\n\\nenum YieldMode {\\n  AUTOMATIC,\\n  VOID,\\n  CLAIMABLE\\n}\\n\\nenum GasMode {\\n    VOID,\\n    CLAIMABLE \\n}\\n\\ninterface IBlastPoints {\\n\\tfunction configurePointsOperator(address operator) external;\\n}\\n\\ninterface IBlast{\\n    // configure\\n    function configureContract(address contractAddress, YieldMode _yield, GasMode gasMode, address governor) external;\\n    function configure(YieldMode _yield, GasMode gasMode, address governor) external;\\n\\n    // base configuration options\\n    function configureClaimableYield() external;\\n    function configureClaimableYieldOnBehalf(address contractAddress) external;\\n    function configureAutomaticYield() external;\\n    function configureAutomaticYieldOnBehalf(address contractAddress) external;\\n    function configureVoidYield() external;\\n    function configureVoidYieldOnBehalf(address contractAddress) external;\\n    function configureClaimableGas() external;\\n    function configureClaimableGasOnBehalf(address contractAddress) external;\\n    function configureVoidGas() external;\\n    function configureVoidGasOnBehalf(address contractAddress) external;\\n    function configureGovernor(address _governor) external;\\n    function configureGovernorOnBehalf(address _newGovernor, address contractAddress) external;\\n\\n    // claim yield\\n    function claimYield(address contractAddress, address recipientOfYield, uint256 amount) external returns (uint256);\\n    function claimAllYield(address contractAddress, address recipientOfYield) external returns (uint256);\\n\\n    // claim gas\\n    function claimAllGas(address contractAddress, address recipientOfGas) external returns (uint256);\\n    function claimGasAtMinClaimRate(address contractAddress, address recipientOfGas, uint256 minClaimRateBips) external returns (uint256);\\n    function claimMaxGas(address contractAddress, address recipientOfGas) external returns (uint256);\\n    function claimGas(address contractAddress, address recipientOfGas, uint256 gasToClaim, uint256 gasSecondsToConsume) external returns (uint256);\\n\\n    // read functions\\n    function readClaimableYield(address contractAddress) external view returns (uint256);\\n    function readYieldConfiguration(address contractAddress) external view returns (uint8);\\n    function readGasParams(address contractAddress) external view returns (uint256 etherSeconds, uint256 etherBalance, uint256 lastUpdated, GasMode);\\n}\\n\\ninterface IERC20Rebasing {\\n  // changes the yield mode of the caller and update the balance\\n  // to reflect the configuration\\n  function configure(YieldMode) external returns (uint256);\\n  // \\\"claimable\\\" yield mode accounts can call this this claim their yield\\n  // to another address\\n  function claim(address recipient, uint256 amount) external returns (uint256);\\n  // read the claimable amount for an account\\n  function getClaimableAmount(address account) external view returns (uint256);\\n}\",\"keccak256\":\"0x54f1d499ad23ec5b569305e738d6b52adb04c5f348d3df48dfe3b5038093f2a4\"},\"contracts/InterestRateModel.sol\":{\"content\":\"// SPDX-License-Identifier: BSD-3-Clause\\r\\npragma solidity ^0.8.10;\\r\\n\\r\\n/**\\r\\n  * @title Compound's InterestRateModel Interface\\r\\n  * @author Compound\\r\\n  */\\r\\nabstract contract InterestRateModel {\\r\\n    /// @notice Indicator that this is an InterestRateModel contract (for inspection)\\r\\n    bool public constant isInterestRateModel = true;\\r\\n\\r\\n    /**\\r\\n      * @notice Calculates the current borrow interest rate per block\\r\\n      * @param cash The total amount of cash the market has\\r\\n      * @param borrows The total amount of borrows the market has outstanding\\r\\n      * @param reserves The total amount of reserves the market has\\r\\n      * @return The borrow rate per block (as a percentage, and scaled by 1e18)\\r\\n      */\\r\\n    function getBorrowRate(uint cash, uint borrows, uint reserves) virtual external view returns (uint);\\r\\n\\r\\n    /**\\r\\n      * @notice Calculates the current supply interest rate per block\\r\\n      * @param cash The total amount of cash the market has\\r\\n      * @param borrows The total amount of borrows the market has outstanding\\r\\n      * @param reserves The total amount of reserves the market has\\r\\n      * @param reserveFactorMantissa The current reserve factor the market has\\r\\n      * @return The supply rate per block (as a percentage, and scaled by 1e18)\\r\\n      */\\r\\n    function getSupplyRate(uint cash, uint borrows, uint reserves, uint reserveFactorMantissa) virtual external view returns (uint);\\r\\n}\\r\\n\",\"keccak256\":\"0xc9165c6470843312db10221c408840d907786ab238156cd22b1e428b9dc93c2a\",\"license\":\"BSD-3-Clause\"}},\"version\":1}",
  "bytecode": "0x60806040523480156200001157600080fd5b50604051620040623803806200406283398101604081905262000034916200092c565b60038054610100600160a81b03191633610100021790556200005b88888888888862000247565b600380546001600160a01b03841661010002610100600160a81b03199091161790556040516336b91f2b60e01b8152732fc95838c71e76ec69ff817983bff17c710f34e0906336b91f2b90620000c49084906004016001600160a01b0391909116815260200190565b600060405180830381600087803b158015620000df57600080fd5b505af1158015620000f4573d6000803e3d6000fd5b505050507343000000000000000000000000000000000000026001600160a01b0316634e606c476040518163ffffffff1660e01b8152600401600060405180830381600087803b1580156200014857600080fd5b505af11580156200015d573d6000803e3d6000fd5b505050507343000000000000000000000000000000000000026001600160a01b031663f098767a6040518163ffffffff1660e01b8152600401600060405180830381600087803b158015620001b157600080fd5b505af1158015620001c6573d6000803e3d6000fd5b5050604051631d70c8d360e31b81526001600160a01b0384166004820152734300000000000000000000000000000000000002925063eb8646989150602401600060405180830381600087803b1580156200022057600080fd5b505af115801562000235573d6000803e3d6000fd5b50505050505050505050505062000a72565b60035461010090046001600160a01b03163314620002b85760405162461bcd60e51b8152602060048201526024808201527f6f6e6c792061646d696e206d617920696e697469616c697a6520746865206d616044820152631c9ad95d60e21b60648201526084015b60405180910390fd5b600954158015620002c95750600a54155b620003235760405162461bcd60e51b815260206004820152602360248201527f6d61726b6574206d6179206f6e6c7920626520696e697469616c697a6564206f6044820152626e636560e81b6064820152608401620002af565b600784905583620003905760405162461bcd60e51b815260206004820152603060248201527f696e697469616c2065786368616e67652072617465206d75737420626520677260448201526f32b0ba32b9103a3430b7103d32b9379760811b6064820152608401620002af565b60006200039d87620004b9565b90508015620003ef5760405162461bcd60e51b815260206004820152601a60248201527f73657474696e6720636f6d7074726f6c6c6572206661696c65640000000000006044820152606401620002af565b42600955670de0b6b3a7640000600a556200040a8662000611565b90508015620004675760405162461bcd60e51b815260206004820152602260248201527f73657474696e6720696e7465726573742072617465206d6f64656c206661696c604482015261195960f21b6064820152608401620002af565b83516200047c9060019060208701906200078e565b508251620004929060029060208601906200078e565b50506003805460ff90921660ff199283161790556000805490911660011790555050505050565b60035460009061010090046001600160a01b03163314620004ed5760405163d219dc1f60e01b815260040160405180910390fd5b60055460408051623f1ee960e11b815290516001600160a01b0392831692851691627e3dd29160048083019260209291908290030181865afa15801562000538573d6000803e3d6000fd5b505050506040513d601f19601f820116820180604052508101906200055e919062000a0a565b620005ac5760405162461bcd60e51b815260206004820152601c60248201527f6d61726b6572206d6574686f642072657475726e65642066616c7365000000006044820152606401620002af565b600580546001600160a01b0319166001600160a01b0385811691821790925560408051928416835260208301919091527f7ac369dbd14fa5ea3f473ed67cc9d598964a77501540ba6751eb0b3decf5870d91015b60405180910390a150600092915050565b600354600090819061010090046001600160a01b03163314620006475760405163407fded560e01b815260040160405180910390fd5b42600954146200066a57604051630be2a5cb60e11b815260040160405180910390fd5b600660009054906101000a90046001600160a01b03169050826001600160a01b0316632191f92a6040518163ffffffff1660e01b8152600401602060405180830381865afa158015620006c1573d6000803e3d6000fd5b505050506040513d601f19601f82011682018060405250810190620006e7919062000a0a565b620007355760405162461bcd60e51b815260206004820152601c60248201527f6d61726b6572206d6574686f642072657475726e65642066616c7365000000006044820152606401620002af565b600680546001600160a01b0319166001600160a01b0385811691821790925560408051928416835260208301919091527fedffc32e068c7c95dfd4bdfd5c4d939a084d6b11c4199eac8436ed234d72f926910162000600565b8280546200079c9062000a35565b90600052602060002090601f016020900481019282620007c057600085556200080b565b82601f10620007db57805160ff19168380011785556200080b565b828001600101855582156200080b579182015b828111156200080b578251825591602001919060010190620007ee565b50620008199291506200081d565b5090565b5b808211156200081957600081556001016200081e565b6001600160a01b03811681146200084a57600080fd5b50565b634e487b7160e01b600052604160045260246000fd5b600082601f8301126200087557600080fd5b81516001600160401b03808211156200089257620008926200084d565b604051601f8301601f19908116603f01168101908282118183101715620008bd57620008bd6200084d565b81604052838152602092508683858801011115620008da57600080fd5b600091505b83821015620008fe5785820183015181830184015290820190620008df565b83821115620009105760008385830101525b9695505050505050565b8051620009278162000834565b919050565b600080600080600080600080610100898b0312156200094a57600080fd5b8851620009578162000834565b60208a01519098506200096a8162000834565b60408a015160608b015191985096506001600160401b03808211156200098f57600080fd5b6200099d8c838d0162000863565b965060808b0151915080821115620009b457600080fd5b50620009c38b828c0162000863565b94505060a089015160ff81168114620009db57600080fd5b9250620009eb60c08a016200091a565b9150620009fb60e08a016200091a565b90509295985092959890939650565b60006020828403121562000a1d57600080fd5b8151801515811462000a2e57600080fd5b9392505050565b600181811c9082168062000a4a57607f821691505b6020821081141562000a6c57634e487b7160e01b600052602260045260246000fd5b50919050565b6135e08062000a826000396000f3fe6080604052600436106102b25760003560e01c806395d89b4111610175578063c5ebeaec116100dc578063f2b3abbd11610095578063f8f9da281161006f578063f8f9da2814610827578063fca7820b1461083c578063fcb641471461085c578063fe9c44ae1461086457600080fd5b8063f2b3abbd146107c2578063f3fdb15a146107e2578063f851a4401461080257600080fd5b8063c5ebeaec146106f4578063cb56c49414610714578063db006a7514610734578063dd62ed3e14610754578063e59746191461079a578063e9c714f2146107ad57600080fd5b8063aae40a2a1161012e578063aae40a2a14610637578063ae9d70b01461064a578063b2a02ff11461065f578063b71d1a0c1461067f578063bd6d894d1461069f578063c37f68e2146106b457600080fd5b806395d89b411461059757806395dd9193146105ac57806399d8c1b4146105cc578063a6afed95146105ec578063a9059cbb14610601578063aa5af0fd1461062157600080fd5b80634576b5db1161021957806369ab3250116101d257806369ab3250146104eb5780636c540baf1461050057806370a082311461051657806373acee981461054c578063852a12e3146105615780638f840ddd1461058157600080fd5b80634576b5db1461045257806347bd3718146104725780634e4d9fea146104885780635fe3b56714610490578063601a0bf1146104b05780636752e702146104d057600080fd5b8063182df0f51161026b578063182df0f51461038457806323b872dd1461039957806326782247146103b9578063313ce567146103f15780633af9e6691461041d5780633b1d21a21461043d57600080fd5b806306fdde03146102c7578063095ea7b3146102f25780631249c58b14610322578063173b99041461032a57806317bfdfbc1461034e57806318160ddd1461036e57600080fd5b366102c2576102c034610879565b005b600080fd5b3480156102d357600080fd5b506102dc6108d1565b6040516102e99190613172565b60405180910390f35b3480156102fe57600080fd5b5061031261030d3660046131dc565b61095f565b60405190151581526020016102e9565b6102c06109cd565b34801561033657600080fd5b5061034060085481565b6040519081526020016102e9565b34801561035a57600080fd5b50610340610369366004613208565b6109d8565b34801561037a57600080fd5b50610340600d5481565b34801561039057600080fd5b50610340610a2b565b3480156103a557600080fd5b506103126103b4366004613225565b610a3a565b3480156103c557600080fd5b506004546103d9906001600160a01b031681565b6040516001600160a01b0390911681526020016102e9565b3480156103fd57600080fd5b5060035461040b9060ff1681565b60405160ff90911681526020016102e9565b34801561042957600080fd5b50610340610438366004613208565b610a8a565b34801561044957600080fd5b50610340610ad0565b34801561045e57600080fd5b5061034061046d366004613208565b610ada565b34801561047e57600080fd5b50610340600b5481565b6102c0610c2c565b34801561049c57600080fd5b506005546103d9906001600160a01b031681565b3480156104bc57600080fd5b506103406104cb366004613266565b610c35565b3480156104dc57600080fd5b50610340666379da05b6000081565b3480156104f757600080fd5b50610340600081565b34801561050c57600080fd5b5061034060095481565b34801561052257600080fd5b50610340610531366004613208565b6001600160a01b03166000908152600e602052604090205490565b34801561055857600080fd5b50610340610c74565b34801561056d57600080fd5b5061034061057c366004613266565b610cbe565b34801561058d57600080fd5b50610340600c5481565b3480156105a357600080fd5b506102dc610cd1565b3480156105b857600080fd5b506103406105c7366004613208565b610cde565b3480156105d857600080fd5b506102c06105e7366004613322565b610cef565b3480156105f857600080fd5b50610340610f4a565b34801561060d57600080fd5b5061031261061c3660046131dc565b611137565b34801561062d57600080fd5b50610340600a5481565b6102c06106453660046133ce565b611186565b34801561065657600080fd5b50610340611195565b34801561066b57600080fd5b5061034061067a366004613225565b61122d565b34801561068b57600080fd5b5061034061069a366004613208565b61127c565b3480156106ab57600080fd5b50610340611309565b3480156106c057600080fd5b506106d46106cf366004613208565b611359565b6040805194855260208501939093529183015260608201526080016102e9565b34801561070057600080fd5b5061034061070f366004613266565b61139a565b34801561072057600080fd5b506102c061072f366004613208565b6113a5565b34801561074057600080fd5b5061034061074f366004613266565b6114e1565b34801561076057600080fd5b5061034061076f3660046133ce565b6001600160a01b039182166000908152600f6020908152604080832093909416825291909152205490565b6102c06107a8366004613208565b6114ec565b3480156107b957600080fd5b506103406114f9565b3480156107ce57600080fd5b506103406107dd366004613208565b611600565b3480156107ee57600080fd5b506006546103d9906001600160a01b031681565b34801561080e57600080fd5b506003546103d99061010090046001600160a01b031681565b34801561083357600080fd5b50610340611614565b34801561084857600080fd5b50610340610857366004613266565b611667565b6103406116a6565b34801561087057600080fd5b50610312600181565b60005460ff166108a45760405162461bcd60e51b815260040161089b90613407565b60405180910390fd5b6000805460ff191690556108b6610f4a565b506108c133826116b1565b506000805460ff19166001179055565b600180546108de9061342b565b80601f016020809104026020016040519081016040528092919081815260200182805461090a9061342b565b80156109575780601f1061092c57610100808354040283529160200191610957565b820191906000526020600020905b81548152906001019060200180831161093a57829003601f168201915b505050505081565b336000818152600f602090815260408083206001600160a01b03871680855292528083208590555191929182907f8c5be1e5ebec7d5bd14f71427d1e84f3dd0314c0f7b2291e5b200ac8c7c3b925906109bb9087815260200190565b60405180910390a35060019392505050565b6109d634610879565b565b6000805460ff166109fb5760405162461bcd60e51b815260040161089b90613407565b6000805460ff19169055610a0d610f4a565b50610a1782610cde565b90506000805460ff19166001179055919050565b6000610a35611867565b905090565b6000805460ff16610a5d5760405162461bcd60e51b815260040161089b90613407565b6000805460ff19168155610a73338686866118d1565b1490506000805460ff191660011790559392505050565b6000806040518060200160405280610aa0611309565b90526001600160a01b0384166000908152600e6020526040902054909150610ac9908290611aff565b9392505050565b6000610a35611b1f565b60035460009061010090046001600160a01b03163314610b0d5760405163d219dc1f60e01b815260040160405180910390fd5b60055460408051623f1ee960e11b815290516001600160a01b0392831692851691627e3dd29160048083019260209291908290030181865afa158015610b57573d6000803e3d6000fd5b505050506040513d601f19601f82011682018060405250810190610b7b9190613460565b610bc75760405162461bcd60e51b815260206004820152601c60248201527f6d61726b6572206d6574686f642072657475726e65642066616c736500000000604482015260640161089b565b600580546001600160a01b0319166001600160a01b0385811691821790925560408051928416835260208301919091527f7ac369dbd14fa5ea3f473ed67cc9d598964a77501540ba6751eb0b3decf5870d91015b60405180910390a150600092915050565b6109d634611b2b565b6000805460ff16610c585760405162461bcd60e51b815260040161089b90613407565b6000805460ff19169055610c6a610f4a565b50610a1782611b7c565b6000805460ff16610c975760405162461bcd60e51b815260040161089b90613407565b6000805460ff19169055610ca9610f4a565b5050600b546000805460ff1916600117905590565b6000610cc982611c97565b506000919050565b600280546108de9061342b565b6000610ce982611cd8565b92915050565b60035461010090046001600160a01b03163314610d5a5760405162461bcd60e51b8152602060048201526024808201527f6f6e6c792061646d696e206d617920696e697469616c697a6520746865206d616044820152631c9ad95d60e21b606482015260840161089b565b600954158015610d6a5750600a54155b610dc25760405162461bcd60e51b815260206004820152602360248201527f6d61726b6574206d6179206f6e6c7920626520696e697469616c697a6564206f6044820152626e636560e81b606482015260840161089b565b600784905583610e2d5760405162461bcd60e51b815260206004820152603060248201527f696e697469616c2065786368616e67652072617465206d75737420626520677260448201526f32b0ba32b9103a3430b7103d32b9379760811b606482015260840161089b565b6000610e3887610ada565b90508015610e885760405162461bcd60e51b815260206004820152601a60248201527f73657474696e6720636f6d7074726f6c6c6572206661696c6564000000000000604482015260640161089b565b42600955670de0b6b3a7640000600a55610ea186611d22565b90508015610efc5760405162461bcd60e51b815260206004820152602260248201527f73657474696e6720696e7465726573742072617465206d6f64656c206661696c604482015261195960f21b606482015260840161089b565b8351610f0f9060019060208701906130e2565b508251610f239060029060208601906130e2565b50506003805460ff90921660ff199283161790556000805490911660011790555050505050565b600954600090429080821415610f635760009250505090565b6000610f6d611b1f565b600b54600c54600a546006546040516315f2405360e01b81526004810186905260248101859052604481018490529495509293919290916000916001600160a01b0316906315f2405390606401602060405180830381865afa158015610fd7573d6000803e3d6000fd5b505050506040513d601f19601f82011682018060405250810190610ffb9190613482565b9050645d21dba0008111156110525760405162461bcd60e51b815260206004820152601c60248201527f626f72726f772072617465206973206162737572646c79206869676800000000604482015260640161089b565b600061105e87896134b1565b9050600061107a60405180602001604052808581525083611e97565b905060006110888288611aff565b9050600061109688836134c8565b905060006110b56040518060200160405280600854815250848a611ec8565b905060006110c485898a611ec8565b60098e9055600a819055600b849055600c839055604080518d815260208101879052908101829052606081018590529091507f4dec04e750ca11537cabcd8a9eab06494de08da3735bc8871cd41250e190bc049060800160405180910390a160009d505050505050505050505050505090565b6000805460ff1661115a5760405162461bcd60e51b815260040161089b90613407565b6000805460ff19168155611170338086866118d1565b1490506000805460ff1916600117905592915050565b611191823483611ee9565b5050565b6006546000906001600160a01b031663b81688166111b1611b1f565b600b54600c546008546040516001600160e01b031960e087901b16815260048101949094526024840192909252604483015260648201526084015b602060405180830381865afa158015611209573d6000803e3d6000fd5b505050506040513d601f19601f82011682018060405250810190610a359190613482565b6000805460ff166112505760405162461bcd60e51b815260040161089b90613407565b6000805460ff1916905561126633858585611fc7565b50600080805460ff191660011790559392505050565b60035460009061010090046001600160a01b031633146112af57604051635cb56c2b60e01b815260040160405180910390fd5b600480546001600160a01b038481166001600160a01b031983168117909355604080519190921680825260208201939093527fca4f2f25d0898edd99413412fb94012f9e54ec8142f9b093e7720646a95b16a99101610c1b565b6000805460ff1661132c5760405162461bcd60e51b815260040161089b90613407565b6000805460ff1916905561133e610f4a565b50611347610a2b565b90506000805460ff1916600117905590565b6001600160a01b0381166000908152600e6020526040812054819081908190819061138387611cd8565b61138b611867565b93509350935093509193509193565b6000610cc982612240565b60035461010090046001600160a01b031633146113f25760405162461bcd60e51b815260206004820152600b60248201526a41646d696e20636865636b60a81b604482015260640161089b565b604051634aa7d2f760e11b81523060048201526001600160a01b03821660248201526002604360981b019063954fa5ee906044016020604051808303816000875af1158015611445573d6000803e3d6000fd5b505050506040513d601f19601f820116820180604052508101906114699190613482565b5060405163430021db60e11b81523060048201526001600160a01b03821660248201526002604360981b019063860043b6906044016020604051808303816000875af11580156114bd573d6000803e3d6000fd5b505050506040513d601f19601f820116820180604052508101906111919190613482565b6000610cc98261227f565b6114f681346122c0565b50565b6004546000906001600160a01b031633141580611514575033155b1561153257604051631ba24f2960e21b815260040160405180910390fd5b60038054600480546001600160a01b03808216610100818102610100600160a81b0319871617968790556001600160a01b031990931690935560408051948390048216808652929095041660208401529290917ff9ffabca9c8276e99321725bcb43fb076a6c66a54b7f21c4e8146d8519b417dc910160405180910390a1600454604080516001600160a01b03808516825290921660208301527fca4f2f25d0898edd99413412fb94012f9e54ec8142f9b093e7720646a95b16a9910160405180910390a160009250505090565b600061160a610f4a565b50610ce982611d22565b6006546000906001600160a01b03166315f24053611630611b1f565b600b54600c546040516001600160e01b031960e086901b1681526004810193909352602483019190915260448201526064016111ec565b6000805460ff1661168a5760405162461bcd60e51b815260040161089b90613407565b6000805460ff1916905561169c610f4a565b50610a1782612312565b6000610a35346123ce565b600554604051634ef4c3e160e01b81526000916001600160a01b031690634ef4c3e1906116e6903090879087906004016134e0565b6020604051808303816000875af1158015611705573d6000803e3d6000fd5b505050506040513d601f19601f820116820180604052508101906117299190613482565b9050801561174d576040516349abd4fd60e01b81526004810182905260240161089b565b426009541461176f576040516338d8859760e01b815260040160405180910390fd5b60006040518060200160405280611784611867565b9052905060006117948585612425565b905060006117a282846124b7565b905080600d546117b291906134c8565b600d556001600160a01b0386166000908152600e60205260409020546117d99082906134c8565b6001600160a01b0387166000908152600e60205260409081902091909155517f4c209b5fc8ad50758f13e2e1088ba56a560dff690a1c6fef26394f4c03821c4f9061182990889085908590613504565b60405180910390a16040518181526001600160a01b03871690309060008051602061358b8339815191529060200160405180910390a3505050505050565b600d546000908061187a57505060075490565b6000611884611b1f565b90506000600c54600b548361189991906134c8565b6118a391906134b1565b90506000836118ba670de0b6b3a764000084613525565b6118c49190613544565b95945050505050565b5090565b6005546040516317b9b84b60e31b81523060048201526001600160a01b038581166024830152848116604483015260648201849052600092839291169063bdcdc258906084016020604051808303816000875af1158015611936573d6000803e3d6000fd5b505050506040513d601f19601f8201168201806040525081019061195a9190613482565b9050801561197e5760405163089d427760e11b81526004810182905260240161089b565b836001600160a01b0316856001600160a01b031614156119b157604051638cd22d1960e01b815260040160405180910390fd5b6000856001600160a01b0316876001600160a01b031614156119d657506000196119fe565b506001600160a01b038086166000908152600f60209081526040808320938a16835292905220545b6000611a0a85836134b1565b6001600160a01b0388166000908152600e602052604081205491925090611a329087906134b1565b6001600160a01b0388166000908152600e602052604081205491925090611a5a9088906134c8565b6001600160a01b03808b166000908152600e6020526040808220869055918b1681522081905590506000198414611ab4576001600160a01b03808a166000908152600f60209081526040808320938e168352929052208390555b876001600160a01b0316896001600160a01b031660008051602061358b83398151915289604051611ae791815260200190565b60405180910390a35060009998505050505050505050565b600080611b0c8484611e97565b9050611b17816124d5565b949350505050565b6000610a3534476134b1565b60005460ff16611b4d5760405162461bcd60e51b815260040161089b90613407565b6000805460ff19169055611b5f610f4a565b50611b6b3333836124ed565b50506000805460ff19166001179055565b600354600090819061010090046001600160a01b03163314611bb157604051630f7e5e6d60e41b815260040160405180910390fd5b4260095414611bd357604051630dff50cb60e41b815260040160405180910390fd5b82611bdc611b1f565b1015611bfb57604051633345e99960e01b815260040160405180910390fd5b600c54831115611c1e576040516378d2980560e11b815260040160405180910390fd5b82600c54611c2c91906134b1565b600c819055600354909150611c4f9061010090046001600160a01b031684612696565b7f3bad0c59cf2f06e7314077049f48a93578cd16f5ef92329f1dab1420a99c177e600360019054906101000a90046001600160a01b03168483604051610c1b93929190613504565b60005460ff16611cb95760405162461bcd60e51b815260040161089b90613407565b6000805460ff19169055611ccb610f4a565b506108c1336000836126d1565b6001600160a01b03811660009081526010602052604081208054611cff5750600092915050565b600a548154600091611d1091613525565b9050816001015481611b179190613544565b600354600090819061010090046001600160a01b03163314611d575760405163407fded560e01b815260040160405180910390fd5b4260095414611d7957604051630be2a5cb60e11b815260040160405180910390fd5b600660009054906101000a90046001600160a01b03169050826001600160a01b0316632191f92a6040518163ffffffff1660e01b8152600401602060405180830381865afa158015611dcf573d6000803e3d6000fd5b505050506040513d601f19601f82011682018060405250810190611df39190613460565b611e3f5760405162461bcd60e51b815260206004820152601c60248201527f6d61726b6572206d6574686f642072657475726e65642066616c736500000000604482015260640161089b565b600680546001600160a01b0319166001600160a01b0385811691821790925560408051928416835260208301919091527fedffc32e068c7c95dfd4bdfd5c4d939a084d6b11c4199eac8436ed234d72f9269101610c1b565b6040805160208101909152600081526040518060200160405280611ebf8560000151856129ae565b90529392505050565b600080611ed58585611e97565b90506118c4611ee3826124d5565b846129ba565b60005460ff16611f0b5760405162461bcd60e51b815260040161089b90613407565b6000805460ff19169055611f1d610f4a565b506000816001600160a01b031663a6afed956040518163ffffffff1660e01b81526004016020604051808303816000875af1158015611f60573d6000803e3d6000fd5b505050506040513d601f19601f82011682018060405250810190611f849190613482565b90508015611fa857604051633eea49b760e11b81526004810182905260240161089b565b611fb4338585856129c6565b50506000805460ff191660011790555050565b60055460405163d02f735160e01b81523060048201526001600160a01b0386811660248301528581166044830152848116606483015260848201849052600092169063d02f73519060a4016020604051808303816000875af1158015612031573d6000803e3d6000fd5b505050506040513d601f19601f820116820180604052508101906120559190613482565b90508015612079576040516363e00e3360e11b81526004810182905260240161089b565b836001600160a01b0316836001600160a01b031614156120ac57604051633a94626760e11b815260040160405180910390fd5b60006120cd836040518060200160405280666379da05b60000815250612e80565b905060006120db82856134b1565b9050600060405180602001604052806120f2611867565b9052905060006121028285611aff565b9050600081600c5461211491906134c8565b600c819055600d5490915061212a9086906134b1565b600d556001600160a01b0388166000908152600e60205260409020546121519088906134b1565b6001600160a01b03808a166000908152600e602052604080822093909355908b16815220546121819085906134c8565b6001600160a01b03808b166000818152600e602052604090819020939093559151908a169060008051602061358b833981519152906121c39088815260200190565b60405180910390a360405185815230906001600160a01b038a169060008051602061358b8339815191529060200160405180910390a37fa91e67c5ea634cd43a12c5a482724b03de01e85ca68702a53d0c2f45cb7c1dc530838360405161222c93929190613504565b60405180910390a150505050505050505050565b60005460ff166122625760405162461bcd60e51b815260040161089b90613407565b6000805460ff19169055612274610f4a565b506108c13382612ea3565b60005460ff166122a15760405162461bcd60e51b815260040161089b90613407565b6000805460ff191690556122b3610f4a565b506108c1338260006126d1565b60005460ff166122e25760405162461bcd60e51b815260040161089b90613407565b6000805460ff191690556122f4610f4a565b506123003383836124ed565b50506000805460ff1916600117905550565b60035460009061010090046001600160a01b0316331461234557604051631205b57b60e11b815260040160405180910390fd5b426009541461236757604051637dfca6b760e11b815260040160405180910390fd5b670de0b6b3a76400008211156123905760405163717220f360e11b815260040160405180910390fd5b600880549083905560408051828152602081018590527faaa68312e2ea9d50e16af5068410ab56e1a1fd06037b1a35664812c30f8214609101610c1b565b6000805460ff166123f15760405162461bcd60e51b815260040161089b90613407565b6000805460ff19169055612403610f4a565b5061240d82613042565b5050600090506000805460ff19166001179055919050565b6000336001600160a01b038416146124715760405162461bcd60e51b815260206004820152600f60248201526e0e6cadcc8cae440dad2e6dac2e8c6d608b1b604482015260640161089b565b8134146124b15760405162461bcd60e51b815260206004820152600e60248201526d0ecc2d8eaca40dad2e6dac2e8c6d60931b604482015260640161089b565b50919050565b6000610ac96124ce84670de0b6b3a76400006129ae565b83516130d6565b8051600090610ce990670de0b6b3a764000090613544565b600554604051631200453160e11b81523060048201526001600160a01b03858116602483015284811660448301526064820184905260009283929116906324008a62906084016020604051808303816000875af1158015612552573d6000803e3d6000fd5b505050506040513d601f19601f820116820180604052508101906125769190613482565b9050801561259a57604051638c81362d60e01b81526004810182905260240161089b565b42600954146125bc5760405163c9021e2f60e01b815260040160405180910390fd5b60006125c785611cd8565b9050600060001985146125da57846125dc565b815b905060006125ea8883612425565b905060006125f882856134b1565b9050600082600b5461260a91906134b1565b6001600160a01b038a8116600081815260106020908152604091829020878155600a54600190910155600b8590558151938f168452830191909152810185905260608101849052608081018290529091507f1a2a22cb034d26d1854bdc6666a5b91fe25efbbb5dcad3b0355478d6f5c362a19060a00160405180910390a1509098975050505050505050565b6040516001600160a01b0383169082156108fc029083906000818181858888f193505050501580156126cc573d6000803e3d6000fd5b505050565b8115806126dc575080155b6127455760405162461bcd60e51b815260206004820152603460248201527f6f6e65206f662072656465656d546f6b656e73496e206f722072656465656d416044820152736d6f756e74496e206d757374206265207a65726f60601b606482015260840161089b565b6000604051806020016040528061275a611867565b90529050600080841561277b578491506127748386611aff565b905061278b565b61278584846124b7565b91508390505b60055460405163eabe7d9160e01b81526000916001600160a01b03169063eabe7d91906127c09030908b9088906004016134e0565b6020604051808303816000875af11580156127df573d6000803e3d6000fd5b505050506040513d601f19601f820116820180604052508101906128039190613482565b905080156128275760405163480f424760e01b81526004810182905260240161089b565b4260095414612849576040516397b5cfcd60e01b815260040160405180910390fd5b81612852611b1f565b1015612871576040516391240a1b60e01b815260040160405180910390fd5b82600d5461287f91906134b1565b600d556001600160a01b0387166000908152600e60205260409020546128a69084906134b1565b6001600160a01b0388166000908152600e60205260409020556128c98783612696565b60405183815230906001600160a01b0389169060008051602061358b8339815191529060200160405180910390a37fe5b754fb1abb7f01b499791d0b820ae3b6af3424ac1c59768edb53f4ec31a92987838560405161292a93929190613504565b60405180910390a16005546040516351dff98960e01b81523060048201526001600160a01b0389811660248301526044820185905260648201869052909116906351dff98990608401600060405180830381600087803b15801561298d57600080fd5b505af11580156129a1573d6000803e3d6000fd5b5050505050505050505050565b6000610ac98284613525565b6000610ac982846134c8565b600554604051632fe3f38f60e11b81523060048201526001600160a01b03838116602483015286811660448301528581166064830152608482018590526000921690635fc7e71e9060a4016020604051808303816000875af1158015612a30573d6000803e3d6000fd5b505050506040513d601f19601f82011682018060405250810190612a549190613482565b90508015612a7857604051630a14d17960e11b81526004810182905260240161089b565b4260095414612a9a576040516380965b1b60e01b815260040160405180910390fd5b42826001600160a01b0316636c540baf6040518163ffffffff1660e01b8152600401602060405180830381865afa158015612ad9573d6000803e3d6000fd5b505050506040513d601f19601f82011682018060405250810190612afd9190613482565b14612b1b57604051631046f38d60e31b815260040160405180910390fd5b846001600160a01b0316846001600160a01b03161415612b4e57604051631bd1a62160e21b815260040160405180910390fd5b82612b6c5760405163d29da7ef60e01b815260040160405180910390fd5b600019831415612b8f57604051635982c5bb60e11b815260040160405180910390fd5b6000612b9c8686866124ed565b60055460405163c488847b60e01b815291925060009182916001600160a01b03169063c488847b90612bd6903090899088906004016134e0565b6040805180830381865afa158015612bf2573d6000803e3d6000fd5b505050506040513d601f19601f82011682018060405250810190612c169190613566565b9150915060008214612c865760405162461bcd60e51b815260206004820152603360248201527f4c49515549444154455f434f4d5054524f4c4c45525f43414c43554c4154455f604482015272105353d5539517d4d152569157d19052531151606a1b606482015260840161089b565b6040516370a0823160e01b81526001600160a01b0388811660048301528291908716906370a0823190602401602060405180830381865afa158015612ccf573d6000803e3d6000fd5b505050506040513d601f19601f82011682018060405250810190612cf39190613482565b1015612d415760405162461bcd60e51b815260206004820152601860248201527f4c49515549444154455f5345495a455f544f4f5f4d5543480000000000000000604482015260640161089b565b6001600160a01b038516301415612d6357612d5e30898984611fc7565b612e1d565b60405163b2a02ff160e01b81526000906001600160a01b0387169063b2a02ff190612d96908c908c9087906004016134e0565b6020604051808303816000875af1158015612db5573d6000803e3d6000fd5b505050506040513d601f19601f82011682018060405250810190612dd99190613482565b14612e1d5760405162461bcd60e51b81526020600482015260146024820152731d1bdad95b881cd95a5e9d5c994819985a5b195960621b604482015260640161089b565b604080516001600160a01b038a811682528981166020830152818301869052871660608201526080810183905290517f298637f684da70674f26509b10f07ec2fbc77a335ab1e7d6215a4b2484d8bb529181900360a00190a15050505050505050565b6000670de0b6b3a7640000612e998484600001516129ae565b610ac99190613544565b60055460405163368f515360e21b81526000916001600160a01b03169063da3d454c90612ed8903090879087906004016134e0565b6020604051808303816000875af1158015612ef7573d6000803e3d6000fd5b505050506040513d601f19601f82011682018060405250810190612f1b9190613482565b90508015612f3f5760405163918db40f60e01b81526004810182905260240161089b565b4260095414612f6157604051630e8d8c6160e21b815260040160405180910390fd5b81612f6a611b1f565b1015612f89576040516348c2588160e01b815260040160405180910390fd5b6000612f9484611cd8565b90506000612fa284836134c8565b9050600084600b54612fb491906134c8565b6001600160a01b0387166000908152601060205260409020838155600a54600190910155600b8190559050612fe98686612696565b604080516001600160a01b038816815260208101879052908101839052606081018290527f13ed6866d4e1ee6da46f845c46d7e54120883d75c5ea9a2dacc1c4ca8984ab809060800160405180910390a1505050505050565b6000808080426009541461306c576040516338acf79960e01b81526004810182905260240161089b565b6130763386612425565b905080600c5461308691906134c8565b915081600c819055507fa91e67c5ea634cd43a12c5a482724b03de01e85ca68702a53d0c2f45cb7c1dc53382846040516130c293929190613504565b60405180910390a160009590945092505050565b6000610ac98284613544565b8280546130ee9061342b565b90600052602060002090601f0160209004810192826131105760008555613156565b82601f1061312957805160ff1916838001178555613156565b82800160010185558215613156579182015b8281111561315657825182559160200191906001019061313b565b506118cd9291505b808211156118cd576000815560010161315e565b600060208083528351808285015260005b8181101561319f57858101830151858201604001528201613183565b818111156131b1576000604083870101525b50601f01601f1916929092016040019392505050565b6001600160a01b03811681146114f657600080fd5b600080604083850312156131ef57600080fd5b82356131fa816131c7565b946020939093013593505050565b60006020828403121561321a57600080fd5b8135610ac9816131c7565b60008060006060848603121561323a57600080fd5b8335613245816131c7565b92506020840135613255816131c7565b929592945050506040919091013590565b60006020828403121561327857600080fd5b5035919050565b634e487b7160e01b600052604160045260246000fd5b600082601f8301126132a657600080fd5b813567ffffffffffffffff808211156132c1576132c161327f565b604051601f8301601f19908116603f011681019082821181831017156132e9576132e961327f565b8160405283815286602085880101111561330257600080fd5b836020870160208301376000602085830101528094505050505092915050565b60008060008060008060c0878903121561333b57600080fd5b8635613346816131c7565b95506020870135613356816131c7565b945060408701359350606087013567ffffffffffffffff8082111561337a57600080fd5b6133868a838b01613295565b9450608089013591508082111561339c57600080fd5b506133a989828a01613295565b92505060a087013560ff811681146133c057600080fd5b809150509295509295509295565b600080604083850312156133e157600080fd5b82356133ec816131c7565b915060208301356133fc816131c7565b809150509250929050565b6020808252600a90820152691c994b595b9d195c995960b21b604082015260600190565b600181811c9082168061343f57607f821691505b602082108114156124b157634e487b7160e01b600052602260045260246000fd5b60006020828403121561347257600080fd5b81518015158114610ac957600080fd5b60006020828403121561349457600080fd5b5051919050565b634e487b7160e01b600052601160045260246000fd5b6000828210156134c3576134c361349b565b500390565b600082198211156134db576134db61349b565b500190565b6001600160a01b039384168152919092166020820152604081019190915260600190565b6001600160a01b039390931683526020830191909152604082015260600190565b600081600019048311821515161561353f5761353f61349b565b500290565b60008261356157634e487b7160e01b600052601260045260246000fd5b500490565b6000806040838503121561357957600080fd5b50508051602090910151909290915056feddf252ad1be2c89b69c2b068fc378daa952ba7f163c4a11628f55a4df523b3efa26469706673582212205ad14a5f2f44e108d85bbe8cf8a1bda4d1ac309b9d830de3203ac2ff4654af7464736f6c634300080a0033",
  "deployedBytecode": "0x6080604052600436106102b25760003560e01c806395d89b4111610175578063c5ebeaec116100dc578063f2b3abbd11610095578063f8f9da281161006f578063f8f9da2814610827578063fca7820b1461083c578063fcb641471461085c578063fe9c44ae1461086457600080fd5b8063f2b3abbd146107c2578063f3fdb15a146107e2578063f851a4401461080257600080fd5b8063c5ebeaec146106f4578063cb56c49414610714578063db006a7514610734578063dd62ed3e14610754578063e59746191461079a578063e9c714f2146107ad57600080fd5b8063aae40a2a1161012e578063aae40a2a14610637578063ae9d70b01461064a578063b2a02ff11461065f578063b71d1a0c1461067f578063bd6d894d1461069f578063c37f68e2146106b457600080fd5b806395d89b411461059757806395dd9193146105ac57806399d8c1b4146105cc578063a6afed95146105ec578063a9059cbb14610601578063aa5af0fd1461062157600080fd5b80634576b5db1161021957806369ab3250116101d257806369ab3250146104eb5780636c540baf1461050057806370a082311461051657806373acee981461054c578063852a12e3146105615780638f840ddd1461058157600080fd5b80634576b5db1461045257806347bd3718146104725780634e4d9fea146104885780635fe3b56714610490578063601a0bf1146104b05780636752e702146104d057600080fd5b8063182df0f51161026b578063182df0f51461038457806323b872dd1461039957806326782247146103b9578063313ce567146103f15780633af9e6691461041d5780633b1d21a21461043d57600080fd5b806306fdde03146102c7578063095ea7b3146102f25780631249c58b14610322578063173b99041461032a57806317bfdfbc1461034e57806318160ddd1461036e57600080fd5b366102c2576102c034610879565b005b600080fd5b3480156102d357600080fd5b506102dc6108d1565b6040516102e99190613172565b60405180910390f35b3480156102fe57600080fd5b5061031261030d3660046131dc565b61095f565b60405190151581526020016102e9565b6102c06109cd565b34801561033657600080fd5b5061034060085481565b6040519081526020016102e9565b34801561035a57600080fd5b50610340610369366004613208565b6109d8565b34801561037a57600080fd5b50610340600d5481565b34801561039057600080fd5b50610340610a2b565b3480156103a557600080fd5b506103126103b4366004613225565b610a3a565b3480156103c557600080fd5b506004546103d9906001600160a01b031681565b6040516001600160a01b0390911681526020016102e9565b3480156103fd57600080fd5b5060035461040b9060ff1681565b60405160ff90911681526020016102e9565b34801561042957600080fd5b50610340610438366004613208565b610a8a565b34801561044957600080fd5b50610340610ad0565b34801561045e57600080fd5b5061034061046d366004613208565b610ada565b34801561047e57600080fd5b50610340600b5481565b6102c0610c2c565b34801561049c57600080fd5b506005546103d9906001600160a01b031681565b3480156104bc57600080fd5b506103406104cb366004613266565b610c35565b3480156104dc57600080fd5b50610340666379da05b6000081565b3480156104f757600080fd5b50610340600081565b34801561050c57600080fd5b5061034060095481565b34801561052257600080fd5b50610340610531366004613208565b6001600160a01b03166000908152600e602052604090205490565b34801561055857600080fd5b50610340610c74565b34801561056d57600080fd5b5061034061057c366004613266565b610cbe565b34801561058d57600080fd5b50610340600c5481565b3480156105a357600080fd5b506102dc610cd1565b3480156105b857600080fd5b506103406105c7366004613208565b610cde565b3480156105d857600080fd5b506102c06105e7366004613322565b610cef565b3480156105f857600080fd5b50610340610f4a565b34801561060d57600080fd5b5061031261061c3660046131dc565b611137565b34801561062d57600080fd5b50610340600a5481565b6102c06106453660046133ce565b611186565b34801561065657600080fd5b50610340611195565b34801561066b57600080fd5b5061034061067a366004613225565b61122d565b34801561068b57600080fd5b5061034061069a366004613208565b61127c565b3480156106ab57600080fd5b50610340611309565b3480156106c057600080fd5b506106d46106cf366004613208565b611359565b6040805194855260208501939093529183015260608201526080016102e9565b34801561070057600080fd5b5061034061070f366004613266565b61139a565b34801561072057600080fd5b506102c061072f366004613208565b6113a5565b34801561074057600080fd5b5061034061074f366004613266565b6114e1565b34801561076057600080fd5b5061034061076f3660046133ce565b6001600160a01b039182166000908152600f6020908152604080832093909416825291909152205490565b6102c06107a8366004613208565b6114ec565b3480156107b957600080fd5b506103406114f9565b3480156107ce57600080fd5b506103406107dd366004613208565b611600565b3480156107ee57600080fd5b506006546103d9906001600160a01b031681565b34801561080e57600080fd5b506003546103d99061010090046001600160a01b031681565b34801561083357600080fd5b50610340611614565b34801561084857600080fd5b50610340610857366004613266565b611667565b6103406116a6565b34801561087057600080fd5b50610312600181565b60005460ff166108a45760405162461bcd60e51b815260040161089b90613407565b60405180910390fd5b6000805460ff191690556108b6610f4a565b506108c133826116b1565b506000805460ff19166001179055565b600180546108de9061342b565b80601f016020809104026020016040519081016040528092919081815260200182805461090a9061342b565b80156109575780601f1061092c57610100808354040283529160200191610957565b820191906000526020600020905b81548152906001019060200180831161093a57829003601f168201915b505050505081565b336000818152600f602090815260408083206001600160a01b03871680855292528083208590555191929182907f8c5be1e5ebec7d5bd14f71427d1e84f3dd0314c0f7b2291e5b200ac8c7c3b925906109bb9087815260200190565b60405180910390a35060019392505050565b6109d634610879565b565b6000805460ff166109fb5760405162461bcd60e51b815260040161089b90613407565b6000805460ff19169055610a0d610f4a565b50610a1782610cde565b90506000805460ff19166001179055919050565b6000610a35611867565b905090565b6000805460ff16610a5d5760405162461bcd60e51b815260040161089b90613407565b6000805460ff19168155610a73338686866118d1565b1490506000805460ff191660011790559392505050565b6000806040518060200160405280610aa0611309565b90526001600160a01b0384166000908152600e6020526040902054909150610ac9908290611aff565b9392505050565b6000610a35611b1f565b60035460009061010090046001600160a01b03163314610b0d5760405163d219dc1f60e01b815260040160405180910390fd5b60055460408051623f1ee960e11b815290516001600160a01b0392831692851691627e3dd29160048083019260209291908290030181865afa158015610b57573d6000803e3d6000fd5b505050506040513d601f19601f82011682018060405250810190610b7b9190613460565b610bc75760405162461bcd60e51b815260206004820152601c60248201527f6d61726b6572206d6574686f642072657475726e65642066616c736500000000604482015260640161089b565b600580546001600160a01b0319166001600160a01b0385811691821790925560408051928416835260208301919091527f7ac369dbd14fa5ea3f473ed67cc9d598964a77501540ba6751eb0b3decf5870d91015b60405180910390a150600092915050565b6109d634611b2b565b6000805460ff16610c585760405162461bcd60e51b815260040161089b90613407565b6000805460ff19169055610c6a610f4a565b50610a1782611b7c565b6000805460ff16610c975760405162461bcd60e51b815260040161089b90613407565b6000805460ff19169055610ca9610f4a565b5050600b546000805460ff1916600117905590565b6000610cc982611c97565b506000919050565b600280546108de9061342b565b6000610ce982611cd8565b92915050565b60035461010090046001600160a01b03163314610d5a5760405162461bcd60e51b8152602060048201526024808201527f6f6e6c792061646d696e206d617920696e697469616c697a6520746865206d616044820152631c9ad95d60e21b606482015260840161089b565b600954158015610d6a5750600a54155b610dc25760405162461bcd60e51b815260206004820152602360248201527f6d61726b6574206d6179206f6e6c7920626520696e697469616c697a6564206f6044820152626e636560e81b606482015260840161089b565b600784905583610e2d5760405162461bcd60e51b815260206004820152603060248201527f696e697469616c2065786368616e67652072617465206d75737420626520677260448201526f32b0ba32b9103a3430b7103d32b9379760811b606482015260840161089b565b6000610e3887610ada565b90508015610e885760405162461bcd60e51b815260206004820152601a60248201527f73657474696e6720636f6d7074726f6c6c6572206661696c6564000000000000604482015260640161089b565b42600955670de0b6b3a7640000600a55610ea186611d22565b90508015610efc5760405162461bcd60e51b815260206004820152602260248201527f73657474696e6720696e7465726573742072617465206d6f64656c206661696c604482015261195960f21b606482015260840161089b565b8351610f0f9060019060208701906130e2565b508251610f239060029060208601906130e2565b50506003805460ff90921660ff199283161790556000805490911660011790555050505050565b600954600090429080821415610f635760009250505090565b6000610f6d611b1f565b600b54600c54600a546006546040516315f2405360e01b81526004810186905260248101859052604481018490529495509293919290916000916001600160a01b0316906315f2405390606401602060405180830381865afa158015610fd7573d6000803e3d6000fd5b505050506040513d601f19601f82011682018060405250810190610ffb9190613482565b9050645d21dba0008111156110525760405162461bcd60e51b815260206004820152601c60248201527f626f72726f772072617465206973206162737572646c79206869676800000000604482015260640161089b565b600061105e87896134b1565b9050600061107a60405180602001604052808581525083611e97565b905060006110888288611aff565b9050600061109688836134c8565b905060006110b56040518060200160405280600854815250848a611ec8565b905060006110c485898a611ec8565b60098e9055600a819055600b849055600c839055604080518d815260208101879052908101829052606081018590529091507f4dec04e750ca11537cabcd8a9eab06494de08da3735bc8871cd41250e190bc049060800160405180910390a160009d505050505050505050505050505090565b6000805460ff1661115a5760405162461bcd60e51b815260040161089b90613407565b6000805460ff19168155611170338086866118d1565b1490506000805460ff1916600117905592915050565b611191823483611ee9565b5050565b6006546000906001600160a01b031663b81688166111b1611b1f565b600b54600c546008546040516001600160e01b031960e087901b16815260048101949094526024840192909252604483015260648201526084015b602060405180830381865afa158015611209573d6000803e3d6000fd5b505050506040513d601f19601f82011682018060405250810190610a359190613482565b6000805460ff166112505760405162461bcd60e51b815260040161089b90613407565b6000805460ff1916905561126633858585611fc7565b50600080805460ff191660011790559392505050565b60035460009061010090046001600160a01b031633146112af57604051635cb56c2b60e01b815260040160405180910390fd5b600480546001600160a01b038481166001600160a01b031983168117909355604080519190921680825260208201939093527fca4f2f25d0898edd99413412fb94012f9e54ec8142f9b093e7720646a95b16a99101610c1b565b6000805460ff1661132c5760405162461bcd60e51b815260040161089b90613407565b6000805460ff1916905561133e610f4a565b50611347610a2b565b90506000805460ff1916600117905590565b6001600160a01b0381166000908152600e6020526040812054819081908190819061138387611cd8565b61138b611867565b93509350935093509193509193565b6000610cc982612240565b60035461010090046001600160a01b031633146113f25760405162461bcd60e51b815260206004820152600b60248201526a41646d696e20636865636b60a81b604482015260640161089b565b604051634aa7d2f760e11b81523060048201526001600160a01b03821660248201526002604360981b019063954fa5ee906044016020604051808303816000875af1158015611445573d6000803e3d6000fd5b505050506040513d601f19601f820116820180604052508101906114699190613482565b5060405163430021db60e11b81523060048201526001600160a01b03821660248201526002604360981b019063860043b6906044016020604051808303816000875af11580156114bd573d6000803e3d6000fd5b505050506040513d601f19601f820116820180604052508101906111919190613482565b6000610cc98261227f565b6114f681346122c0565b50565b6004546000906001600160a01b031633141580611514575033155b1561153257604051631ba24f2960e21b815260040160405180910390fd5b60038054600480546001600160a01b03808216610100818102610100600160a81b0319871617968790556001600160a01b031990931690935560408051948390048216808652929095041660208401529290917ff9ffabca9c8276e99321725bcb43fb076a6c66a54b7f21c4e8146d8519b417dc910160405180910390a1600454604080516001600160a01b03808516825290921660208301527fca4f2f25d0898edd99413412fb94012f9e54ec8142f9b093e7720646a95b16a9910160405180910390a160009250505090565b600061160a610f4a565b50610ce982611d22565b6006546000906001600160a01b03166315f24053611630611b1f565b600b54600c546040516001600160e01b031960e086901b1681526004810193909352602483019190915260448201526064016111ec565b6000805460ff1661168a5760405162461bcd60e51b815260040161089b90613407565b6000805460ff1916905561169c610f4a565b50610a1782612312565b6000610a35346123ce565b600554604051634ef4c3e160e01b81526000916001600160a01b031690634ef4c3e1906116e6903090879087906004016134e0565b6020604051808303816000875af1158015611705573d6000803e3d6000fd5b505050506040513d601f19601f820116820180604052508101906117299190613482565b9050801561174d576040516349abd4fd60e01b81526004810182905260240161089b565b426009541461176f576040516338d8859760e01b815260040160405180910390fd5b60006040518060200160405280611784611867565b9052905060006117948585612425565b905060006117a282846124b7565b905080600d546117b291906134c8565b600d556001600160a01b0386166000908152600e60205260409020546117d99082906134c8565b6001600160a01b0387166000908152600e60205260409081902091909155517f4c209b5fc8ad50758f13e2e1088ba56a560dff690a1c6fef26394f4c03821c4f9061182990889085908590613504565b60405180910390a16040518181526001600160a01b03871690309060008051602061358b8339815191529060200160405180910390a3505050505050565b600d546000908061187a57505060075490565b6000611884611b1f565b90506000600c54600b548361189991906134c8565b6118a391906134b1565b90506000836118ba670de0b6b3a764000084613525565b6118c49190613544565b95945050505050565b5090565b6005546040516317b9b84b60e31b81523060048201526001600160a01b038581166024830152848116604483015260648201849052600092839291169063bdcdc258906084016020604051808303816000875af1158015611936573d6000803e3d6000fd5b505050506040513d601f19601f8201168201806040525081019061195a9190613482565b9050801561197e5760405163089d427760e11b81526004810182905260240161089b565b836001600160a01b0316856001600160a01b031614156119b157604051638cd22d1960e01b815260040160405180910390fd5b6000856001600160a01b0316876001600160a01b031614156119d657506000196119fe565b506001600160a01b038086166000908152600f60209081526040808320938a16835292905220545b6000611a0a85836134b1565b6001600160a01b0388166000908152600e602052604081205491925090611a329087906134b1565b6001600160a01b0388166000908152600e602052604081205491925090611a5a9088906134c8565b6001600160a01b03808b166000908152600e6020526040808220869055918b1681522081905590506000198414611ab4576001600160a01b03808a166000908152600f60209081526040808320938e168352929052208390555b876001600160a01b0316896001600160a01b031660008051602061358b83398151915289604051611ae791815260200190565b60405180910390a35060009998505050505050505050565b600080611b0c8484611e97565b9050611b17816124d5565b949350505050565b6000610a3534476134b1565b60005460ff16611b4d5760405162461bcd60e51b815260040161089b90613407565b6000805460ff19169055611b5f610f4a565b50611b6b3333836124ed565b50506000805460ff19166001179055565b600354600090819061010090046001600160a01b03163314611bb157604051630f7e5e6d60e41b815260040160405180910390fd5b4260095414611bd357604051630dff50cb60e41b815260040160405180910390fd5b82611bdc611b1f565b1015611bfb57604051633345e99960e01b815260040160405180910390fd5b600c54831115611c1e576040516378d2980560e11b815260040160405180910390fd5b82600c54611c2c91906134b1565b600c819055600354909150611c4f9061010090046001600160a01b031684612696565b7f3bad0c59cf2f06e7314077049f48a93578cd16f5ef92329f1dab1420a99c177e600360019054906101000a90046001600160a01b03168483604051610c1b93929190613504565b60005460ff16611cb95760405162461bcd60e51b815260040161089b90613407565b6000805460ff19169055611ccb610f4a565b506108c1336000836126d1565b6001600160a01b03811660009081526010602052604081208054611cff5750600092915050565b600a548154600091611d1091613525565b9050816001015481611b179190613544565b600354600090819061010090046001600160a01b03163314611d575760405163407fded560e01b815260040160405180910390fd5b4260095414611d7957604051630be2a5cb60e11b815260040160405180910390fd5b600660009054906101000a90046001600160a01b03169050826001600160a01b0316632191f92a6040518163ffffffff1660e01b8152600401602060405180830381865afa158015611dcf573d6000803e3d6000fd5b505050506040513d601f19601f82011682018060405250810190611df39190613460565b611e3f5760405162461bcd60e51b815260206004820152601c60248201527f6d61726b6572206d6574686f642072657475726e65642066616c736500000000604482015260640161089b565b600680546001600160a01b0319166001600160a01b0385811691821790925560408051928416835260208301919091527fedffc32e068c7c95dfd4bdfd5c4d939a084d6b11c4199eac8436ed234d72f9269101610c1b565b6040805160208101909152600081526040518060200160405280611ebf8560000151856129ae565b90529392505050565b600080611ed58585611e97565b90506118c4611ee3826124d5565b846129ba565b60005460ff16611f0b5760405162461bcd60e51b815260040161089b90613407565b6000805460ff19169055611f1d610f4a565b506000816001600160a01b031663a6afed956040518163ffffffff1660e01b81526004016020604051808303816000875af1158015611f60573d6000803e3d6000fd5b505050506040513d601f19601f82011682018060405250810190611f849190613482565b90508015611fa857604051633eea49b760e11b81526004810182905260240161089b565b611fb4338585856129c6565b50506000805460ff191660011790555050565b60055460405163d02f735160e01b81523060048201526001600160a01b0386811660248301528581166044830152848116606483015260848201849052600092169063d02f73519060a4016020604051808303816000875af1158015612031573d6000803e3d6000fd5b505050506040513d601f19601f820116820180604052508101906120559190613482565b90508015612079576040516363e00e3360e11b81526004810182905260240161089b565b836001600160a01b0316836001600160a01b031614156120ac57604051633a94626760e11b815260040160405180910390fd5b60006120cd836040518060200160405280666379da05b60000815250612e80565b905060006120db82856134b1565b9050600060405180602001604052806120f2611867565b9052905060006121028285611aff565b9050600081600c5461211491906134c8565b600c819055600d5490915061212a9086906134b1565b600d556001600160a01b0388166000908152600e60205260409020546121519088906134b1565b6001600160a01b03808a166000908152600e602052604080822093909355908b16815220546121819085906134c8565b6001600160a01b03808b166000818152600e602052604090819020939093559151908a169060008051602061358b833981519152906121c39088815260200190565b60405180910390a360405185815230906001600160a01b038a169060008051602061358b8339815191529060200160405180910390a37fa91e67c5ea634cd43a12c5a482724b03de01e85ca68702a53d0c2f45cb7c1dc530838360405161222c93929190613504565b60405180910390a150505050505050505050565b60005460ff166122625760405162461bcd60e51b815260040161089b90613407565b6000805460ff19169055612274610f4a565b506108c13382612ea3565b60005460ff166122a15760405162461bcd60e51b815260040161089b90613407565b6000805460ff191690556122b3610f4a565b506108c1338260006126d1565b60005460ff166122e25760405162461bcd60e51b815260040161089b90613407565b6000805460ff191690556122f4610f4a565b506123003383836124ed565b50506000805460ff1916600117905550565b60035460009061010090046001600160a01b0316331461234557604051631205b57b60e11b815260040160405180910390fd5b426009541461236757604051637dfca6b760e11b815260040160405180910390fd5b670de0b6b3a76400008211156123905760405163717220f360e11b815260040160405180910390fd5b600880549083905560408051828152602081018590527faaa68312e2ea9d50e16af5068410ab56e1a1fd06037b1a35664812c30f8214609101610c1b565b6000805460ff166123f15760405162461bcd60e51b815260040161089b90613407565b6000805460ff19169055612403610f4a565b5061240d82613042565b5050600090506000805460ff19166001179055919050565b6000336001600160a01b038416146124715760405162461bcd60e51b815260206004820152600f60248201526e0e6cadcc8cae440dad2e6dac2e8c6d608b1b604482015260640161089b565b8134146124b15760405162461bcd60e51b815260206004820152600e60248201526d0ecc2d8eaca40dad2e6dac2e8c6d60931b604482015260640161089b565b50919050565b6000610ac96124ce84670de0b6b3a76400006129ae565b83516130d6565b8051600090610ce990670de0b6b3a764000090613544565b600554604051631200453160e11b81523060048201526001600160a01b03858116602483015284811660448301526064820184905260009283929116906324008a62906084016020604051808303816000875af1158015612552573d6000803e3d6000fd5b505050506040513d601f19601f820116820180604052508101906125769190613482565b9050801561259a57604051638c81362d60e01b81526004810182905260240161089b565b42600954146125bc5760405163c9021e2f60e01b815260040160405180910390fd5b60006125c785611cd8565b9050600060001985146125da57846125dc565b815b905060006125ea8883612425565b905060006125f882856134b1565b9050600082600b5461260a91906134b1565b6001600160a01b038a8116600081815260106020908152604091829020878155600a54600190910155600b8590558151938f168452830191909152810185905260608101849052608081018290529091507f1a2a22cb034d26d1854bdc6666a5b91fe25efbbb5dcad3b0355478d6f5c362a19060a00160405180910390a1509098975050505050505050565b6040516001600160a01b0383169082156108fc029083906000818181858888f193505050501580156126cc573d6000803e3d6000fd5b505050565b8115806126dc575080155b6127455760405162461bcd60e51b815260206004820152603460248201527f6f6e65206f662072656465656d546f6b656e73496e206f722072656465656d416044820152736d6f756e74496e206d757374206265207a65726f60601b606482015260840161089b565b6000604051806020016040528061275a611867565b90529050600080841561277b578491506127748386611aff565b905061278b565b61278584846124b7565b91508390505b60055460405163eabe7d9160e01b81526000916001600160a01b03169063eabe7d91906127c09030908b9088906004016134e0565b6020604051808303816000875af11580156127df573d6000803e3d6000fd5b505050506040513d601f19601f820116820180604052508101906128039190613482565b905080156128275760405163480f424760e01b81526004810182905260240161089b565b4260095414612849576040516397b5cfcd60e01b815260040160405180910390fd5b81612852611b1f565b1015612871576040516391240a1b60e01b815260040160405180910390fd5b82600d5461287f91906134b1565b600d556001600160a01b0387166000908152600e60205260409020546128a69084906134b1565b6001600160a01b0388166000908152600e60205260409020556128c98783612696565b60405183815230906001600160a01b0389169060008051602061358b8339815191529060200160405180910390a37fe5b754fb1abb7f01b499791d0b820ae3b6af3424ac1c59768edb53f4ec31a92987838560405161292a93929190613504565b60405180910390a16005546040516351dff98960e01b81523060048201526001600160a01b0389811660248301526044820185905260648201869052909116906351dff98990608401600060405180830381600087803b15801561298d57600080fd5b505af11580156129a1573d6000803e3d6000fd5b5050505050505050505050565b6000610ac98284613525565b6000610ac982846134c8565b600554604051632fe3f38f60e11b81523060048201526001600160a01b03838116602483015286811660448301528581166064830152608482018590526000921690635fc7e71e9060a4016020604051808303816000875af1158015612a30573d6000803e3d6000fd5b505050506040513d601f19601f82011682018060405250810190612a549190613482565b90508015612a7857604051630a14d17960e11b81526004810182905260240161089b565b4260095414612a9a576040516380965b1b60e01b815260040160405180910390fd5b42826001600160a01b0316636c540baf6040518163ffffffff1660e01b8152600401602060405180830381865afa158015612ad9573d6000803e3d6000fd5b505050506040513d601f19601f82011682018060405250810190612afd9190613482565b14612b1b57604051631046f38d60e31b815260040160405180910390fd5b846001600160a01b0316846001600160a01b03161415612b4e57604051631bd1a62160e21b815260040160405180910390fd5b82612b6c5760405163d29da7ef60e01b815260040160405180910390fd5b600019831415612b8f57604051635982c5bb60e11b815260040160405180910390fd5b6000612b9c8686866124ed565b60055460405163c488847b60e01b815291925060009182916001600160a01b03169063c488847b90612bd6903090899088906004016134e0565b6040805180830381865afa158015612bf2573d6000803e3d6000fd5b505050506040513d601f19601f82011682018060405250810190612c169190613566565b9150915060008214612c865760405162461bcd60e51b815260206004820152603360248201527f4c49515549444154455f434f4d5054524f4c4c45525f43414c43554c4154455f604482015272105353d5539517d4d152569157d19052531151606a1b606482015260840161089b565b6040516370a0823160e01b81526001600160a01b0388811660048301528291908716906370a0823190602401602060405180830381865afa158015612ccf573d6000803e3d6000fd5b505050506040513d601f19601f82011682018060405250810190612cf39190613482565b1015612d415760405162461bcd60e51b815260206004820152601860248201527f4c49515549444154455f5345495a455f544f4f5f4d5543480000000000000000604482015260640161089b565b6001600160a01b038516301415612d6357612d5e30898984611fc7565b612e1d565b60405163b2a02ff160e01b81526000906001600160a01b0387169063b2a02ff190612d96908c908c9087906004016134e0565b6020604051808303816000875af1158015612db5573d6000803e3d6000fd5b505050506040513d601f19601f82011682018060405250810190612dd99190613482565b14612e1d5760405162461bcd60e51b81526020600482015260146024820152731d1bdad95b881cd95a5e9d5c994819985a5b195960621b604482015260640161089b565b604080516001600160a01b038a811682528981166020830152818301869052871660608201526080810183905290517f298637f684da70674f26509b10f07ec2fbc77a335ab1e7d6215a4b2484d8bb529181900360a00190a15050505050505050565b6000670de0b6b3a7640000612e998484600001516129ae565b610ac99190613544565b60055460405163368f515360e21b81526000916001600160a01b03169063da3d454c90612ed8903090879087906004016134e0565b6020604051808303816000875af1158015612ef7573d6000803e3d6000fd5b505050506040513d601f19601f82011682018060405250810190612f1b9190613482565b90508015612f3f5760405163918db40f60e01b81526004810182905260240161089b565b4260095414612f6157604051630e8d8c6160e21b815260040160405180910390fd5b81612f6a611b1f565b1015612f89576040516348c2588160e01b815260040160405180910390fd5b6000612f9484611cd8565b90506000612fa284836134c8565b9050600084600b54612fb491906134c8565b6001600160a01b0387166000908152601060205260409020838155600a54600190910155600b8190559050612fe98686612696565b604080516001600160a01b038816815260208101879052908101839052606081018290527f13ed6866d4e1ee6da46f845c46d7e54120883d75c5ea9a2dacc1c4ca8984ab809060800160405180910390a1505050505050565b6000808080426009541461306c576040516338acf79960e01b81526004810182905260240161089b565b6130763386612425565b905080600c5461308691906134c8565b915081600c819055507fa91e67c5ea634cd43a12c5a482724b03de01e85ca68702a53d0c2f45cb7c1dc53382846040516130c293929190613504565b60405180910390a160009590945092505050565b6000610ac98284613544565b8280546130ee9061342b565b90600052602060002090601f0160209004810192826131105760008555613156565b82601f1061312957805160ff1916838001178555613156565b82800160010185558215613156579182015b8281111561315657825182559160200191906001019061313b565b506118cd9291505b808211156118cd576000815560010161315e565b600060208083528351808285015260005b8181101561319f57858101830151858201604001528201613183565b818111156131b1576000604083870101525b50601f01601f1916929092016040019392505050565b6001600160a01b03811681146114f657600080fd5b600080604083850312156131ef57600080fd5b82356131fa816131c7565b946020939093013593505050565b60006020828403121561321a57600080fd5b8135610ac9816131c7565b60008060006060848603121561323a57600080fd5b8335613245816131c7565b92506020840135613255816131c7565b929592945050506040919091013590565b60006020828403121561327857600080fd5b5035919050565b634e487b7160e01b600052604160045260246000fd5b600082601f8301126132a657600080fd5b813567ffffffffffffffff808211156132c1576132c161327f565b604051601f8301601f19908116603f011681019082821181831017156132e9576132e961327f565b8160405283815286602085880101111561330257600080fd5b836020870160208301376000602085830101528094505050505092915050565b60008060008060008060c0878903121561333b57600080fd5b8635613346816131c7565b95506020870135613356816131c7565b945060408701359350606087013567ffffffffffffffff8082111561337a57600080fd5b6133868a838b01613295565b9450608089013591508082111561339c57600080fd5b506133a989828a01613295565b92505060a087013560ff811681146133c057600080fd5b809150509295509295509295565b600080604083850312156133e157600080fd5b82356133ec816131c7565b915060208301356133fc816131c7565b809150509250929050565b6020808252600a90820152691c994b595b9d195c995960b21b604082015260600190565b600181811c9082168061343f57607f821691505b602082108114156124b157634e487b7160e01b600052602260045260246000fd5b60006020828403121561347257600080fd5b81518015158114610ac957600080fd5b60006020828403121561349457600080fd5b5051919050565b634e487b7160e01b600052601160045260246000fd5b6000828210156134c3576134c361349b565b500390565b600082198211156134db576134db61349b565b500190565b6001600160a01b039384168152919092166020820152604081019190915260600190565b6001600160a01b039390931683526020830191909152604082015260600190565b600081600019048311821515161561353f5761353f61349b565b500290565b60008261356157634e487b7160e01b600052601260045260246000fd5b500490565b6000806040838503121561357957600080fd5b50508051602090910151909290915056feddf252ad1be2c89b69c2b068fc378daa952ba7f163c4a11628f55a4df523b3efa26469706673582212205ad14a5f2f44e108d85bbe8cf8a1bda4d1ac309b9d830de3203ac2ff4654af7464736f6c634300080a0033",
  "devdoc": {
    "author": "Compound",
    "kind": "dev",
    "methods": {
      "_acceptAdmin()": {
        "details": "Admin function for pending admin to accept role and update admin",
        "returns": {
          "_0": "uint 0=success, otherwise a failure (see ErrorReporter.sol for details)"
        }
      },
      "_addReserves()": {
        "returns": {
          "_0": "uint 0=success, otherwise a failure (see ErrorReporter.sol for details)"
        }
      },
      "_claimAllYields(address)": {
        "params": {
          "_receiver": "Treasury address"
        }
      },
      "_reduceReserves(uint256)": {
        "params": {
          "reduceAmount": "Amount of reduction to reserves"
        },
        "returns": {
          "_0": "uint 0=success, otherwise a failure (see ErrorReporter.sol for details)"
        }
      },
      "_setComptroller(address)": {
        "details": "Admin function to set a new comptroller",
        "returns": {
          "_0": "uint 0=success, otherwise a failure (see ErrorReporter.sol for details)"
        }
      },
      "_setInterestRateModel(address)": {
        "details": "Admin function to accrue interest and update the interest rate model",
        "params": {
          "newInterestRateModel": "the new interest rate model to use"
        },
        "returns": {
          "_0": "uint 0=success, otherwise a failure (see ErrorReporter.sol for details)"
        }
      },
      "_setPendingAdmin(address)": {
        "details": "Admin function to begin change of admin. The newPendingAdmin must call `_acceptAdmin` to finalize the transfer.",
        "params": {
          "newPendingAdmin": "New pending admin."
        },
        "returns": {
          "_0": "uint 0=success, otherwise a failure (see ErrorReporter.sol for details)"
        }
      },
      "_setReserveFactor(uint256)": {
        "details": "Admin function to accrue interest and set a new reserve factor",
        "returns": {
          "_0": "uint 0=success, otherwise a failure (see ErrorReporter.sol for details)"
        }
      },
      "accrueInterest()": {
        "details": "This calculates interest accrued from the last checkpointed block   up to the current block and writes new checkpoint to storage."
      },
      "allowance(address,address)": {
        "params": {
          "owner": "The address of the account which owns the tokens to be spent",
          "spender": "The address of the account which may transfer tokens"
        },
        "returns": {
          "_0": "The number of tokens allowed to be spent (-1 means infinite)"
        }
      },
      "approve(address,uint256)": {
        "details": "This will overwrite the approval amount for `spender`  and is subject to issues noted [here](https://eips.ethereum.org/EIPS/eip-20#approve)",
        "params": {
          "amount": "The number of tokens that are approved (uint256.max means infinite)",
          "spender": "The address of the account which may transfer tokens"
        },
        "returns": {
          "_0": "Whether or not the approval succeeded"
        }
      },
      "balanceOf(address)": {
        "params": {
          "owner": "The address of the account to query"
        },
        "returns": {
          "_0": "The number of tokens owned by `owner`"
        }
      },
      "balanceOfUnderlying(address)": {
        "details": "This also accrues interest in a transaction",
        "params": {
          "owner": "The address of the account to query"
        },
        "returns": {
          "_0": "The amount of underlying owned by `owner`"
        }
      },
      "borrow(uint256)": {
        "params": {
          "borrowAmount": "The amount of the underlying asset to borrow"
        },
        "returns": {
          "_0": "uint 0=success, otherwise a failure (see ErrorReporter.sol for details)"
        }
      },
      "borrowBalanceCurrent(address)": {
        "params": {
          "account": "The address whose balance should be calculated after updating borrowIndex"
        },
        "returns": {
          "_0": "The calculated balance"
        }
      },
      "borrowBalanceStored(address)": {
        "params": {
          "account": "The address whose balance should be calculated"
        },
        "returns": {
          "_0": "The calculated balance"
        }
      },
      "borrowRatePerBlock()": {
        "returns": {
          "_0": "The borrow interest rate per block, scaled by 1e18"
        }
      },
      "constructor": {
        "params": {
          "admin_": "Address of the administrator of this token",
          "comptroller_": "The address of the Comptroller",
          "decimals_": "ERC-20 decimal precision of this token",
          "initialExchangeRateMantissa_": "The initial exchange rate, scaled by 1e18",
          "interestRateModel_": "The address of the interest rate model",
          "name_": "ERC-20 name of this token",
          "symbol_": "ERC-20 symbol of this token"
        }
      },
      "exchangeRateCurrent()": {
        "returns": {
          "_0": "Calculated exchange rate scaled by 1e18"
        }
      },
      "exchangeRateStored()": {
        "details": "This function does not accrue interest before calculating the exchange rate",
        "returns": {
          "_0": "Calculated exchange rate scaled by 1e18"
        }
      },
      "getAccountSnapshot(address)": {
        "details": "This is used by comptroller to more efficiently perform liquidity checks.",
        "params": {
          "account": "Address of the account to snapshot"
        },
        "returns": {
          "_0": "(possible error, token balance, borrow balance, exchange rate mantissa)"
        }
      },
      "getCash()": {
        "returns": {
          "_0": "The quantity of underlying asset owned by this contract"
        }
      },
      "initialize(address,address,uint256,string,string,uint8)": {
        "params": {
          "comptroller_": "The address of the Comptroller",
          "decimals_": "EIP-20 decimal precision of this token",
          "initialExchangeRateMantissa_": "The initial exchange rate, scaled by 1e18",
          "interestRateModel_": "The address of the interest rate model",
          "name_": "EIP-20 name of this token",
          "symbol_": "EIP-20 symbol of this token"
        }
      },
      "liquidateBorrow(address,address)": {
        "details": "Reverts upon any failure",
        "params": {
          "borrower": "The borrower of this cToken to be liquidated",
          "cTokenCollateral": "The market in which to seize collateral from the borrower"
        }
      },
      "mint()": {
        "details": "Reverts upon any failure"
      },
      "redeem(uint256)": {
        "details": "Accrues interest whether or not the operation succeeds, unless reverted",
        "params": {
          "redeemTokens": "The number of cTokens to redeem into underlying"
        },
        "returns": {
          "_0": "uint 0=success, otherwise a failure (see ErrorReporter.sol for details)"
        }
      },
      "redeemUnderlying(uint256)": {
        "details": "Accrues interest whether or not the operation succeeds, unless reverted",
        "params": {
          "redeemAmount": "The amount of underlying to redeem"
        },
        "returns": {
          "_0": "uint 0=success, otherwise a failure (see ErrorReporter.sol for details)"
        }
      },
      "repayBorrow()": {
        "details": "Reverts upon any failure"
      },
      "repayBorrowBehalf(address)": {
        "details": "Reverts upon any failure",
        "params": {
          "borrower": "the account with the debt being payed off"
        }
      },
      "seize(address,address,uint256)": {
        "details": "Will fail unless called by another cToken during the process of liquidation.  Its absolutely critical to use msg.sender as the borrowed cToken and not a parameter.",
        "params": {
          "borrower": "The account having collateral seized",
          "liquidator": "The account receiving seized collateral",
          "seizeTokens": "The number of cTokens to seize"
        },
        "returns": {
          "_0": "uint 0=success, otherwise a failure (see ErrorReporter.sol for details)"
        }
      },
      "supplyRatePerBlock()": {
        "returns": {
          "_0": "The supply interest rate per block, scaled by 1e18"
        }
      },
      "totalBorrowsCurrent()": {
        "returns": {
          "_0": "The total borrows with interest"
        }
      },
      "transfer(address,uint256)": {
        "params": {
          "amount": "The number of tokens to transfer",
          "dst": "The address of the destination account"
        },
        "returns": {
          "_0": "Whether or not the transfer succeeded"
        }
      },
      "transferFrom(address,address,uint256)": {
        "params": {
          "amount": "The number of tokens to transfer",
          "dst": "The address of the destination account",
          "src": "The address of the source account"
        },
        "returns": {
          "_0": "Whether or not the transfer succeeded"
        }
      }
    },
    "title": "Compound's CEther Contract",
    "version": 1
  },
  "userdoc": {
    "events": {
      "AccrueInterest(uint256,uint256,uint256,uint256)": {
        "notice": "Event emitted when interest is accrued"
      },
      "Approval(address,address,uint256)": {
        "notice": "EIP20 Approval event"
      },
      "Borrow(address,uint256,uint256,uint256)": {
        "notice": "Event emitted when underlying is borrowed"
      },
      "LiquidateBorrow(address,address,uint256,address,uint256)": {
        "notice": "Event emitted when a borrow is liquidated"
      },
      "Mint(address,uint256,uint256)": {
        "notice": "Event emitted when tokens are minted"
      },
      "NewAdmin(address,address)": {
        "notice": "Event emitted when pendingAdmin is accepted, which means admin is updated"
      },
      "NewComptroller(address,address)": {
        "notice": "Event emitted when comptroller is changed"
      },
      "NewMarketInterestRateModel(address,address)": {
        "notice": "Event emitted when interestRateModel is changed"
      },
      "NewPendingAdmin(address,address)": {
        "notice": "Event emitted when pendingAdmin is changed"
      },
      "NewReserveFactor(uint256,uint256)": {
        "notice": "Event emitted when the reserve factor is changed"
      },
      "Redeem(address,uint256,uint256)": {
        "notice": "Event emitted when tokens are redeemed"
      },
      "RepayBorrow(address,address,uint256,uint256,uint256)": {
        "notice": "Event emitted when a borrow is repaid"
      },
      "ReservesAdded(address,uint256,uint256)": {
        "notice": "Event emitted when the reserves are added"
      },
      "ReservesReduced(address,uint256,uint256)": {
        "notice": "Event emitted when the reserves are reduced"
      },
      "Transfer(address,address,uint256)": {
        "notice": "EIP20 Transfer event"
      }
    },
    "kind": "user",
    "methods": {
      "_acceptAdmin()": {
        "notice": "Accepts transfer of admin rights. msg.sender must be pendingAdmin"
      },
      "_addReserves()": {
        "notice": "The sender adds to reserves."
      },
      "_claimAllYields(address)": {
        "notice": "Admin only blast integration"
      },
      "_reduceReserves(uint256)": {
        "notice": "Accrues interest and reduces reserves by transferring to admin"
      },
      "_setComptroller(address)": {
        "notice": "Sets a new comptroller for the market"
      },
      "_setInterestRateModel(address)": {
        "notice": "accrues interest and updates the interest rate model using _setInterestRateModelFresh"
      },
      "_setPendingAdmin(address)": {
        "notice": "Begins transfer of admin rights. The newPendingAdmin must call `_acceptAdmin` to finalize the transfer."
      },
      "_setReserveFactor(uint256)": {
        "notice": "accrues interest and sets a new reserve factor for the protocol using _setReserveFactorFresh"
      },
      "accrualBlockNumber()": {
        "notice": "Block number that interest was last accrued at"
      },
      "accrueInterest()": {
        "notice": "Applies accrued interest to total borrows and reserves"
      },
      "admin()": {
        "notice": "Administrator for this contract"
      },
      "allowance(address,address)": {
        "notice": "Get the current allowance from `owner` for `spender`"
      },
      "approve(address,uint256)": {
        "notice": "Approve `spender` to transfer up to `amount` from `src`"
      },
      "balanceOf(address)": {
        "notice": "Get the token balance of the `owner`"
      },
      "balanceOfUnderlying(address)": {
        "notice": "Get the underlying balance of the `owner`"
      },
      "borrow(uint256)": {
        "notice": "Sender borrows assets from the protocol to their own address"
      },
      "borrowBalanceCurrent(address)": {
        "notice": "Accrue interest to updated borrowIndex and then calculate account's borrow balance using the updated borrowIndex"
      },
      "borrowBalanceStored(address)": {
        "notice": "Return the borrow balance of account based on stored data"
      },
      "borrowIndex()": {
        "notice": "Accumulator of the total earned interest rate since the opening of the market"
      },
      "borrowRatePerBlock()": {
        "notice": "Returns the current per-block borrow interest rate for this cToken"
      },
      "comptroller()": {
        "notice": "Contract which oversees inter-cToken operations"
      },
      "constructor": {
        "notice": "Construct a new CEther money market"
      },
      "decimals()": {
        "notice": "EIP-20 token decimals for this token"
      },
      "exchangeRateCurrent()": {
        "notice": "Accrue interest then return the up-to-date exchange rate"
      },
      "exchangeRateStored()": {
        "notice": "Calculates the exchange rate from the underlying to the CToken"
      },
      "getAccountSnapshot(address)": {
        "notice": "Get a snapshot of the account's balances, and the cached exchange rate"
      },
      "getCash()": {
        "notice": "Get cash balance of this cToken in the underlying asset"
      },
      "initialize(address,address,uint256,string,string,uint8)": {
        "notice": "Initialize the money market"
      },
      "interestRateModel()": {
        "notice": "Model which tells what the current interest rate should be"
      },
      "isCToken()": {
        "notice": "Indicator that this is a CToken contract (for inspection)"
      },
      "liquidateBorrow(address,address)": {
        "notice": "The sender liquidates the borrowers collateral.  The collateral seized is transferred to the liquidator."
      },
      "mint()": {
        "notice": "Sender supplies assets into the market and receives cTokens in exchange"
      },
      "name()": {
        "notice": "EIP-20 token name for this token"
      },
      "pendingAdmin()": {
        "notice": "Pending administrator for this contract"
      },
      "protocolSeizeShareMantissa()": {
        "notice": "Share of seized collateral that is added to reserves"
      },
      "redeem(uint256)": {
        "notice": "Sender redeems cTokens in exchange for the underlying asset"
      },
      "redeemUnderlying(uint256)": {
        "notice": "Sender redeems cTokens in exchange for a specified amount of underlying asset"
      },
      "repayBorrow()": {
        "notice": "Sender repays their own borrow"
      },
      "repayBorrowBehalf(address)": {
        "notice": "Sender repays a borrow belonging to borrower"
      },
      "reserveFactorMantissa()": {
        "notice": "Fraction of interest currently set aside for reserves"
      },
      "seize(address,address,uint256)": {
        "notice": "Transfers collateral tokens (this market) to the liquidator."
      },
      "supplyRatePerBlock()": {
        "notice": "Returns the current per-block supply interest rate for this cToken"
      },
      "symbol()": {
        "notice": "EIP-20 token symbol for this token"
      },
      "totalBorrows()": {
        "notice": "Total amount of outstanding borrows of the underlying in this market"
      },
      "totalBorrowsCurrent()": {
        "notice": "Returns the current total borrows plus accrued interest"
      },
      "totalReserves()": {
        "notice": "Total amount of reserves of the underlying held in this market"
      },
      "totalSupply()": {
        "notice": "Total number of tokens in circulation"
      },
      "transfer(address,uint256)": {
        "notice": "Transfer `amount` tokens from `msg.sender` to `dst`"
      },
      "transferFrom(address,address,uint256)": {
        "notice": "Transfer `amount` tokens from `src` to `dst`"
      }
    },
    "notice": "CToken which wraps Ether",
    "version": 1
  },
  "storageLayout": {
    "storage": [
      {
        "astId": 3176,
        "contract": "contracts/CEtherImmutable.sol:CEtherImmutable",
        "label": "_notEntered",
        "offset": 0,
        "slot": "0",
        "type": "t_bool"
      },
      {
        "astId": 3179,
        "contract": "contracts/CEtherImmutable.sol:CEtherImmutable",
        "label": "name",
        "offset": 0,
        "slot": "1",
        "type": "t_string_storage"
      },
      {
        "astId": 3182,
        "contract": "contracts/CEtherImmutable.sol:CEtherImmutable",
        "label": "symbol",
        "offset": 0,
        "slot": "2",
        "type": "t_string_storage"
      },
      {
        "astId": 3185,
        "contract": "contracts/CEtherImmutable.sol:CEtherImmutable",
        "label": "decimals",
        "offset": 0,
        "slot": "3",
        "type": "t_uint8"
      },
      {
        "astId": 3194,
        "contract": "contracts/CEtherImmutable.sol:CEtherImmutable",
        "label": "admin",
        "offset": 1,
        "slot": "3",
        "type": "t_address_payable"
      },
      {
        "astId": 3197,
        "contract": "contracts/CEtherImmutable.sol:CEtherImmutable",
        "label": "pendingAdmin",
        "offset": 0,
        "slot": "4",
        "type": "t_address_payable"
      },
      {
        "astId": 3201,
        "contract": "contracts/CEtherImmutable.sol:CEtherImmutable",
        "label": "comptroller",
        "offset": 0,
        "slot": "5",
        "type": "t_contract(ComptrollerInterface)7988"
      },
      {
        "astId": 3205,
        "contract": "contracts/CEtherImmutable.sol:CEtherImmutable",
        "label": "interestRateModel",
        "offset": 0,
        "slot": "6",
        "type": "t_contract(InterestRateModel)10418"
      },
      {
        "astId": 3207,
        "contract": "contracts/CEtherImmutable.sol:CEtherImmutable",
        "label": "initialExchangeRateMantissa",
        "offset": 0,
        "slot": "7",
        "type": "t_uint256"
      },
      {
        "astId": 3210,
        "contract": "contracts/CEtherImmutable.sol:CEtherImmutable",
        "label": "reserveFactorMantissa",
        "offset": 0,
        "slot": "8",
        "type": "t_uint256"
      },
      {
        "astId": 3213,
        "contract": "contracts/CEtherImmutable.sol:CEtherImmutable",
        "label": "accrualBlockNumber",
        "offset": 0,
        "slot": "9",
        "type": "t_uint256"
      },
      {
        "astId": 3216,
        "contract": "contracts/CEtherImmutable.sol:CEtherImmutable",
        "label": "borrowIndex",
        "offset": 0,
        "slot": "10",
        "type": "t_uint256"
      },
      {
        "astId": 3219,
        "contract": "contracts/CEtherImmutable.sol:CEtherImmutable",
        "label": "totalBorrows",
        "offset": 0,
        "slot": "11",
        "type": "t_uint256"
      },
      {
        "astId": 3222,
        "contract": "contracts/CEtherImmutable.sol:CEtherImmutable",
        "label": "totalReserves",
        "offset": 0,
        "slot": "12",
        "type": "t_uint256"
      },
      {
        "astId": 3225,
        "contract": "contracts/CEtherImmutable.sol:CEtherImmutable",
        "label": "totalSupply",
        "offset": 0,
        "slot": "13",
        "type": "t_uint256"
      },
      {
        "astId": 3229,
        "contract": "contracts/CEtherImmutable.sol:CEtherImmutable",
        "label": "accountTokens",
        "offset": 0,
        "slot": "14",
        "type": "t_mapping(t_address,t_uint256)"
      },
      {
        "astId": 3235,
        "contract": "contracts/CEtherImmutable.sol:CEtherImmutable",
        "label": "transferAllowances",
        "offset": 0,
        "slot": "15",
        "type": "t_mapping(t_address,t_mapping(t_address,t_uint256))"
      },
      {
        "astId": 3245,
        "contract": "contracts/CEtherImmutable.sol:CEtherImmutable",
        "label": "accountBorrows",
        "offset": 0,
        "slot": "16",
        "type": "t_mapping(t_address,t_struct(BorrowSnapshot)3240_storage)"
      }
    ],
    "types": {
      "t_address": {
        "encoding": "inplace",
        "label": "address",
        "numberOfBytes": "20"
      },
      "t_address_payable": {
        "encoding": "inplace",
        "label": "address payable",
        "numberOfBytes": "20"
      },
      "t_bool": {
        "encoding": "inplace",
        "label": "bool",
        "numberOfBytes": "1"
      },
      "t_contract(ComptrollerInterface)7988": {
        "encoding": "inplace",
        "label": "contract ComptrollerInterface",
        "numberOfBytes": "20"
      },
      "t_contract(InterestRateModel)10418": {
        "encoding": "inplace",
        "label": "contract InterestRateModel",
        "numberOfBytes": "20"
      },
      "t_mapping(t_address,t_mapping(t_address,t_uint256))": {
        "encoding": "mapping",
        "key": "t_address",
        "label": "mapping(address => mapping(address => uint256))",
        "numberOfBytes": "32",
        "value": "t_mapping(t_address,t_uint256)"
      },
      "t_mapping(t_address,t_struct(BorrowSnapshot)3240_storage)": {
        "encoding": "mapping",
        "key": "t_address",
        "label": "mapping(address => struct CTokenStorage.BorrowSnapshot)",
        "numberOfBytes": "32",
        "value": "t_struct(BorrowSnapshot)3240_storage"
      },
      "t_mapping(t_address,t_uint256)": {
        "encoding": "mapping",
        "key": "t_address",
        "label": "mapping(address => uint256)",
        "numberOfBytes": "32",
        "value": "t_uint256"
      },
      "t_string_storage": {
        "encoding": "bytes",
        "label": "string",
        "numberOfBytes": "32"
      },
      "t_struct(BorrowSnapshot)3240_storage": {
        "encoding": "inplace",
        "label": "struct CTokenStorage.BorrowSnapshot",
        "members": [
          {
            "astId": 3237,
            "contract": "contracts/CEtherImmutable.sol:CEtherImmutable",
            "label": "principal",
            "offset": 0,
            "slot": "0",
            "type": "t_uint256"
          },
          {
            "astId": 3239,
            "contract": "contracts/CEtherImmutable.sol:CEtherImmutable",
            "label": "interestIndex",
            "offset": 0,
            "slot": "1",
            "type": "t_uint256"
          }
        ],
        "numberOfBytes": "64"
      },
      "t_uint256": {
        "encoding": "inplace",
        "label": "uint256",
        "numberOfBytes": "32"
      },
      "t_uint8": {
        "encoding": "inplace",
        "label": "uint8",
        "numberOfBytes": "1"
      }
    }
  }
}